Relevance,Explanation
PARTLY_RELEVANT,"The generated answer partially matches the context of the original answer. It correctly states that Bajaj Pulsar NS 160 is in the price range below 30 million dong, and it also mentions some of the same models listed in the original answer. However, it rephrases the original question and provides a similar response, without adding any new information or insights. Additionally, the wording and structure of the generated answer are quite similar to the original answer, which makes it difficult to determine whether it's a true generated response or simply a reworded version of the original answer."
RELEVANT,"The generated answer discusses the Honda CB Unicorn 160, mentioning its price range, engine specifications, and features, which is highly relevant to the original answer. The original answer listed Honda CB Unicorn 160 as a motorcycles under 30 million VND, and the generated answer provides detailed information about the motorcycle's specifications and suitability for a budget under 30 million VND."
RELEVANT,"The generated answer is relevant to the original answer as it provides a correct response to the question about whether Toyota has any models in the list of motorcycles under 30 million dong. The answer is identical to the original answer provided, mentioning the list of models and stating that Toyota is not included. The generated answer accurately reflects the content and context of the original answer."
PARTLY_RELEVANT,"The generated answer partially matches the original answer by mentioning the Suzuki Gixxer SP as one of the models listed in the original answer. However, the focus of the generated answer is on refuting the question about it being a cheap model, which is not present in the original answer. The original answer only provides a list of models without evaluating their prices."
PARTLY_RELEVANT,"The generated answer only mentions Hero Achiever 2017, which is a part of the original answer, but does not provide a comprehensive list of motorbikes under 30 million VND, as the original answer does."
RELEVANT,"The generated answer is almost identical to the original answer, with the same information about Raul Mondesi being sentenced to 8 years in prison for corruption. The only minor difference is the repetition of 'cựu thị trưởng' (former mayor) in the generated answer, which does not affect the relevance of the answer."
RELEVANT,"The generated answer is a paraphrased version of the original answer, providing the same information in a slightly different format. Although the wording is changed, the essential information about Raul Mondesi being sentenced to 8 years in prison for corruption is preserved."
RELEVANT,"The generated answer is identical to the original answer, matching the exact sentence in terms of content and structure, indicating that it is highly relevant."
RELEVANT,"The generated answer is mostly relevant to the original answer as it mentions the same benefits of the UltraFlex technology in Petronas Sprinta oil, specifically reducing engine stress and increasing driving experience. The generated answer also adds some additional information about the causes of engine stress, which is still related to the topic. However, it does not provide the same level of detail and specific mentions of the technology's benefits, such as the increased durability of the oil membrane."
RELEVANT,"The generated answer largely matches the original answer in terms of content and structure, with minor differences in wording and phrasing. The main points, such as the benefit of Petronas Sprinta in reducing engine stress, improving driving experience, and increasing vehicle's lifespan, are identical in both answers. The only difference is that the generated answer starts with a rhetorical question that is not present in the original answer, but the answer itself is largely the same."
RELEVANT,"The generated answer is highly relevant to the original answer. It directly addresses the query 'Tỷ lệ bền màng dầu của Petronas Sprinta so với các tiêu chuẩn ngành như thế nào?' and provides a similar explanation as the original answer. The generated answer even reproduces parts of the original answer, including the specific percentage improvement (41%) and the mention of UltraFlex technology."
PARTLY_RELEVANT,"The generated answer accurately identifies the types of stressors that Petronas Sprinta's UltraFlex technology helps the engine withstand, such as ứng suất động cơ, hiệu ứng tải, tốc độ và ứng suất động cơ. However, the generated answer lacks the specific details and metrics provided in the original answer about the benefits of UltraFlex technology, such as the percentage of improved film strength. Additionally, the generated answer does not convey the same level of confidence and emphasis on the technology's capabilities as the original answer."
