Relevance,Explanation
PARTLY_RELEVANT,"The generated answer mentions the Qualcomm Snapdragon 835 chip, which matches the context of the original answer. However, the answer talks about the Quick Charge 4+ feature, which is not directly related to the original answer's focus on the Snapragon 835 processor's capabilities. The answer is partly relevant because it shares the same context but diverges to discuss a different aspect of the chip."
PARTLY_RELEVANT,"The generated answer is partly relevant because it provides additional information about the Qualcomm Snapdragon 835, such as its capabilities and features. However, it does not directly answer the question about how it is perceived on the market. The generated answer focuses more on the technical specifications and details of the processor, whereas the original answer provides context about its reputation and popularity on the market."
RELEVANT,"The generated answer repeats the same information as the original answer, specifically mentioning the Qualcomm Snapdragon 835 processor. The language and structure are also similar, making it a relevant answer."
PARTLY_RELEVANT,"The generated answer partially addresses the original answer by providing additional information about Moto Z2's specifications. However, it misses the core information about the processor, which is the main focus of the original answer. The generated answer also introduces new details not present in the original answer, such as the camera resolution and battery capacity, which are not directly related to the processor chip Snapdragon 835."
PARTLY_RELEVANT,"The generated answer mentions some relevant information about Qualcomm Snapdragon 835, specifically its fast charging feature and heat reduction technology, which are novel and surpassing expectations. However, the original answer primarily focuses on the processor's presence in the Moto Z2, whereas the generated answer focuses on its features and benefits, which is not directly related to the original answer's contextual information."
RELEVANT,"The generated answer is a direct response to the generated question, and its content is identical to a portion of the original answer. The information shared in the generated answer matches the original answer's description of Lanmei Airlines' model, specifically its use of narrow-body aircraft with a simple design structure."
PARTLY_RELEVANT,"The generated answer partially addresses the question, but it does not provide a direct answer to the question. Instead, it summarizes the characteristics of Lanmei Airlines' business model, which includes using narrow-body aircraft, and indirectly implies that this choice helps reduce costs. However, the answer does not explicitly state that using narrow-body aircraft reduces costs. A more direct answer would be expected."
RELEVANT,"The generated answer is similar to the original answer in terms of content and context. The generated answer provides additional information about the 'đại chúng' model by Lanmei Airlines, which is also present in the original answer. The answer is still focused on Lanmei Airlines' services and features, and the language used is similar to the original text."
PARTLY_RELEVANT,"The generated answer touches on the topic of Lanmei Airlines providing a service to its passengers, but it does not fully capture the context of the original answer, which mentions a broader picture of the airline's business model and services. The original answer provides a detailed description of Lanmei Airlines' plans to create a 'mass airline' model, with a focus on cost reduction and service optimization. The generated answer is more specific and related to the airline's cabin service, which is one aspect of its overall services. While the generated answer is relevant to the original answer, it does not accurately represent the full scope of Lanmei Airlines' services and business model."
NON_RELEVANT,The generated answer contains different information than the original answer. The date '19/7' mentioned in the generated answer is not matching with the date '26.11' mentioned in the original answer.
NON_RELEVANT,"The generated answer is incorrect and not relevant to the original answer. The original answer mentions Ninh Ba being in Chiết Giang, Trung Quốc, whereas the generated answer lists Ninh Bá as being in Quảng Trị which are different locations."
RELEVANT,"The generated answer accurately reflects the original answer, providing the same location information, specifically Ninh Ba, province of Zhejiang, China. The answer is identical in content and context to the original, indicating a high level of relevance."
NON_RELEVANT,"The generated answer is the same as the generated question, which is the user's query. This suggests a lack of understanding of the task, as the model is simply repeating the input instead of generating a relevant answer."
