Relevance,Explanation
RELEVANT,"The generated answer is exactly the same as the original answer, including specific details like the location and city. The only difference is that the original answer is phrased as a sentence describing a wedding, while the generated answer is phrased as a sentence answering a question. The content and context of the generated answer are identical to the original answer, indicating high relevance."
RELEVANT,"The generated answer provides the exact same information as the original answer, including the specific number of guests (20) and the names involved (Shofika Begum and Saddam Hussein). The answer is a direct reproduction of the original information, making it relevant and accurate."
RELEVANT,"The generated answer is relevant to the original answer as it provides the same information about the wedding location and number of guests. Although the tone is slightly different and the word 'kết hôn' (married) is not explicitly stated, the majority of the content is similar to the original answer, making it relevant."
RELEVANT,"The generated answer is highly similar to the original answer, providing the same specific location (Kutupalong) and number of attendees (about 20). The only minor difference is the rephrase of the sentence structure, but the content remains the same, making it highly relevant to the original answer."
RELEVANT,"The generated answer is similar to the original answer in terms of content and context. Both answers provide information about the number of guests attending the wedding and the exclusivity of the event. The generated answer is a straightforward answer to the generated question, which is a sub-question of the original answer. Although the generated answer could have been more detailed and provide information about the 20 guests, the core information is accurate and relevant to the original answer."
PARTLY_RELEVANT,"The generated answer contains the same information as the original answer, but it's a verbatim copy. The original question is also repeated in the generated answer. Although the information is correct, the format and lack of added value make it PARTLY_RELEVANT."
RELEVANT,"The generated answer provides the same information as the original answer, including the correct statistic of 44 years, the golfer who broke the record (Justin Thomas), and the specific event (US Open Championship 2017). The answer is concise, clear, and accurate, making it highly relevant to the original answer."
PARTLY_RELEVANT,"The generated answer is partially relevant because it contains the same sentence as the original answer, but it does not provide any additional information or answer the original question. It seems that the generated answer is simply repeating the original answer, which makes it less informative and relevant compared to the original answer."
RELEVANT,"The generated answer accurately quotes the original answer, restating that Justin Thomas scored 63 strokes (-9) in the 3rd round of the US Open Championship 2017. The content and context of the generated answer match the original answer, providing the exact same information."
PARTLY_RELEVANT,"The generated answer provides the nationality of Justin Thomas, which is American, but it does not explicitly provide the same level of detail as the original answer about his record-breaking score at the US Open Championship. While it is related to the original answer, it does not capture the specific context or content of the original answer."
RELEVANT,"The generated answer discusses the same event and reasons mentioned in the original answer. Although the order of presentation is slightly different, the content is largely similar, focusing on the failure of FSA to advance into Deir Ezzor due to being blocked by YPG and their commitment to SAA. The generated answer also elaborates on the consequences of this failure, which shows a deeper understanding of the context and relevance to the original answer."
PARTLY_RELEVANT,"The generated answer mentions the impact of YPG's commitment on the US strategy at Deir Ezzor, which is relevant to the original answer. However, it also introduces some additional information about the agreement between YPG and SAA on Raqqa and Deir Ezzor, which is not present in the original answer. While the generated answer covers some of the same points as the original, it does not accurately capture the entirety of the original answer's content and context."
RELEVANT,"The generated answer provides the same information as the original answer, which is the reason why the US plan to capture Deir Ezzor failed. The explanation provided in the generated answer is a summary of the original answer, implying that the generated answer is relevant and includes the same key information."
PARTLY_RELEVANT,"The generated answer partially addresses the question by mentioning FSA and YPG as the forces that contributed to the failed strategy of the US at Deir Ezzor. However, it additionally mentions the agreement between YPG and SAA, which is not directly relevant to the question. The generated answer requires some additional information to be considered complete, but it still provides valuable insights into the context."
