Relevance,Explanation
PARTLY_RELEVANT,"The generated answer partially answers the question by listing several cases where the budget can be adjusted. However, it does not mention the specific case mentioned in the original answer, which is 'có biến động lớn về nguồn thu và nhiệm vụ chi'. The generated answer provides additional information beyond what is mentioned in the original answer, but does not fully align with the original answer."
NON_RELEVANT,"The generated answer is about access to export and import records and national database, which is unrelated to the original answer about commune committee's budget adjustment and compatibility with central guidance."
RELEVANT,"The generated answer is almost identical to the original answer, with the same content and structure. It confirms the time required to fulfill the mandatory military service is 3 years, which matches the original answer. The only minor difference is that the generated answer asks the question again, whereas the original answer directly states the fact. Overall, the generated answer is highly relevant to the original answer."
RELEVANT,"The generated answer 'Theo luật, nghĩa vụ Công an kéo dài bao lâu? là 3 năm.' is relevant to the original answer 'Thời gian thực hiện nghĩa vụ tham gia Công an nhân dân là ba năm.' because it directly answers the question 'Theo luật, nghĩa vụ Công an kéo dài bao lâu?' and provides the same information about the length of time for the military duty. The only difference is that the generated answer is a question-answer pair, while the original answer is a statement. The content and context of the generated answer match the original answer."
PARTLY_RELEVANT,"Although the generated answer mentions the duration of military service, it does not directly match the original answer. The original answer mentions actual time served ('Thời gian thực hiện nghĩa vụ tham gia Công an nhân dân'), whereas the generated answer addresses a different aspect ('Độ dài thời gian phục vụ nghĩa vụ công an'). The answer still conveys the correct information about the duration, but in a different tone and with a different question."
RELEVANT,"The generated answer shares the same time period 'ba năm' (three years) as the original answer, indicating a strong relevance. Although the phrasing and context are different, the exact numerical value remains the same, demonstrating a good understanding of the original information."
PARTLY_RELEVANT,"The generated answer mentions the same duration of three years, which is correct according to the original answer. However, the context and question being asked are different. The original answer provides the duration of time for completing military service, while the generated question and answer are about the duration of joining the police force. Although the numbers match, the context and relevance of the answer to the original question are not directly related."
NON_RELEVANT,"The generated answer is about violating the use of firecrackers, which is a completely different topic and context compared to the original answer which is about not repairing or maintaining traffic signs. The two answers are not even remotely related."
PARTLY_RELEVANT,"Although the generated answer is related to the topic of the original answer, it is not a direct response to the question. The original answer provides information about the fine for violating a specific regulation, while the generated answer is a rewritten version of the question. The generated answer lacks the essential information contained in the original answer, specifically the fine amount and the specific regulations regarding warning signs. The relevance is partially due to the sharing of a relevant topic (fines for violating regulations), but the generated answer does not provide an answer that is comparable in terms of providing specific information and context as the original answer."
RELEVANT,"The generated answer is closely related to the original answer. It directly addresses the penalty for not repairing damaged warning signs, which is the same topic as the original answer. The content and structure of the generated answer are similar to the original answer, including the specification of the fine amounts and the entity responsible."
RELEVANT,"The generated answer states the highest fine for not repairing damaged danger signs, which is mentioned in the original answer as part of the fines for organizations that fail to timely repair or replace damaged signs. The generated answer is a specific consequence of the original answer's information, making it relevant."
RELEVANT,"The generated answer is relevant to the original answer as it directly quotes the same text from the original answer. The generated answer is simply rephrasing the original answer, which makes it highly relevant."
PARTLY_RELEVANT,"The generated answer partially captures the idea that hương ước, quy ước is established for the purpose of self-management of the community, which is mentioned in the original answer. However, the generated answer also includes additional information not present in the original answer, such as the specific goals of protecting natural resources, environment, and social order, as well as promoting cultural values and customs. This makes the generated answer partially relevant, as it retains some of the original information but also introduces new content."
RELEVANT,"The generated answer is relevant to the original answer as it provides the same information about the participants involved in the creation of hương ước, quy ước. The answer is almost identical to the original answer, with only minor differences in wording. The content and context of the generated answer are consistent with the original answer, making it a relevant evaluation."
