Relevance,Explanation
RELEVANT,"The generated answer is relevant to the original answer as it directly addresses the same question and provides similar information. The content is identical, with the generated answer rephrasing the same points mentioned in the original answer, specifically about Real Madrid's chance to win the third title and comparing with Barcelona's performance."
RELEVANT,"The generated answer focuses on the same topic as the original answer, which is Real Madrid's goal in the 2017 FIFA Club World Cup. Although the tone and structure are slightly different, the key points mentioned in the original answer (Real Madrid's chance to win the third title and compare their record with Barcelona) are also present in the generated answer (Real Madrid's chance to win the trophy)."
RELEVANT,"The generated answer is largely consistent with the original answer, as it accurately states the reason why the judges are not fond of the contestants' shopping habits. The generated answer also includes similar phrasing and context as the original answer, including the mention of judges seeking a more profound person and the lack of enthusiasm towards contestants with shopping inclinations. The only slight difference is the generated answer's more direct rephrasing of the original statement, but overall, it maintains a strong relevance to the original answer."
NON_RELEVANT,"The generated answer is completely unrelated to the original answer. The original answer discusses the judges' preferences for the contestants' personality and the questions they ask, while the generated answer is an unrelated inquiring statement. The generated answer does not provide any insight or information about the judges' preferences or the questions asked, making it non-relevant."
RELEVANT,"The generated answer is a direct quote from the original answer, addressing the same topic and providing similar information. It specifically mentions MC Phan Anh's comment about shopping, which is deeply relevant to the original context. The answer is almost identical to the original, demonstrating a high level of relevance and similarity."
NON_RELEVANT,"The generated answer is irrelevant because it is a repetition of the question and does not provide any meaningful information about the ban giám khảo or Hoa hậu Hương Giang. The context of the original answer is about the ban giám khảo's preferences and Hoa hậu Hương Giang's perception, but the generated answer ignores this context and fails to provide a relevant answer."
RELEVANT,"The generated answer is highly similar to the original answer, providing the same information about the Nissan Leaf 2018's ProPilot Park technology used for parking support, including the cameras and ultrasonic sensors. The answer is a direct response to the generated question, mirroring the original answer's content and context."
RELEVANT,"The generated answer is a direct extraction from the original answer, providing the specific number of sensors (12) used in the Nissan Leaf 2018 model for automatic parking, which is a crucial detail from the original statement. The generated answer lacks any additional information or context, but accurately answers the generated question."
RELEVANT,"The generated answer is a direct response to the inquiry about how the ProPilot Park technology on Nissan Leaf 2018 works. The content is virtually identical to the original answer, with the same syntax, vocabulary, and structure. The only difference is the posed question in the generated answer, which is already answered by the original answer. This suggests that the RAG system has successfully retrieved and augmented the relevant information to generate a highly relevant and accurate response."
RELEVANT,"The generated answer is relevant because it mentions the same sensor technology (supernel audio sensing) as the original answer, in the context of supporting autonomous parking functionality. The generated answer is a direct extraction from the original answer, providing the same information in a slightly rephrased manner."
RELEVANT,"The generated answer accurately conveys the goal of the French government's plan to stop homework, which is to reduce social inequality and bring joy to families. The content and context of the generated answer match the original answer, with only minor phrasing differences."
RELEVANT,"Although the generated answer includes some additional information not present in the original answer, it generally conveys the same message and agrees with the original answer. The generated answer identifies the impact of homework on social inequality and quotes the Minister of Education to support the statement, which is consistent with the original answer. However, the generated answer is not an exact copy of the original answer, but rather a paraphrased version that adds some new details."
PARTLY_RELEVANT,"The generated answer discusses the possible changes in French family culture after the abolition of homework, which is partially related to the original answer's topic of reducing social inequality and promoting family harmony. However, the generated answer provides some new information not present in the original answer, such as the proposed alternatives to homework, which affects the relevance of the answer to the original text."
