Relevance,Explanation
PARTLY_RELEVANT,"The generated answer partially relates to the original answer by providing a minimum fine for transporting food together with hazardous chemicals, which is an important aspect of the original answer. However, the generated answer does not provide the same range of fines as the original answer, instead, it provides a specific minimum fine, which is not directly comparable to the original answer."
PARTLY_RELEVANT,"The generated answer partially relates to the original answer by mentioning a specific penalty for violating regulations on transporting hazardous goods. However, it does not directly answer the question about the penalty for transporting food with hazardous chemicals, but rather provides a broader context. The generated answer also provides more detailed information, including the law and possible consequences, which is not present in the original answer."
RELEVANT,"The generated answer is relevant to the original answer as it provides the condition for the investor to be granted a certificate of land use and ownership in accordance with the Law on Land. It mentions specific requirements, such as 30% of the project's value and asset registration, which are mentioned in the original answer. Although the wording and structure are different, the content is similar and accurately conveys the required information."
RELEVANT,"The generated answer is mostly relevant to the original answer as it provides information on who the land use certificate is issued to (chủ đầu tư dự án) and the process for obtaining it, which is consistent with the original answer's mention of the competent state agency issuing the certificate to the investor. However, the generated answer provides more specific details and references a specific decree (Thông tư số 30/2011/TT-BTNMT), which makes its relevance even higher."
PARTLY_RELEVANT,"The generated answer partially addresses the original answer's content, specifically mentioning the types of areas that may be included in the land area, such as areas being built on or exempt from the master plan. However, it fails to provide the specific information about the certificate issuance process, which is the main topic of the original answer and the context of the generated question. The generated answer also does not mention the connection with the project's completion progress, economic law, and investment, construction regulations, which are key elements in the original answer. The answer seems to be a relevant but incomplete response to the generated question."
PARTLY_RELEVANT,"The generated answer does not fully address the question, but provides some related information. The original answer talks about the issuance of certifications for land use and property rights, while the generated answer discusses the incentives for investment in certain industries or locations, which is still related to the topic, but secondary. The generated answer also uses similar phrases and concepts, but does not fully capture the essence of the original answer."
RELEVANT,"The generated answer accurately conveys the same information and implication as the original answer, which states that a foreign reporter does not need to have a visa when conducting journalism activities in Vietnam. The generated answer also omits any unnecessary conditions, making it a relevant and concise response."
PARTLY_RELEVANT,"The generated answer partially relates to the original answer by providing information about the duration of foreign reporters' stay in Vietnam to conduct journalism work. However, it does not directly answer the question asked, which is about the requirement to carry a passport while conducting journalism activities in Vietnam, as stated in the original answer."
PARTLY_RELEVANT,"The generated answer provides some relevant information, as it mentions the essential contact for foreign journalists to obtain permission to work in Vietnam, which is related to the original answer's mention of not needing a visa for temporary journalists. However, the answer is not directly answering the question and instead provides a broader discussion of the regulations and procedures for foreign journalists, which is not what the original answer emphasizes."
RELEVANT,"The generated answer accurately provides the information about what kinds of appeals are handled by the Chief Justice of the Supreme People's Court for the first time. The answer also reproduces the original text's structure and wording, except for the addition of the repeated question at the beginning. The content and context of the generated answer are highly similar to the original answer, making it relevant."
