Relevance,Explanation
RELEVANT,"The generated answer addresses the question about the procedure for reviewing statistics reports, which is partially implied in the original answer. The generated answer provides specific details about the regulations and guidelines for reviewing such reports, which is in line with the original answer's mention of 'quy định'. Although the generated answer does not directly quote the original answer's specific phrase, it conveys the same idea of following regulations and guidelines."
NON_RELEVANT,"The generated answer talks about the ownership of the report's copyright, which is a completely different topic from the original answer. The original answer mentions the responsibilities of a agency or unit in storing reports and related documents, while the generated answer addresses a question about copyright ownership."
PARTLY_RELEVANT,"The generated answer partially matches the original answer in terms of the concept of Báo cáo thống kê hình sự liên ngành, but the specific details provided are not identical. The generated answer provides a list of data sources, whereas the original answer does not mention specific data sources. The generated answer correctly implies that alongside the main report, other relevant documents are stored, but the original answer does not explicitly state this. This evaluation suggests that the generated answer has some relevant information but does not accurately capture the essence of the original answer."
PARTLY_RELEVANT,"The generated answer is partially relevant because it asks a question about the importance of securing stability in the technology infrastructure of government agencies, which is related to the original answer's emphasis on ensuring stability in the technology infrastructure. However, the generated answer does not provide a concrete explanation or elaboration on this point, unlike the original answer which provides a detailed list of requirements."
PARTLY_RELEVANT,"The generated answer contains some relevant information about the importance of ensuring information security in the system of government agencies, as well as complying with relevant regulations and standards. However, the answer is not entirely relevant as it focuses more on specific requirements for certain sectors, such as the finance sector, and provides more detailed information than what was asked in the generated question. The answer also diverts attention to other topics, such as encrypting sensitive information, which is not directly related to the original question."
PARTLY_RELEVANT,"While the generated answer mentions the importance of ensuring the safety of the system and the potential risks, it lacks specific details and focuses more on the general requirements and importance of ensuring the safety of the system, unlike the original answer which provides more specific and concrete information on the requirements for the system's technology and infrastructure."
PARTLY_RELEVANT,"The generated answer partially addresses the topic of the original answer, which is about not being evaluated for the 'Chiến sĩ tiên tiến' title. The generated answer provides a regulatory basis for the time frame of eligibility, but it answers a different question (what is the timeframe?) rather than directly addressing the original statement."
PARTLY_RELEVANT,"The generated answer partially addresses the question, providing conditions for being considered as a 'chiến sĩ tiên tiến' (advanced soldier). However, it does not directly relate to the original answer 'Không được xét danh hiệu chiến sĩ tiên tiến' (It is not considered for the title of advanced soldier). The generated answer discusses the criteria for being considered, whereas the original answer explicitly states it is not an option."
RELEVANT,"The generated answer provides relevant information about the standards for being awarded the title of 'Chiến sĩ tiên tiến', which is similar to the original answer that mentions the standards are 'được quy định tại Điều 24 của Luật thi đua, khen thưởng'. The generated answer provides additional details and specifications for the eligibility criteria, demonstrating a high degree of relevance to the original answer."
RELEVANT,"The generated answer provides more detailed information about the requirements for awarding the 'Lao động tiên tiến', 'Chiến sĩ tiên triumph' titles, including the specific regulations and criteria mentioned in Article 24 of the Law on Awards. Although it does not directly answer the original question, it still provides relevant information about the topic, showing a high level of relevance compared to the original answer."
RELEVANT,"The generated answer is highly similar to the original answer, with the same sentence structure and almost identical wording. The only difference is the use of 'then' in the generated answer, which does not affect the meaning. The generated answer accurately reflects the same information as the original answer, indicating a high level of relevance."
PARTLY_RELEVANT,"The generated answer partially overlaps with the original answer in terms of the fine range, but the specific range is not identical and the context of the fine is different. The original answer is for a specific offense, whereas the generated answer is for a more general offense related to postal services."
