Relevance,Explanation
RELEVANT,"The generated answer is very similar to the original answer in terms of context, content, and language used. It correctly identifies the person being fooled ('xỏ háng') as Sergio Busquets, and provides a detailed description of the event. The only minor difference is the use of 'hát' instead of 'háng', which does not affect the overall relevance and accuracy of the answer."
RELEVANT,"The generated answer refers to the same event (Messi's action on Busquets) and provides specific details about the location (sân tập của CLB Barcelona) which is similar to the original answer. However, it does not directly quote or mention 'trộm' Busquets, which is a crucial part of the original answer. Nevertheless, the generated answer is relevant to the original answer in terms of context and content."
RELEVANT,"The generated answer is identical to the original answer, directly addressing the question about the safety features of Yamaha X-Max 125 2018 and mentioning the Traction Control (TCS) system. The content and context are exact matches, making it relevant to the original answer."
RELEVANT,"The generated answer is highly relevant to the original answer. Both answers discuss the lighting system of the Yamaha X-Max 125 2018, specifically highlighting the use of LED lights. The generated answer accurately summarizes the original answer and provides the same information, with the only difference being the language used to phrase the answer."
RELEVANT,"The generated answer provides a list of features and technologies of Yamaha X-Max 125 2018, which are mostly accurate and matches the original answer. The main differences are the rephrasing and reorganization of the information. However, the generated answer still captures the key points of the original answer and provides similar information."
PARTLY_RELEVANT,"The generated answer partially addresses the question by providing the correct information about the screen and handlebar of Yamaha X-Max 125 2018 being adjustable to fit different heights. However, it lacks context and details provided in the original answer, such as mentioning it's available on two positions and also includes information about other standard equipment features like USB port and smart lock. The generated answer only focuses on the specific question's topic, which is the adjustment of the bike's height."
RELEVANT,"The generated answer matches the original answer, providing the exact same information and details about the number of public sanitation projects invested by UBND Thành phố Hà Nội in a social welfare project."
RELEVANT,"The generated answer is identical to the original answer, providing the exact numerical value of 500. The language and structure of the answer are also similar, confirming the relevance and accuracy of the generated response."
RELEVANT,"The generated answer accurately reproduces the original answer, providing the same numerical value and describing the construction of public restrooms through socialization project. The language and structure used in the generated answer are very similar to those in the original answer, making it easy to understand the relevance and similarity between the two."
RELEVANT,"The generated answer is identical to the original answer, matching the exact content and structure. The answer is a direct response to the generated question and provides the same information as the original answer."
RELEVANT,"The generated answer is highly relevant to the original answer because it provides the exact same information and even uses the same wording, including the number 500. The context of the question and answer is also identical, discussing the socio-economic project and the investment of the Hanoi People's Committee in public sanitation facilities. The only difference is the change from 'nhà vệ sinh công cộng' to 'cơ sở vệ sinh công cộng', which is a minor variation in terminology but does not affect the overall relevance of the answer."
PARTLY_RELEVANT,"The generated answer provides the correct information that Theresa May was the head of state of the United Kingdom. However, it does not address the specific context mentioned in the original answer, which is about the cooperation between Theresa May and Shinzo Abe to speed up the implementation of sanctions against North Korea. The generated answer is related to Theresa May's role, but it does not connect to the original topic."
PARTLY_RELEVANT,"The generated answer provides correct information about Shinzo Abe, which is a necessary piece of context to understand the original answer. However, it does not address the issue of cooperation between Theresa May and Shinzo Abe on sanctions against North Korea, which is the main topic of the original answer. The generated answer is relevant but limited in scope."
NON_RELEVANT,"The generated answer is about a lawyer's opinion on reporting criminal acts, which is unrelated to the original answer's context of Theresa May and Shinzo Abe agreeing to accelerate the implementation of sanctions against North Korea after a missile test. The generated answer does not mention the sanction-related topics, individuals, or events mentioned in the original answer."
