Relevance,Explanation
RELEVANT,"The generated answer is relevant to the original answer as it provides similar information regarding Tăng Thanh Hà's physique, specifically mentioning her having a slender and toned body after 2 months of giving birth. The generated answer also mentions the effort she put into losing weight, which is consistent with the context of the original answer."
RELEVANT,"The generated answer is identical to the original answer, providing the exact time and date of the show. This suggests that the generator has accurately captured the context of the original answer and reproduced it effectively."
RELEVANT,The generated answer 'Ngày phát sóng tập 1 phim Sự hoán đổi diệu kỳ là ngày 31/07.' is highly relevant to the original answer 'Tập 1 phim Sự hoán đổi diệu kỳ sẽ được phát sóng vào 20h20 tối 31/07.' as it provides the exact date mentioned in the original answer.
RELEVANT,"The generated answer is identical to the original answer, providing the same information regarding the broadcast timing of episode 1 of the movie 'Sự hoán đổi diệu kỳ'. The answer is exact and matches the original content, making it highly relevant."
PARTLY_RELEVANT,"The generated answer partially matches the original answer in terms of the film and broadcast time. However, the original answer provides additional information about the broadcast on 'Tập 1', which is not included in the generated answer."
RELEVANT,"The generated answer is identical to the original answer, which accurately responds to the generated question of when the next episode of phim Sự hoán đổi diệu kỳ will be broadcast. The answer is the same as the original one, making it highly relevant and a correct response."
RELEVANT,"The generated answer is identical to the original answer, sharing the same information and phrases. The only difference is the question being asked before the answer, which doesn't affect the relevance of the answer itself."
PARTLY_RELEVANT,"The generated answer discusses the time at which a goal was scored by U20 futsal Vietnam, which is somewhat related to the original answer mentioning a draw with a score of 1-1. However, it doesn't provide any information directly related to the score or the fact that the match ended in a draw, making it only partly relevant."
PARTLY_RELEVANT,"The generated answer mentions Indonesia scoring a goal, which is partially relevant to the original answer about the match ending with a 1-1 draw. However, the answer is not entirely relevant as it only provides information about one team scoring a goal and does not provide any information about the 1-1 draw, which is a key aspect of the original answer."
RELEVANT,"The generated answer accurately reports the outcome of the match between U20 futsal Vietnam and Indonesia, which is the same as the original answer. The additional details about the goals and timing provided in the generated answer are also relevant to the original answer."
RELEVANT,"The generated answer is highly relevant to the original answer, as it provides the same information and details about the score of the match, which is exactly what the original answer also mentions. The only difference is the additional context about U20 futsal match between Vietnam and Indonesia, but this does not affect the relevance of the answer."
RELEVANT,"The generated answer is highly relevant to the original answer. Both answers mention the reason behind not disclosing the information, which is 'chưa được tiết lộ' (not disclosed yet). The generated answer provides a specific example of a case where the family refused to perform an autopsy due to the same reason. The similarity in content and context between the two answers suggests that the generated answer is relevant to the original answer."
PARTLY_RELEVANT,"The generated answer partially matches the context and relevance of the original answer. Although the generated answer discusses the reason behind the decision of the Otto Warmbier family, the original answer is more general and states that the reason is still unknown, whereas the generated answer provides more specific information about the decision. The generated answer does not directly answer the question, but it provides related contextual information, which partially justifies its relevance."
RELEVANT,"The generated answer not only provides information about Otto Warmbier's family refusing to perform an autopsy, but also includes the original answer's statement 'Lý do đằng sau quyết định này hiện chưa được tiết lộ' (The reason behind this decision has not been revealed yet), which suggests strong relevance between the original and generated answers. The generated answer expands on the original answer by providing an explanation for the family's decision, maintaining a consistent level of relevance."
RELEVANT,"The generated answer is highly similar to the original answer, sharing the same structure and content. The only difference is the specific context, with the generated answer focusing on Otto Warmbier's family, whereas the original answer is more general. The generated answer accurately conveys the same message as the original answer, which is that the reason behind the decision is not publicly disclosed."
