Relevance,Explanation
RELEVANT,"The generated answer is similar to the original answer in terms of providing information about the recreation areas at the Stoke Park house. The generated answer repeats the phrase 'khu vực giải trí ngoài trời' and also includes additional details about the recreations facilities such as cinema, gym, tennis court, hot tub, and outdoor cooking area. The generated answer is mostly relevant to the original answer and provides a more detailed description of the recreation facilities."
RELEVANT,"The generated answer accurately extracts a specific piece of information from the original answer, specifically mentioning the 'khu nhân viên, văn phòng và gara' as part of the additional structures beyond the main house."
RELEVANT,"The generated answer is almost identical to the original answer, with the same information and phrasing. Only minor wording variations are present, but the essential details are preserved. As a result, the relevance is high and classified as 'RELEVANT'."
PARTLY_RELEVANT,"The generated answer partially addresses the original answer by mentioning Oxalis's intention to create something for customers to climb over the 90m wall in Hang Son Doong. However, it does not provide the specific detail of attaching metal stairs to limestone blocks as mentioned in the original answer. Instead, it replicates the same question asked, which is not adding any new information to the original answer."
PARTLY_RELEVANT,"The generated answer is partially relevant to the original answer as it mentions Oxalis' intention to bring something into Hang Son Doong, similar to the original answer's mention of bringing 'khối thạch nhũ' (stone blocks) into the same location. However, the specific object being brought in is different (customers vs. stone blocks). The generated answer is also less detailed than the original answer, which provides more context about Oxalis' plans for the stone blocks."
RELEVANT,"The generated answer is identical to the original answer, providing exact information about the team that was won by Germany with a score of 6-0 during the World Cup 2018 qualifying match."
RELEVANT,"The generated answer is highly similar to the original answer in terms of content and context. The generated answer answers the generated question with a logical and factual response, providing the exact same score as the original answer. This high level of similarity suggests that the generated answer is relevant to the original answer."
RELEVANT,"The generated answer is highly relevant to the original answer, as it provides the same information about the match between Germany and Norway in the 2018 World Cup qualifiers, with the same score of 6-0."
RELEVANT,"The generated answer correctly states the year (2017) and the match result (6-0) between Germany and Norway, which is consistent with the original answer. However, the generated answer incorrectly states that the match took place in 2017 instead of 2018."
RELEVANT,"The generated answer is highly similar to the original answer, providing the same information and detail. The only difference is that the generated answer includes a reiteration of the original sentence, which does not affect the relevance of the answer."
RELEVANT,"The generated answer is largely similar to the original answer in terms of content and context. It correctly paraphrases the sentiment of the original text, discussing the admiration of the Vietnamese team's fans from Thailand, Malaysia, and Iraq. The answer even retains the same sentence structure and wording in some parts, making it a relevant response to the original question."
RELEVANT,"The generated answer is relevant to the original answer as it extracts the key information about the Thai fans' expectations, which is the same topic as the original answer. The generated answer is concise and accurate, covering the important points about the fans' positive comments and their hopes for a match between Thailand and Vietnam. Although the wording is not identical to the original answer, the context and main ideas are preserved, making it a relevant response."
