Relevance,Explanation
PARTLY_RELEVANT,"The generated answer partially addresses the original question, but its content and context are not entirely relevant. It mentions the severity of the offense and the possible sanctions, which is related to the original answer's mention of the punishment for evading inspection. However, the generated answer also discusses the Laws and company regulations, which is not directly addressed in the original answer. The answer also mentions the possibility of the fine increasing or the contract being terminated, which is not mentioned in the original answer. Overall, the generated answer partially captures the essence of the original answer, but its scope and focus are different."
PARTLY_RELEVANT,"The generated answer provides some relevant information, as it does mention laws and regulations related to financial management. However, it is not directly relevant to the original answer, which specifically talks about the fine for a specific behavior, whereas the generated answer does not address the fine or the behavior. The generated answer seems to be more focused on explaining the scope of applicability of certain laws and regulations for expenditures within a certain range, which is related but not directly relevant to the original answer."
PARTLY_RELEVANT,"The generated answer provides some relevant information about the penalty for bus drivers who avoid inspection by getting off the bus, but it does not fully match the original answer. The penalty range mentioned in the generated answer (500.000 - 1.000.000 đồng) is different from the one mentioned in the original answer (1.000.000 - 2.000.000 đồng). Additionally, the generated answer provides more details about the potential consequences, including fines, imprisonment, and license suspension, which are not mentioned in the original answer. Overall, while the generated answer contains some relevant information, it is not a direct match to the original answer."
RELEVANT,"The generated answer accurately mentions the relevant departments ('Bộ Công Thương' and 'Bộ Quốc phòng') and task ('điều chỉnh danh mục sản phẩm công nghiệp an ninh') as described in the original answer. Although the wording is slightly different, the content and context are closely related, making the generated answer relevant to the original answer."
PARTLY_RELEVANT,"The generated answer mentions some relevant activities of the Ministry of Industry and Trade, such as developing videosoft, developing security technology, strengthening domestic security industry, developing security forces, and training labor forces with skills. However, the answer does not specifically mention the responsibilities of the Ministry of Industry and Trade as stated in the original answer, such as coordinating with other agencies to approve or correct the list of industrial products, which reduces its relevance."
PARTLY_RELEVANT,"The generated answer provides some relevant information about who can be issued an insurance card by the state, but it is not directly related to the original answer. The original answer specifically mentions students at the Ha Noi Military School and their families, while the generated answer provides general information about various groups of people. While some of the groups mentioned in the generated answer may also be eligible for a health insurance card, the connection is not explicit."
PARTLY_RELEVANT,"The generated answer provides some relevant information, specifically the condition that the wife and son must have a blood relationship with the military cadet (wife, husband, child). However, the generated answer also contains additional conditions not mentioned in the original answer, such as having been demobilized or currently undergoing training at the Ho Chi Minh Military Academy, which makes it less relevant overall. Additionally, the generated answer cites 'the regulation of the Ho Chi Minh Military Academy' as the authority, whereas the original answer refers to a specific article in a law."
PARTLY_RELEVANT,"The generated answer partially relates to the original answer as it mentions the requirement for a certificate of being a student of Lục Quân Hà Nội and the need for a family member to have a certain income. However, it does not directly answer the question about the regulation, but rather explains the requirements for obtaining the card, and provides the source of the regulation. Additionally, the generated answer provides extra information not present in the original answer, making it partially relevant but not entirely relevant to the original answer."
PARTLY_RELEVANT,"The generated answer addresses the same regulation and article as the original answer, but provides specific details and additional information about the subjects that can receive the health insurance card. While it is related to the original answer, it does not exactly match the content and only partially mirrors the context."
PARTLY_RELEVANT,"The generated answer partially addresses the question by referencing the relevant regulation and context from the original text. However, it lacks specific details and deadlines mentioned in the original text, making it incomplete and less relevant compared to the original answer."
