Relevance,Explanation
RELEVANT,"The generated answer is highly relevant to the original answer as it provides a similar explanation for why the 5 personnel of the Moldovan diplomatic delegation were asked to leave Russia. The original answer mentions that Russia sent a note to the Moldovan embassy, asking for the 5 personnel to leave Russia, and the generated answer explicitly states this. The generated answer also provides the correct reasons for the action, which matches the original answer."
PARTLY_RELEVANT,"The generated answer correctly mentions the reason for Russia's demand, which is the perceived 'động thái khiêu khích' (provocative action) from Tallinn. It also correctly states that Russia sent a note to the Estonian embassy, requesting the departure of two Estonian diplomats within 5 days. However, the generated answer is not entirely relevant as it does not provide a complete and detailed explanation of Russia's actions and the contexts surrounding it. The original answer provides more context, stating that Russia took similar actions against Moldova, and that it is a response to Estonia's previous expulsion of Russian diplomats. The generated answer lacks this additional context, which makes it only partly relevant."
PARTLY_RELEVANT,"The generated answer partially matches the original context. The relevant part is the warning from Moscow about the impact of Estonia's 'chính sách gây hại' on bilateral relations. However, the generated answer is missing the detail about Moscow's warning to Estonian diplomats, which is present in the original answer."
RELEVANT,"The generated answer addresses the key points and details mentioned in the original answer, including the fact that Estonia and Moldova withdrew their diplomats and Russia's response in kind. The generated answer also correctly states that Russia expelled 5 diplomats from Moldova and demanded the expulsion of 2 diplomats from Estonia. The only minor difference is that the generated answer lacks some specific details mentioned in the original answer, such as the exact dates and quotes mentioned. However, the overall relevance and accuracy of the generated answer are high, making it 'RELEVANT' rather than 'NON_RELEVANT'."
PARTLY_RELEVANT,"The generated answer provides some relevant information as it mentions that there is no information about the way to transport drugs from Sông Mã. However, it does not provide the specific information about the transportation method (ngụy trang ma túy trong các loại thực phẩm như cá khô, miến dong) and the subsequent steps (giửi hàng trên xe khách vào TPHCM) as mentioned in the original answer. The answer is partly relevant because it indirectly acknowledges the lack of information about the transportation method."
RELEVANT,"The generated answer accurately reproduces the original answer, including the detail about hiding drugs in food items like dried fish and vermicelli. The only difference is that the original answer provides additional context about sending the goods on separate vehicles, while the generated answer focuses solely on the hiding method."
RELEVANT,"The generated answer is relevant because it accurately summarizes the original answer, providing a similar structure and key details about the transportation method used by Đinh Thanh Bằng and Cù Quang Tuyến. The generated answer includes the same key points as the original answer, such as using a vehicle (xe khách) to transport drugs and hiding the drugs in food items (cá khô, miến dong). The only minor difference is the order of presentation, but the overall content and meaning are preserved."
NON_RELEVANT,"The generated answer discusses the role of people traveling on the same bus, which is not mentioned in the original answer. The original answer describes the roles of specific individuals in the drug transportation process, including the driver, the person at the back of the bus, and someone who is sent on a separate bus to provide surveillance. The generated answer is unrelated to the original answer and provides a completely different context."
NON_RELEVANT,"The generated answer does not relate to the original answer's context. The original answer describes a drug trafficking operation, and the generated question deals with a scenario where the perpetrators find law enforcement and flee. The generated answer mentioned an unrelated action, 'nhảy xuống sông bỏ trốn' (jumping down the river to escape), which is not discussed in the original answer."
RELEVANT,"The generated answer is a direct copy of the original answer, including punctuation and sentence structure. The answer specifically addresses the question and provides relevant information about the teaser MV What's My Name of T-ara. The content and context of the answer are identical to the original, making it a relevant and accurate response."
NON_RELEVANT,"The generated answer is a repetition of the original question, providing no relevant information about Boram and Soyeon, or their relationship with the teaser. It does not mention the specific products (bottle and pencil) mentioned in the original answer, nor does it provide any insight into the MV What's My Name of T-ara. The generated answer lacks meaningful content and is not relevant to the original answer."
