Relevance,Explanation
PARTLY_RELEVANT,"The generated answer provides the dates of the tournament, which is partially related to the original answer's mention of the team's goal to advance to the 2018 Asian Futsal Championship, as the tournament in the original answer refers to is presumably a qualification tournament for the 2018 Asian Futsal Championship. However, the generated answer does not directly address the original answer's specific goal."
PARTLY_RELEVANT,"The generated answer lists opposing teams in the 2017 HDBank East Asian Futsal Cup, which is related to the original answer's mention of the team's goal to reach the 2018 AFC Futsal Championship. However, the connection is not direct, and the answer primarily focuses on providing a list of competitors rather than specifically addressing the team's goal, making it PARTLY_RELEVANT."
RELEVANT,"The generated answer is partially extracted from the original answer, specifically mentioning the technique of laparoscopic surgery for cutting off the appendix. Although the generated answer is concise and relevant, it lacks the broader context of the original answer, which mentioned multiple advanced techniques and the development of new ones. The generated answer only focused on one specific technique."
NON_RELEVANT,"The generated answer is not related to the original answer and does not provide any relevant information about the technique Longo. The generated answer simply asks the same question again, which is not a meaningful response to the original context."
PARTLY_RELEVANT,"Although the generated answer mentions thở máy (ventilation) which is related to the original answer's mention of thở máy xâm nhập VCV, PCV, the answer is not entirely relevant. Specifically, the generated answer only talks about treating lung congestion/dyspnea, whereas the original answer highlights the hospital's advanced surgical techniques and development of new techniques. The generated answer misses the context of the hospital's expertise in various surgical procedures and new techniques."
RELEVANT,"The generated answer is relevant to the original answer as it lists the new techniques developed by the hospital, which is partially mentioned in the original answer. The generated answer is accurate and preserves the essential information from the original answer, including the hospital's name, techniques, and the fact that they are new developments."
RELEVANT,"The generated answer is a direct quote from the original text, with slight modifications to grammar and formatting. The content and context of the generated answer match the original answer almost exactly, making it highly relevant."
PARTLY_RELEVANT,"The generated answer is partially relevant because it mentions the reason why Jade Donavanik thinks asylum would be a favorable option for Yingluck Shinawatra, which is that the military is in control of Thailand and she has not been charged with corruption or national asset theft. However, it only focuses on one aspect mentioned in the original answer and omits the other important points, such as the possibility of asylum and the opposition from some politicians."
RELEVANT,"The generated answer is relevant to the original answer as it discusses the possibility of Yingluck Shinawatra being eligible for political asylum and relies on the same information about her not being charged with corruption or national asset theft. The answer also mentions the same advisor, Jade Donavanik, and provides similar reasoning for why she may be eligible for asylum. However, the generated answer is not identical to the original answer and provides a slightly different explanation, which is why it is not classified as 'PARTLY_RELEVANT'. Overall, the generated answer effectively conveys the relevant information and context, making it 'RELEVANT'."
PARTLY_RELEVANT,"The generated answer partially addresses the question and provides some relevant information about why a private enterprise cannot be removed from civil transactions and banking. However, it does not fully capture the complexity and nuances of the original answer, which provides a more detailed and contextual explanation of the concept of subject entities in Vietnamese law. The generated answer mainly focuses on the definition and characteristics of a private enterprise, which is a key aspect, but it does not fully explore the other subject entities mentioned in the original answer, such as family households, cooperatives, and businesses. Additionally, the tone and style of the generated answer are more formal and less conversational than the original answer."
