Relevance,Explanation
RELEVANT,"The generated answer is identical to the original answer, indicating a high degree of relevance between the two. The generated answer provides the same information and format as the original answer, answering the question 'Hệ quả tài chính của việc để dòng xe xếp hàng vượt quá 1.000 m đến 2.000 m là gì?' with the same range of fines ('phạt tiền từ 10.000.000 đồng đến 20.000.000 đồng'). This suggests that the RAG system has successfully retrieved and generated the correct information to provide a relevant answer."
PARTLY_RELEVANT,"The generated answer partially addresses the question, but the format and context are different from the original answer. The original answer provides a fine amount range (10.000.000 đồng to 20.000.000 đồng), whereas the generated answer provides a unit value (150 xe to 200 xe) without converting it to the expected currency format. Although it attempts to answer the question, the generated answer lacks clarity and precision, making it partially relevant."
RELEVANT,"The generated answer directly responds to the question, providing the same range of fine as the original answer (10.000.000 đồng to 20.000.000 đồng). The question and answer are closely related, with the generated answer accurately providing the fine information for a specific scenario (xe xếp hàng quá dài before a toll station)."
RELEVANT,"The generated answer is directly copied from the original answer, indicating a high level of relevance and accuracy. The format of the answer, including the range of fines in Vietnamese dong, is also identical to the original. This suggests that the RAG system successfully retrieved and reproduced the correct information from the original text."
RELEVANT,"The generated answer is relevant because it directly addresses the question raised, providing a clear explanation of when a person holding a collateral can give another person the right to use the collateral. The content is similar to the original answer, including the same phrases and sentences. The only difference is that the original answer is slightly more concise."
PARTLY_RELEVANT,"The generated answer provides information related to the given topic 'Điều kiện để người cầm cố cho thuê tài sản', namely the requirements for a pledge to lease property. However, it does not directly answer the original phrase 'Có, nếu có thỏa thuận', which implies a yes or no answer. The generated answer provides additional information that is not explicitly related to the original answer, making it partly relevant rather than fully similar or equivalent."
PARTLY_RELEVANT,"The generated answer contains relevant information about the necessity of the consent of the pledgee (bên nhận thế chấp) for leasing collateral assets. However, the additional information about cases involving investments by third parties or the pledgee in the collateral assets is not present in the original answer. The generated answer does not fully match the original in terms of scope and context, making it partially relevant."
RELEVANT,"The generated answer is relevant to the original answer as it confirms the same idea that it is not possible to lease a secured asset without a agreement. The generated answer provides additional details and context, such as the regulations and potential consequences, which is consistent with the tone and content of the original answer."
RELEVANT,"The generated answer discusses the terms of a mortgage agreement, which is similar to the original answer's response of 'Có, nếu có thỏa thuận' (Yes, if there is an agreement). The generated answer goes into more detail, providing specific examples of what the agreement includes, such as rental rights, investment, and sales. While it doesn't directly match the original answer, it's still relevant to the question and topic, demonstrating an understanding of the underlying concept."
PARTLY_RELEVANT,"The generated answer partially addresses the original answer by mentioning the condition under which a revocable mandate (ủy quyền lại) is effective. However, it fails to capture the complexity and nuance of the original answer, which specifically mentions the need for consent from the delegating party or circumstances that make it impossible to exercise the mandate. The generated answer only provides a limited and simplified view of the condition for the effectiveness of the revocable mandate."
NON_RELEVANT,"The generated answer is not relevant to the original answer. The generated answer is focused on the conditions for implementing a second authorization, whereas the original answer discusses the requirements and limitations for re-authorizing a civil transaction for the benefit of the authorizing person. The generated answer does not address the same issue or context as the original answer."
NON_RELEVANT,"The generated answer does not provide any information related to the impact of reauthorizing on the grantor, which is the focus of the original answer. Instead, it talks about the impact on the attorney, which is a completely different aspect."
NON_RELEVANT,"The generated answer is not relevant to the original answer because it does not mention the purpose of re-authorizing for the benefit of the original grantor, which is the main focus of the original answer. Instead, it talks about the purpose of re-authorizing for the purpose of receiving information about an event, which is a completely different context."
PARTLY_RELEVANT,"The generated answer partially addresses the question by providing a general statement that startups are established according to the law, which is correct. However, it lacks the specific context and details provided in the original answer, which focuses on the characteristics of startups that can increase their growth rate. The generated answer mainly repeats the starting sentence of the original answer, but fails to provide the additional information regarding intellectual property, technology, and business model innovation."
