Relevance,Explanation
RELEVANT,"The generated answer is identical to the original answer, ensuring that the context and content are similar and accurately convey the same information."
NON_RELEVANT,"The generated answer is not relevant to the question 'Năm nào phim 'The Mummy' được phát hành?' as it does not provide information about the release year of the movie. Instead, it simply states that the release date is not mentioned in the context provided, which is not a relevant answer to the question."
NON_RELEVANT,"The generated answer only mentions that 'The Mummy' is a blockbuster, whereas the original answer provides specific information about Annabelle Wallis having an opportunity to act with Tom Cruise in the movie. The generated answer does not provide any connection or relevance to the original question or answer, and is a non-sequitur."
NON_RELEVANT,"The generated answer 'Leh Lub Salub Rarng' is completely irrelevant to the original answer and the question being asked. The original answer mentions 'The Mummy', but the generated answer is a random phrase that doesn't relate to the topic at all. The question was asking for the English title of the movie, but the generated answer is not even a real title or relevant information."
PARTLY_RELEVANT,"The generated answer correctly provides the target revenue for Thế Giới Di Động in 2018, which is 86.390 tỷ đồng. However, it does not provide additional context and information about the revenue increase compared to 2017, as well as the profit after tax increase, which are mentioned in the original answer."
RELEVANT,"The generated answer is relevant to the original answer as it provides the exact percentage value (36.5%) mentioned in the original answer, which is the percentage increase in revenue from 2017 to 2018."
RELEVANT,"The generated answer focuses on the same topic (lợi nhuận) and provides a specific percentage increase for the year 2018, which is also mentioned in the original answer. Although the wording and structure are different, the content is still relevant to the original answer."
PARTLY_RELEVANT,"The generated answer is partially relevant because it mentions the same specific target revenue goal of 86.390 billion VND for 2018, which is correct. However, the wording and formatting are slightly different, and the generated answer does not provide the same level of detail as the original answer, such as the percentage increase in revenue and net profit compared to 2017."
PARTLY_RELEVANT,"The generated answer provides a specific percentage (18.3%) which is referenced in the original answer, but the generated question is about the expected increase in profit after tax, whereas the original answer mentions the achieved increase in profit after tax. The answer is not entirely irrelevant, but it does not fully match the context and intent of the original question."
RELEVANT,"The generated answer provides similar details and information as the original answer, including the type of ship, its dimensions, and its propulsion system. The generated answer is a direct summary of the original answer, highlighting the key points and features of the Lider-class nuclear-powered icebreaker."
PARTLY_RELEVANT,"The generated answer partially relevant to the original answer, as it mentions a unique feature of the Lider-class icebreaker, being able to operate continuously for 25 years without refueling. However, the generated answer does not provide information about the physical characteristics, displacement, or propulsion system of the icebreaker, which were mentioned in the original answer. Therefore, it does not provide a comprehensive answer to the question about the particular capabilities of the Lider-class icebreaker."
PARTLY_RELEVANT,"The generated answer partially addresses the question by indicating that the original information provided did not include the specific type of engine used by the Lider-class icebreaker. While it does not directly answer the question, it does provide some relevant information related to the context, which is the lack of information on the engine type. However, it does not provide any direct or explicit information about the engine type, making it partially relevant."
PARTLY_RELEVANT,"Although the generated answer states that there is no information about the horsepower of the Lider-class icebreaker, which is true, it does not provide any new or relevant information about the class compared to the original answer. The original answer provided more detailed information about the specifications of the Lider-class icebreaker, such as its tonnage, length, beam, and propulsion system. The generated answer does not add any new insights or details, making it partly relevant."
PARTLY_RELEVANT,"The generated answer provides some similar information about Phạm Lê Thảo Nguyên's ranking in the 2017 World Chess Rapid Championship, but it is not a direct match to the original answer. The generated answer only mentions the ranking (xếp hạng 5) and the type of chess event (nội dung cờ nhanh), whereas the original answer also mentions the score ( điểm số 12). Additionally, the generated answer lacks precision in describing Phạm Lê Thảo Nguyên's achievement."
