Relevance,Explanation
PARTLY_RELEVANT,"The generated answer partially relates to the original answer in that both discuss fines/punishments for illegally submitted fake money. However, the generated answer provides specific fine ranges for individuals and organizations, whereas the original answer mentions a fine of 500,000 Vietnam Dong but does not specify the punishment range. The generated answer does not explicitly address the original answer's claim that the fine is not related to the 500,000 Vietnam Dong amount, which makes the answer PARTLY_RELEVANT."
NON_RELEVANT,"The generated answer provides a list of specific penalties (phạt tiền) for violating rules, whereas the original answer specifically mentions a different scenario (vi phạm tiền giả) and a specific fine of 500,000. The generated answer does not address the specific question asked and is largely unrelated to the context and scenario mentioned in the original answer."
PARTLY_RELEVANT,"The generated answer partially relates to the original answer's topic of punishments for fake money. However, it only touches on the specific punishment range (2,000,000 - 15,000,000 VND) whereas the original answer emphasizes the lack of direct correlation between the fine amount (500,000 VND) and the act of not submitting fake money. The generated answer does not address the main concerns or points presented in the original answer, making it partially relevant in a narrow context."
RELEVANT,"The generated answer is relevant to the original answer as it directly addresses the question about the time limit of a lawyer's card, which is also mentioned in the original answer. Although the generated answer does not provide a specific time limit, it still provides information related to the original answer."
RELEVANT,"The generated answer provides additional information and context to the original answer, which is a correct explanation of the lifespan of a lawyer's card. The generated answer explains that a lawyer's card does not have an expiration date but can be revoked or changed according to the law if the lawyer violates the law regulations. The generated answer is closely related to the original answer, clarifying the meaning of the original answer and providing more details."
PARTLY_RELEVANT,"The generated answer partially matches the structure and key statement ('gia hạn thẻ luật sư') of the original answer. However, it does not provide the same information about the long-term value of the lawyer's card, as the original answer states. The generated answer is focused on a specific action to be taken ('gia hạn') rather than the inherent value of the card, which is the main point of the original answer."
PARTLY_RELEVANT,"The generated answer partially addresses the same concern as the original answer, which is the validity of a lawyer's card. However, the generated answer does not provide a direct response to the original answer, instead, it asks a new question about the possibility of a lawyer's card being locked after a certain period. This lack of direct addressing makes the answer only partly relevant to the original question."
PARTLY_RELEVANT,"The generated answer is partly relevant because it addresses the same topic as the original answer, which is the value of a lawyer's card. However, the generated answer's statement that the value is not dependent on time is not directly comparable to the original answer, which simply states that the card has no expiration date. The generated answer could be seen as a slight extension or interpretation of the original answer, but it does not directly answer the same question."
RELEVANT,"The generated answer states that người lao động (workers) have the right to request the opening of a bankruptcy procedure, which is the same topic as the original answer. Although the wording and sentence structure are a bit different, the generated answer provides additional information from the regulation, whereas the original answer only mentions the time limit for filing the request. Therefore, the generated answer is relevant to the original answer."
RELEVANT,"The generated answer directly repeats the original answer's content, word-for-word. Although the generated answer is identical to the original, it still conveys the same information and provides the same answer to the generated question, indicating relevance."
RELEVANT,"The generated answer is identical to the original answer, word-for-word, and captures the same meaning and context. It correctly restates the timeframe within which an employee can request insolvency proceedings when the employer fails to pay wages and other debts. The similarity in content and syntax between the original and generated answers indicates a strong relevance between the two."
RELEVANT,"The generated answer provides the same condition and timeline mentioned in the original answer, indicating that it is highly relevant and basically identical."
RELEVANT,"The generated answer matches the original answer nearly word-for-word, providing the exact same information and context. While it's slightly rephrased, it covers the same key points and retains the core meaning of the original answer."
RELEVANT,"The generated answer correctly identifies the management agency of the wetland reserve as the responsible entity for drafting the management regulations, which is partially similar in content and context to the original answer, but not identical. The original answer specifically mentions 'cơ quan quản lý khu bảo tồn' (management agency of the wetland reserve), while the generated answer is more general, but still conveys the correct information."
RELEVANT,"The generated answer partially repeats the original answer, paraphrasing the same information. The similarity in content and context between the original and generated answers suggests that the generated answer is relevant to the original one."
