Relevance,Explanation
RELEVANT,"The generated answer closely matches the original answer in terms of content and context. It provides the same information about the conditions required for Hà Nội FC to advance to the next round in AFC Cup 2017. The only difference is the addition of a minor rephrase of the last part of the original answer, but this does not affect the relevance of the generated answer. Overall, the generated answer is very similar to the original answer and conveys the same meaning."
RELEVANT,"The generated answer directly addresses the content of the original answer, specifically the conditions for Hà Nội FC to advance to the next round in AFC Cup 2017. Although the wording and phrasing are not identical, the main points and requirements (winning against Felda United and Ceres not getting 3 points against Tampines Rovers) are accurately reflected in the generated answer."
PARTLY_RELEVANT,"The generated answer partially relates to the original answer by mentioning Ceres' required outcome to prevent Hà Nội FC from advancing to the next round. However, the generated answer only lists the necessary conditions for Tampines Rovers, without considering the additional scenarios mentioned in the original answer, such as a draw and a Tampines Rovers win."
NON_RELEVANT,"The generated answer does not address the original question's focus on the influence of Tampines Rovers' win or loss on Hà Nội FC's chances of advancing in AFC Cup 2017. Instead, it makes a contradictory statement that Tampines Rovers' result has no effect on Hà Nội FC, which is not in line with the original answer's discussion of the potential scenarios."
PARTLY_RELEVANT,"The generated answer is partially relevant as it provides the correct information that Hà Nội FC needs to win Felda United to enter the next round. However, it lacks the additional context and conditions mentioned in the original answer, which makes it less relevant to the entire scenario."
RELEVANT,"The generated answer is a paraphrased version of the original answer, retaining the same information and structure. It does not introduce any new or irrelevant information, and the content is directly related to the original answer. The only difference is the rephrasing of the question into a statement, but the overall meaning and context remain the same."
PARTLY_RELEVANT,"The generated answer reproduces the same content as the original answer, but it is actually a copy of the original text. Although it is related to the same topic and provided similar information, it does not offer any additional insights or new perspectives. The answer does not creatively generate new content or provide an original response that adds value to the original answer. Therefore, it is classified as Partly Relevant."
RELEVANT,"The generated answer is highly similar to the original answer, providing the same information about the predicted landfall of Bão số 2 in several provinces. The only difference is that the generated answer is a direct repetition of the original answer, likely due to being a generated question-answer pair. Overall, the generated answer is relevant and accurately conveys the same information as the original answer."
RELEVANT,"The generated answer is identical to the original answer, sharing the same content and context. The question asked about the affected area, and the answer provides the specific provinces that will be impacted by the storm. The relevance is high as the answer directly addresses the question and provides accurate information."
RELEVANT,"The generated answer is highly similar to the original answer, as it provides the exact same information about the expected timing of Bão số 2's landfall. The only difference is that the generated answer is phrased as a response to a question, whereas the original answer is a standalone statement. The content and context of the generated answer match perfectly with the original answer, making it 'RELEVANT'."
RELEVANT,"The generated answer is directly addressing the question and providing the same information as the original answer, which is that HMNZS Te Kaha does not have an integrated anti-ship missile system on board. The answer is identical to the original answer, which indicates a high relevance and similarity between the two."
PARTLY_RELEVANT,"The generated answer provides the correct information about the type of missile (AGM-119) and its range (30-50km), but it focuses only on the details of the missile itself, without mentioning the context of the original answer, which discussed the limitations and attacks on the ship. The generated answer does not provide a balanced view of the original answer and does not convey the same level of nuance."
RELEVANT,"The generated answer summarizes the primary method of attack for HMNZS Te Kaha, which is using the SH-2G Super Seasprite helicopter to deploy AGM-119 missiles. Although it does not explicitly state that the ship cannot attack without the helicopter, the implication is clear. The generated answer is largely consistent with the original answer, partially rephrasing the same information. It misses some additional details mentioned in the original answer, such as the range and limitations of the AGM-119 missiles and the vulnerability of HMNZS Te Kaha without the helicopter. Nevertheless, the generated answer accurately conveys the main point of the original answer, making it relevant to the original context."
RELEVANT,"The generated answer is highly relevant to the original answer as it provides the same information about HMNZS Te Kaha's weapon system, specifically the lack of integrated anti-ship missiles and its reliance on the SH-2G Super Seasprite helicopter. The generated answer also mentions the vulnerability of the ship when the helicopter is shot down, which is also mentioned in the original answer."
RELEVANT,"The generated answer accurately summarizes the information from the original answer about what would happen if the SH-2G helicopter of HMNZS Te Kaha is shot down, specifically mentioning the loss of the anti-ship weapon and inability to attack."
