Relevance,Explanation
PARTLY_RELEVANT,"While the generated answer mentions Thu nhập từ hoạt động kinh doanh, it does not directly address the original answer's focus on Thu nhập của các doanh nghiệp nước ngoài hoạt động sản xuất, kinh doanh tại Việt Nam. Instead, it explains the reason behind the regulations in the Hiệp định tránh đánh thuế hai lần, which is related but not directly corresponding to the original answer."
RELEVANT,"The generated answer is essentially a copy-paste of the original answer, with no modifications or adjustments. It provides the same information and definition of 'Thu nhập từ hoạt động kinh doanh' as the original answer, indicating a high level of similarity and relevance."
RELEVANT,"The generated answer is a verbatim duplication of the original answer, with no modifications or inaccuracies. The content and context of the generated answer match exactly with the original answer, indicating a high level of relevance."
RELEVANT,"Although the generated answer mentions a specific regulation (Nghị định về cấp giấy phép cho doanh nghiệp hoạt động dịch vụ việc làm) and a required timeframe (07 ngày làm việc), it directly addresses the responsibility of the company director to provide information on labor use, which is in line with the original answer. The relevance is not 100% due to the added detail about the specific regulation, but the generated answer still captures the overall idea of the original answer."
RELEVANT,"The generated answer is relevant because it summarizes the main characteristics of the information provided by the director about the labor use situation, which aligns with the original answer. The generated answer mentions the accuracy, timeliness, and compliance with the law, which are the same key points mentioned in the original answer. The generated answer also includes a sentence that repeats the original answer, emphasizing the director's responsibility to provide labor use information according to the law. Overall, the generated answer is a good summary of the original answer and its contents."
RELEVANT,"The generated answer is identical to the original answer, except for the formatting of the sentence structure. The content and information provided in the generated answer are exactly the same as in the original answer, and it accurately answers the generated question."
RELEVANT,"The generated answer is identical to the original answer, providing the same information about the timing of when partners can withdraw funds. The answer fully replicates the original answer, indicating high relevance and similarity."
PARTLY_RELEVANT,"The generated answer partially captures the condition for a member to withdraw their capital, which is also mentioned in the original answer. However, it adds additional information about the requirement for approval from the Council of Members and the notification deadline, which is not present in the original answer. The generated answer also correctly mentions the condition in the original answer, 'chỉ được rút vốn vào thời điểm kết thúc năm tài chính và báo cáo tài chính của năm tài chính đó đã được thông qua', but this information is not unique to the condition and is mentioned separately in the original answer."
RELEVANT,"The generated answer accurately conveys the same information as the original answer, specifically that shareholders can only withdraw funds after the financial report has been approved. The generated answer is a direct response to the generated question, which is also relevant to the original answer. The minor difference in wording does not affect the correctness or relevance of the generated answer."
RELEVANT,"The generated answer is highly relevant to the original answer, as it provides a similar explanation for the limit on withdrawing funds by a member of a limited liability partnership. The generated answer directly addresses the question and provides the same specific condition for withdrawing funds, which is the same as in the original answer."
RELEVANT,"The generated answer is highly similar to the original answer, both in terms of content and context. The generated answer paraphrases the original answer, rephrasing the clause structure and wording slightly, but maintaining the same information and logical flow. The main ideas, relationships between concepts, and key phrases are preserved, making the generated answer relevant to the original answer."
RELEVANT,"The generated answer directly addresses the same topic as the original answer, which is the consequences of abusing official power while handling complaints. The generated answer also provides a clear and concise explanation of the punishment, which is consistent with the original answer."
