Relevance,Explanation
NON_RELEVANT,"The generated answer flatly states that the area of the symbol of priorities for traffic police is not mentioned in the text, which is not relevant to the original answer. The original answer provides a detailed description of the symbol's shape, size, color, and other features. The generated answer is unrelated to the original answer and does not provide any relevant information."
PARTLY_RELEVANT,"The generated answer is relevant in the sense that it tries to address the original question about the length of the arrow on the traffic police badge. However, it is not entirely relevant as it does not provide a specific measurement (23.5 cm) from the original answer, but instead states that the information is not available in relevant regulations. It could be improved by providing a more direct answer or explaining why a specific measure is not available."
NON_RELEVANT,"The generated answer does not provide the requested information about the length of the base of the traffic police badge, instead it provides a context about the regulation of the badge's length in certain scenarios. The generated answer does not provide any relevant or accurate information about the original question, therefore, it is considered NON_RELEVANT."
PARTLY_RELEVANT,"The generated answer partially matches the original answer by mentioning the colors green (xanh lục) and yellow (vàng) which are present in the original answer. However, the generated answer is incomplete as it does not mention the specific details of the symbol of the Public Security Forces on the flag, which is an important part of the original answer."
PARTLY_RELEVANT,"The generated answer partially captures a correct aspect of the original answer, which is the role of the Ủy ban nhân dân cấp xã or phường, thị trấn in setting or suggesting the quota for recruitment. However, it only addresses a specific part of the original answer and does not provide a comprehensive description of the criteria for setting such quotas."
PARTLY_RELEVANT,"The generated answer provides some relevant information about who is involved in developing and proposing the recruitment criteria, but it is not a direct answer to the original question. The original answer states that the criteria are determined by the relevant authority and built by the People's Committee of the commune or ward, town, but the generated answer focuses on the role of the Central Committee of the Vietnamese Fatherland Front and the election councils, which is not directly mentioned in the original answer"
RELEVANT,"The generated answer is highly relevant as it directly addresses the question 'Nghị định nào quy định thẩm quyền lập biên bản vi phạm hành chính trong hoạt động Khoa học và công nghệ?' and provides the same information as the original answer. The wording and phrasing are almost identical, indicating a strong similarity in content and context."
PARTLY_RELEVANT,"The generated answer is partly relevant as it mentions the concept of 'người có thẩm quyền' (person with authority) who can write a fine in scientific and technological activities, which is a part of the original answer. However, the answer goes on to explain a different type of processing ( xử phạt, punishment) and context (ngữ cảnh 2, context 2), which is not present in the original answer. The generated answer partially aligns with the original answer, but also adds new and irrelevant information."
PARTLY_RELEVANT,"The generated answer partially aligns with the original answer by mentioning that there are certain agencies (Ủy ban nhân dân cấp tỉnh và các cơ quan có thẩm quyền khác) that are responsible for inspecting and prosecuting violations of law in the field of science and technology. However, it does not provide the full range of relevant agencies specified in the original answer (các công chức, viên chức trong các cơ quan quy định tại các điều từ Điều 28 đến Điều 34 của Nghị định this) and also does not provide the specific legal framework (Nghị định) as mentioned in the original answer. Therefore, the relevance is considered PARTLY_RELEVANT as it only captures a part of the information provided in the original answer."
RELEVANT,"The generated answer is highly similar to the original answer, as it provides the same information about the entities with authority to create a record of administrative offenses in the field of science and technology, as well as their responsibilities. The generated answer accurately reflects the original answer's content and structure, indicating a high level of relevance."
RELEVANT,"The generated answer directly references the specific regulation (Thông tư số 40/2013/TT-BNNPTNT) and the content about endangered species, which is identical to the original answer. The generated answer also maintains the same structure and terminology, indicating a high level of relevance and similarity to the original answer."
