Relevance,Explanation
RELEVANT,"The generated answer is a direct duplicate of the original answer, stating the exact same score of 3-0 for the first match between MU and Basel in the Champions League."
RELEVANT,"The generated answer matches the original answer '3-0' in terms of score, as well as providing contextual information about the match (Champions League 2017/2018, first leg). The answer is specific, accurate and relevant to the original question. The only difference is the additional descriptive words, which do not affect the relevance of the answer."
RELEVANT,"The generated answer is highly relevant to the original answer because it provides the exact score of the first match between Basel and MU in the Champions League 2017/2018, which is 3-0, just like the original answer. The generated answer even mentions that the score is biased towards MU, which is a minor but accurate detail that matches the original answer."
NON_RELEVANT,"The generated answer is unrelated to the original answer, which discusses the Arsenal fans waiting for the 5th day to watch the game while the generated answer mentions there is no information about the schedule of Arsenal players, which is a different topic"
RELEVANT,"The generated answer accurately states that Arsenal fans are waiting for the Europa League, which is directly related to the original answer mentioning that Arsenal fans are those who are patiently waiting for the night of the 5th to play but in the Europa League."
RELEVANT,"The generated answer is very similar to the original answer, both mentioning the fans of Arsenal, their emotions during a UEFA Europa League match, and the reason for their silence. The only difference is the mention of the Champions League in the original answer, which is not present in the generated answer. However, the overall context and topic are similar, making the generated answer relevant to the original one."
PARTLY_RELEVANT,"The generated answer partially addresses the generated question, but it diverts from the original context and answer. While it acknowledges that the fans of Arsenal were quiet, it focuses on the lack of information in the context rather than providing a direct answer to the question. The original answer talks about the reason for the subdued atmosphere, which is due to the team playing in the Europa League on a Friday night. The generated answer misses this important detail and provides a generic explanation."
NON_RELEVANT,"The generated answer is about Manchester United and their group stage opponents in the Champions League, which is unrelated to Arsenal and the Europa League mentioned in the original answer. The context and content of the generated answer do not match the topic and details provided in the original answer."
RELEVANT,"The generated answer, 'Trận đấu giữa Quảng Nam và B. Bình Dương diễn ra lúc 17h.' is highly relevant to the original answer because it specifically mentions the time of the match between Quảng Nam and B. Bình Dương, which is also mentioned in the original answer. The answer is accurate and matches the original content, indicating a high degree of relevance."
NON_RELEVANT,"The generated answer is not related to the original answer. The original answer provides information about the schedule of V-League matches in Vietnam, while the generated answer is a response to a question about the channel broadcasting a specific match, which is not mentioned in the original answer."
RELEVANT,"The generated answer contains the correct information about the match between TP HCM and SHB Đà Nẵng, which is one of the matches mentioned in the original answer. Although the format and wording are different, the essential details are similar."
RELEVANT,"The generated answer accurately provides the scheduled teams and match timing for 18:30 hours, which is a key piece of information closely related to the original answer. The generated answer matches the original answer in terms of the teams and match timing, indicating high relevance."
RELEVANT,"The generated answer accurately extracts the time of the match 'Than Quảng Ninh - Cần Thơ' from the original answer, which matches one of the matches listed in the original answer. The generated answer is concise and relevant to the original answer, making it highly relevant."
RELEVANT,"The generated answer is a direct repetition of the original answer, providing the same information and context about William Shakespeare and the quote 'Yêu mọi người, tin vài người và không hại ai cả'. The generated answer is identical to the original answer, making it highly relevant and accurate."
