Relevance,Explanation
PARTLY_RELEVANT,"The generated answer partially relates to the original answer as it correctly identifies the cup/league where Real Madrid and Barcelona meet as 'Siêu kinh điển', also known as the El Clásico. However, it fails to provide information about the match date and time, which is crucial information mentioned in the original answer."
RELEVANT,"The generated answer is highly similar to the original answer, providing the same information about the match date, time, and league. The only difference is the rephrased question from the input data, indicating a correct understanding of the original answer and its relevance remains high."
RELEVANT,"The generated answer is a perfect match to the original answer, containing the exact same information, including the date, time, and match details. The format and structure of the answer are also identical, indicating a high level of relevance and similarity."
RELEVANT,"The generated answer closely matches the original answer in terms of content and context. Both answers mention Triều Tiên's development of the KN-17 missile, its ability to attack mobile targets, and its potential to carry nuclear warheads. The generated answer even uses similar wording, such as 'triều tiên đang nghiên cứu loại vũ khí' and 'Triều Tiên đang phát triển tên lửa'. However, the generated answer is not a verbatim copy of the original answer, as it has been rewritten and rephrased to be more concise and question-oriented."
RELEVANT,"The generated answer accurately mentions the name of the missile being developed by North Korea, KN-17, which is the same as mentioned in the original answer. The generated answer also shares the context of the purpose of the missile being for attacking a USA carrier, which is partially mentioned in the original answer. Although the generated answer does not provide the entirety of the original answer's context, it is still relevant to the original answer."
RELEVANT,"The generated answer is highly relevant to the original answer as it directly addresses the question of what type of warhead North Korea can attach to the KN-17 missile, and specifically mentions a nuclear warhead, which is mentioned in the original answer. The answer is accurate and closely matches the information provided in the original answer."
RELEVANT,"The generated answer is a direct quote from the original answer, and it addresses the same topic and question. While the wording and reordering of sentences are slightly different, the main idea and information are identical to the original answer, making it highly relevant."
RELEVANT,"The generated answer is highly relevant to the original answer as it repeats the same information about the expert's evaluation of North Korea's KN-17 missile development. The wording and sentence structure are very similar, making it clear that the generated answer is a paraphrased version of the original. The content is identical, and the only difference is a slight rephrasing of the sentence."
RELEVANT,"The generated answer is identical to the original answer, with no deviations in content or context. The similarity between the two is almost 100%, making it a valid and relevant response."
RELEVANT,"The generated answer is relevant to the original answer as it discusses the same topic, which is the potential consequences and responsibilities of a company when it has the conditions to distribute dividends but fails to arrange funds. The generated answer elaborates on the difficulties the company may face and provides potential solutions, such as developing long-term financial plans, improving business efficiency, and seeking new funding sources. Although the generated answer does not cover all the information from the original answer, it stays focused on the same theme and provides new insights, making it relevant to the original answer."
RELEVANT,"The generated answer provides additional context and suggestions to ensure the timely distribution of dividends, in line with the original answer's emphasis on having mechanisms in place for personal responsibility and timely decision-making. While the specific points discussed differ, the overall purpose and theme of ensuring the correctness and timeliness of dividend distribution is maintained."
RELEVANT,"The generated answer accurately mentions two components of Japan's missile defense system, specifically the SM-3 and PAC-3 missiles. Although it omits some details present in the original answer, such as the fact that SM-3 is deployed on Kongo-class destroyers and the mention of THAAD and radar AN/TPY-2, the generated answer still maintains the core information regarding Japan's missile defense system."
RELEVANT,"The generated answer discusses the radar system used in Japan's missile defense system, which is a specific detail mentioned in the original answer. Although the generated answer is concise and only discusses the radar aspect, it corresponds to the original answer and provides similar information on the type and distribution of radar systems used in Japan's missile defense system."
