Relevance,Explanation
RELEVANT,"The generated answer is highly similar to the original answer, both in terms of content and context. The same specific groups are mentioned ('lực lượng dân quân 'chống Balaka' người Cơ đốc giáo và các tay súng Hồi giáo thuộc lực lượng Seleka'), and the same date and location are referenced ('ngày 20/6 tại thị trấn Bria của Cộng hòa Trung Phi'). This suggests that the generated answer accurately responds to the question and provides relevant information."
RELEVANT,"The generated answer is identical to the original answer, including the same words and structure. The language used is also similar, indicating a high level of similarity and relevance between the two answers."
RELEVANT,"The generated answer contains the same information as the original answer, mentioning the same forces ('lực lượng dân quân 'chống Balaka' người Cơ đốc giáo và các tay súng Hồi giáo thuộc lực lượng Seleka') and the same event ('cuộc đụng độ') on the same date ('Ngày 20/6') and location ('thị trấn Bria của Cộng hòa Trung Phi'). The structure and wording of the sentences are also very similar, indicating a high degree of relevance and similarity between the generated and original answers."
RELEVANT,"The generated answer closely follows the original answer's structure and conveys the same ideas. It accurately restates the original answer's main points, including the reasons behind Germany's decision to move the gold reserves home, such as the end of the Cold War and the removal of concerns about Soviet control. The generated answer also includes some additional details from the original text, like the mention of no longer needing to keep gold in Paris as a precaution. The only minor difference is the use of the phrase 'hồi hương' (back to the homeland) which is not present in the original answer. Overall, the generated answer is highly relevant to the original answer."
RELEVANT,"The generated answer accurately captures the main reasons for Germany's decision to repatriate its gold reserves, which are 'xây dựng “sự tin tưởng và tự tin” của người dân’ and ‘thừa nhận rằng thời đại đã thay đổi’. The language used is similar to the original answer, and the same key points are emphasized. The only minor difference is the order in which the reasons are presented, but this does not affect the overall relevance of the answer."
RELEVANT,"The generated answer is mostly similar to the original answer in terms of content and context. It accurately mentions the reason for Germany's decision to transfer its gold reserves from abroad, namely the end of the Cold War and the change in times. The additional sentence about France and Germany using the euro as their currency is also present in the original answer. However, the wording and structure of the generated answer are not identical to the original answer, which is why it is not simply a copy-paste job."
NON_RELEVANT,"The generated answer provides a different location for the accident site compared to the original answer. Specifically, the original answer states that the accident occurred at Km 203 on the Pháp Vân - Cầu Giẽ highway in Thường Tín district, while the generated answer mentions the Nguyễn Hữu Cảnh bridge in Bình Thạnh district, Ho Chi Minh City, which is completely unrelated to the original location."
PARTLY_RELEVANT,"The generated answer provides specific timing information (1h30' rạng sáng ngày 23/9), but the date and location mentioned are different from the original answer (24/11, Km 203 đường cao tốc Pháp Vân - Cầu Giẽ, xã Vân Tự, huyện Thường Tín). The generated answer is relevant in terms of providing timing information, but lacks the other important details mentioned in the original answer."
NON_RELEVANT,"The generated answer is about a different location and situation altogether, unrelated to the original answer which describes a fatal accident on the Pháp Vân - Cầu Giẽ highway in Hà Nam province. The generated answer talks about a separate accident on Nguyễn Hữu Cảnh street in TP.HCM, making it non-relevant to the original answer."
