Relevance,Explanation
NON_RELEVANT,"The generated answer provides unrelated information about certificates and documents related to civil lawsuits and international judicial assistance, which is not mentioned in the original answer. The original answer specifically lists documents such as identification cards, national ID cards, and passports, whereas the generated answer contains entirely different types of documents."
NON_RELEVANT,"The generated answer completely contradicts the original answer. The original answer lists specific documents required when submitting a file to participate in research, manufacturing, production, or repairing weapons, while the generated answer states that no documents are required. This has no connection to the original context and is not relevant."
PARTLY_RELEVANT,"Although the generated answer mentions the same policy (Thông tư số 338/2016/TT-BTC), it discusses a different content aspect (ra soát, đánh giá các thủ tục hành chính) compared to the original answer, which focuses on the content and scope of policy support for students and entrepreneurs. The generated answer is partially relevant as it still relates to the same policy, but the content is not directly equivalent to the original answer."
RELEVANT,"The generated answer provides the date of issuance of the same regulations mentioned in the original answer, which is a key piece of information. Although the format and context are slightly different, the generated answer is directly related to the original answer and provides the same information in a slightly modified form."
RELEVANT,The generated answer is highly relevant to the original answer as it directly quotes the same regulation number (Thông tư số 338/2016/TT-BTC) and provides the same information about the Ministry of Finance's regulation on supporting students and pupils in starting a business.
PARTLY_RELEVANT,"The generated answer is partially relevant as it touches on the topic of support for students and startup, but it does not accurately reflect the original answer. The original answer states that the contents and expenditures for supporting students and startup are regulated by the Finance Ministry's Circular No. 338/2016/TT-BTC, whereas the generated answer provides specific examples of training materials and resources without referencing the regulatory document."
NON_RELEVANT,"The generated answer directly contradicts the original answer, stating that Thông tư số 338/2016/TT-BTC has no relation to the activities of học sinh, sinh viên, while the original answer implies that the decree regulates policies to support students and start-ups. The generated answer lacks relevance and accuracy in relation to the original answer."
RELEVANT,"The generated answer is relevant to the original answer as it directly quotes the conditions under which a verbal will takes effect, which is the main point of the original answer. The generated answer provides a clear and concise statement of the relevant law, without adding any new information or context that would make it less relevant."
RELEVANT,"The generated answer is identical to the original answer, providing the same information and conclusion. The only difference is the phrasing of the question in the generated answer, but the answer itself is identical to the original answer."
PARTLY_RELEVANT,"The generated answer partially addresses the original answer's content. It mentions the importance of the testator's mental faculties during the creation of the will and the absence of coercion. However, it does not directly address the specific timeframe of 03 months mentioned in the original answer, which is a crucial aspect of the original answer's content."
PARTLY_RELEVANT,"The generated answer explains the term 'minh mẫn, sáng suốt' in the context of oral will, but it is not directly related to the original answer's statement about the revocation of an oral will after 3 months. The generated answer provides additional information that is relevant to the concept, but it is not a direct response to the original answer's focus on revocation."
RELEVANT,"The generated answer is highly relevant to the original answer. The original answer mentions that if someone is still alive, conscious, and in their right mind 3 months after making an oral will, the oral will is considered null and void. The generated answer mentions an exception to this rule, which is the case where someone's life is in danger and they cannot make a written will. The generated answer also quotes the same condition from the original answer, making it a strong connection between the two."
