Relevance,Explanation
RELEVANT,"The generated answer is identical to the original answer, sharing the same information and providing the same details about the resignation of Nicholas Holgate as a result of the Grenfell Tower fire and the pressure from the UK government. The answer maintains the same context and relevance to the generated question."
RELEVANT,"The generated answer, 'Vụ hỏa hoạn Grenfell Tower đã khiến ít nhất 80 người thiệt mạng', matches the original answer, 'Giám đốc điều hành Hội đồng khu vực Kensington và Chelsea ở London, ông Nicholas Holgate, đã từ chức sau vụ cháy tòa nhà chung cư cao tầng Grenfell Tower khiến ít nhất 79 người thiệt mạng hồi tuần trước.', in terms of the number of people killed in the Grenfell Tower fire, which is the main topic of the original answer. The generated answer only differs in the exact number, being 80 instead of 79, which is a minor discrepancy."
RELEVANT,"The generated answer provides the correct information about the Director of the Kensington and Chelsea Regional Council, which is consistent with the original answer. The only deviation is that the generated answer is asking the same question again instead of providing a direct answer. However, the content and context of the answer are identical, making it still relevant."
NON_RELEVANT,"The generated answer is a rephrased version of the original question, lacking any relevant information about the rating of the Grenfell Tower fire. The original answer provided information about the resignation of Nicholas Holgate and the government's pressure, while the generated answer only asks about the rating of the fire and does not provide any relevant information."
RELEVANT,"The generated answer is almost identical to the original answer, providing the exact same information about the number of patients being treated at the hospital, including the breakdown of patients with SXHD. The only minor difference is the use of 'số bệnh nhân' instead of 'hiện tại, có gần 346 bệnh nhân', but it does not affect the overall accuracy and relevance of the answer."
RELEVANT,"The generated answer is highly relevant to the original answer as it provides the exact number of patients with sickle-haemoglobin disease (SXHD) being treated as inpatients at the Central Hospital for Tropical Diseases, which is the same information as the original answer."
RELEVANT,The generated answer accurately extracts the target information ('242 bệnh nhân SXHD đang điều trị nội trú') from the original answer and provides a similar context ('Bệnh viện Bệnh Nhiệt đới Trung ương'). The only difference is the numerical approximation ('gần' meaning 'almost') which does not significantly impact the answer's relevance.
RELEVANT,"The generated answer closely matches the original answer in terms of content and structure. It provides the exact number of patients being treated at the hospital, which is the same as the original answer. The only minor difference is the inclusion of SRVD in the generated question, but this does not impact the overall relevance of the answer. Overall, the generated answer accurately responds to the original question and is considered relevant."
RELEVANT,"The generated answer is very similar to the original answer in terms of content and context. The same reasons for the bus driver's suspension are mentioned in both answers, and the wording is almost identical. The generated answer is a direct copy of the original answer, which indicates a high level of relevance and similarity."
RELEVANT,"The generated answer is highly similar to the original answer, rephrasing the original sentence with minor variations in wording. The key information and facts mentioned in the original answer, such as the bus number, location, violations, and regulations, are accurately transferred and presented in the generated answer. The relevance and similarity between the two answers are high, indicating that the generated answer is relevant to the original answer."
RELEVANT,"The generated answer accurately summarizes the original answer, repeating the same list of reasons (chạy ngược chiều, phóng nhanh, bỏ trạm không đón khách theo quy định) that led to the bus driver's suspension. The generated answer maintains the same structure and content as the original answer, making it highly relevant."
RELEVANT,"The generated answer provides specific details about the violations committed by the bus driver, including running counter-flow, not picking up passengers at designated stops, and excessive speeding, which are directly mentioned in the original answer. Although the generated answer provides additional details not present in the original answer, it still conveys the same general information and relevance to the original answer."
RELEVANT,"The generated answer includes all the same details as the original answer, including the reasons for the bus driver's license being suspended. The only difference is the phrase 'tuyến 81' vs 'xe buýt số 81', which is a minor variation in the way the bus route is referred to. Overall, the generated answer accurately addresses the question and provides similar information as the original answer."
