Relevance,Explanation
RELEVANT,"The generated answer is relevant to the original answer as it directly answers the generated question, providing the same information about the reasons behind Otto Warmbier's family's decision not to perform a comprehensive autopsy. The generated answer even repeats the original answer, indicating a high degree of similarity and relevance."
PARTLY_RELEVANT,"The generated answer provides some relevant information about symptoms of food poisoning from catfish, but it is not directly related to the methods of treatment mentioned in the original answer. The generated answer does not mention anything about using trám, dầu hạt cải, rễ cỏ tranh, or nước lá khoai lang non to treat the symptoms."
RELEVANT,"The generated answer is relevant to the original answer as it directly addresses the question 'Ngoài hạt trám, còn có những biện pháp nào khác để giải độc cá nóc?' and provides similar methods to detoxify the fish. The content is almost identical to the original answer, with a few minor changes. The similarity in structure, vocabulary, and tone suggests that the generated answer is a paraphrased version of the original text, making it relevant to the original answer."
RELEVANT,"The generated answer is relevant because it provides a valid use of rễ cỏ tranh tươi to treat ngộ độc cá nóc, which is also mentioned in the original answer. The generated answer includes similar information about the amount of rễ cỏ tranh tươi to use and the method of preparation (giã nát lấy nước or sắc nước cỏ tranh khô), which matches the original answer. However, the generated answer does not provide a comprehensive list of methods to treat ngộ độc cá nóc like the original answer, but it addresses one specific method mentioned in the original answer."
PARTLY_RELEVANT,"The generated answer is partially relevant to the original answer as it does mention the alternative methods of removing the poison, such as using dầu hạt cải and cỏ tranh. However, it is not a direct answer to the generated question about replacing hạt trám with another herb. The generated answer still mentions the original methods from the original answer, but does not provide a clear and direct answer to the question."
NON_RELEVANT,"The generated answer does not address the main question about where to buy the detox remedies for night blooming jasmine poisoning. Instead, it provides a general statement about the lack of specific information on where to buy the remedies, which is not relevant to the original answer that provides concrete methods for detoxification."
RELEVANT,"The generated answer is identical to the original answer, indicating that it accurately reflects the information required to answer the question, making it relevant to the context and content of the original answer."
RELEVANT,"The generated answer is identical to the original answer, which means it directly responds to the generated question and conveys the same information as the original answer, making it highly relevant to the original answer."
NON_RELEVANT,"The generated answer denies the existence of information about Mitchell Weiser's team, while the original answer is actually providing specific information about Mitchell Weiser's team, which is U21 Đức. The generated answer is unrelated to the original answer and is not relevant at all."
RELEVANT,"The generated answer is almost identical to the original answer, with only minor differences in word order and phrasing. The key information, i.e., Mitchell Weiser being the scorer of the final goal, is correctly retrieved and generated. The similarity in content and context between the generated and original answers indicates a high level of relevance."
RELEVANT,"The generated answer is relevant to the original answer as it mentions Mitchell Weiser and the U21 Germany team, which are identical to the original answer. The generated answer also provides the same detail, that Mitchell Weiser is the one who scored the winning goal. The only difference is the rephrased sentence structure, making it similar but not identical to the original answer. Overall, the generated answer conveys the same meaning and information as the original answer."
RELEVANT,"The generated answer accurately mentions three books written by Woo Bo Hyun, which are also mentioned in the original answer. Although the original answer provides more detailed information about Woo Bo Hyun's literary works, the generated answer is relevant as it does cover the core information about his books."
RELEVANT,"The generated answer directly extracts the information from the original answer regarding the companies that have collaborated with Woo Bo Hyun. The answer is accurate and relevant to the original question, providing the specific details about the companies mentioned in the original answer, including Tây Ban Nha, Nhật Bản, and Đài Loan."
RELEVANT,"The generated answer mentions most of the media outlets where Woo Bo Hyun is a commentator, which matches the original answer. The only difference is that the generated answer focuses on the television channel Ariang TV, not the publishing activity mentioned in the original answer."
PARTLY_RELEVANT,"The generated answer partially matches the context of the original answer by mentioning Woo Bo Hyun's focus on the Spanish market. However, it also adds additional information not present in the original answer, specifically the discussions with Japanese and Taiwanese markets, which does not exist in the original text. As a result, the relevance is not complete, but it still shares some similarities with the original answer."
