Relevance,Explanation
PARTLY_RELEVANT,"The generated answer provides a similar structure to the original answer, stating the same processor type (Snapdragon 660 64 bit). However, it's not identical as the original answer is part of a sentence whereas the generated answer is a standalone answer. Furthermore, the context is slightly different as the generated answer is in response to a question whereas the original answer is a part of a sentence."
RELEVANT,"The generated answer accurately matches the original answer, providing the same information about the processor (Snapdragon 660 64 bit) of the HTC U11 Life. The similarity in content and context is high, making the generated answer relevant to the original answer."
PARTLY_RELEVANT,"The generated answer mentions the correct Snapdragon 660 processor, but it is not a direct copy of the original answer. The original answer mentions that the HTC U11 Life will be equipped with the Snapdragon 660 processor, whereas the generated answer answers a different question that asks about the processor's category (it belongs to the Snapdragon 660 line). While the information is correct, the generated answer does not directly address the original answer's content and context, which is about the phone's specifications, rather than specifications of the processor."
RELEVANT,"The generated answer is highly relevant to the original answer as it provides the exact same information about the features of the McLaren P1, including the active rear spoiler, butterfly doors, and 7-speed dual-clutch transmission. The only additional information provided in the generated answer is the fact that the car has only 620km and still has its original condition. This extra information does not detract from the relevance of the answer but rather provides a more specific and detailed description of the car's condition."
RELEVANT,"The generated answer provides specific information about the design feature of the McLaren P1, which is mentioned in the original answer. The original answer describes the unique butterfly-door design of the car, and the generated answer confirms this detail. Although it does not provide all the details mentioned in the original answer, it still addresses the question about the door design and is therefore relevant."
RELEVANT,"The generated answer is relevant to the original answer as it directly quotes a specific detail mentioned in the original answer, which is the mileage of the vehicle. The generated answer provides an identical value (620 km) to the original answer, accurately conveying the same information."
RELEVANT,"The generated answer focuses on the transmission type of the McLaren P1, which is one of the advanced features mentioned in the original answer. It directly answers the question and provides the same information as the original answer, making it relevant and accurate."
PARTLY_RELEVANT,"The generated answer partially repeats the original answer's content, but with more details and analysis added. It summarizes the information provided in the original answer, stating that the McLaren P1 is still original and has only been driven 620 km. However, it does not exactly match the original answer's content, which was more descriptive, providing information about the car's features and condition."
RELEVANT,"The generated answer is identical to the original answer, word-for-word. It accurately responds to the generated question and conveys the same meaning as the original answer, indicating high relevance."
RELEVANT,"The generated answer is highly similar to the original answer, as it accurately recreates the same sentence structure and content. The generated answer provides a logical reason for why Đức Phúc would post a photo of himself on Facebook, which is in line with the original answer's statement about him posting the photo to assert his real appearance. The main difference is the repetition of the same sentence, but the ideas and information presented are identical, making the generated answer highly relevant to the original answer."
PARTLY_RELEVANT,"The generated answer contains a portion of the original answer, specifically the mention of Facebook and the context of confirming the true beauty, but it does not entirely replicate the original answer. The original answer provides a complete sentence, while the generated answer only provides a truncated and rephrased version of it."
RELEVANT,"The generated answer accurately summarizes the original answer, providing the same information about the photo that Đức Phúc posted on his personal Facebook account, which confirms his current appearance."
