Relevance,Explanation
PARTLY_RELEVANT,"Although the generated answer mentions Minh Tú's ranking in a context related to beauty, it does not directly answer the question. The question asks if Minh Tú is considered one of the three most beautiful people in Asia, and the generated answer neither confirms nor denies this, instead providing an unclear response. The relevance is partly due to the mention of Minh Tú's ranking, but the answer lacks clear relevance to the original question."
RELEVANT,"The generated answer is a direct replica of the original answer, with identical wording and content, signifying high relevance and accuracy."
RELEVANT,"The generated answer is almost identical to the original answer, and it correctly describes the main actions of the robot during the Robocon 2017 competition, which includes tossing the main disc to make the ball fall and then tossing other discs to the receiving area to score points. The generated answer maintains the same content and structure as the original answer, indicating significant relevance and similarity between the two."
RELEVANT,"The generated answer is highly similar to the original answer and provides the same information, with nearly identical words and structure. The only minor difference is that the generated answer is framed as a direct answer to the question, whereas the original answer is part of a larger narrative. Overall, the generated answer accurately captures the key requirement of the robot in the Robocon 2017 competition, making it relevant to the original answer."
RELEVANT,"The generated answer is an exact match with the original answer, conveying the same information and explaining how to score points in the Robocon 2017 competition. The only difference is that the generated answer is a response to a question, whereas the original answer is a statement. The relevance is high as the generated answer accurately answers the question and is similar in content and context to the original answer."
RELEVANT,"The generated answer is similar to the original answer, as it also mentions the tasks of throwing balls and scoring by throwing disks onto a specific area. The generated answer is a paraphrased version of the original answer, with some minor changes in wording, but still conveys the same information."
RELEVANT,"The generated answer is a direct quote of the original answer, which is exact and matches the original sentence structure."
RELEVANT,"The generated answer is relevant because it provides the same information as the original answer, which is that Urinboev Zabikhillo was injured after a match against U23 Myanmar and therefore couldn't play against U23 Vietnam. The answer is structured similarly and conveys the same meaning as the original answer, making it relevant to the question."
NON_RELEVANT,"The generated answer is a direct rejection of providing information about the U23 Uzbekistan and U23 Myanmar match result, which is unrelated to the original answer that mentions an injury of Urinboev Zabikhillo after a match with U23 Myanmar. The generated answer does not provide any relevant information about the topic."
NON_RELEVANT,"The generated answer refers to a different match between U23 Uzbekistan and U23 Vietnam, mentioning the current date (13-12) and time, whereas the original answer talks about Zabikhillo Urinboev's injury after a match with U23 Myanmar. The generated answer is not related to the original context or question."
PARTLY_RELEVANT,"The generated answer is partly relevant as it acknowledges the lack of information about Urinboev Zabikhillo's position. It provides some context by mentioning that there is no information available, which is indirectly related to the original answer. However, the answer does not directly answer the question asked about Urinboev Zabikhillo's position, making it partially relevant."
RELEVANT,"The generated answer accurately summarizes the key information about the market behavior of Asian stocks on July 11th, including the notable gains in MIAPJ0000PUS and the moderate performance of the Nikkei 225 and Australian stocks. The answer also briefly mentions the changes in Chinese stocks, which is in line with the original text. The only minor deficiency is the lack of specific data on other stock indices and oil prices, but overall, the generated answer captures the essence of the original text."
PARTLY_RELEVANT,"The generated answer partially relays the same information as the original answer, mentioning the Asian stock market's growth and the increased values of specific indices. However, it lacks some details and context present in the original answer, such as the information about oil prices and the implications of the Federal Reserve's decisions. The generated answer provides a summary of the stock market's performance, but does not cover the entire scope of the original answer."
PARTLY_RELEVANT,"The generated answer is partially relevant as it provides a specific detail about the Nikkei index, specifically its increase on 11/7. However, it lacks context and does not provide a comprehensive overview of the market trends and events, which are present in the original answer."
PARTLY_RELEVANT,"The generated answer is relevant in the sense that it addresses the specific question asked and provides a correct factual statement. However, the answer only provides a negative response (namely, that the percentage increase is not provided) rather than providing the actual percentage increase, which is the main relevant information in the original answer."
