Relevance,Explanation
PARTLY_RELEVANT,"The generated answer mentions Hoàng Hương Giang's personal information but does not have direct relevance to the original answer's mention of friends or hobbies. The answer also seems unrelated to the question about the number of girlfriends, which was not mentioned in the original answer."
PARTLY_RELEVANT,"The generated answer is partly relevant because it acknowledges that the additional information about Hoàng Hương Giang's other interests is not provided in the given context. However, the answer does not provide any relevant or meaningful information about Hoàng Hương Giang's other interests, which reduces its overall relevance."
RELEVANT,"The generated answer is highly relevant to the original answer. The original answer mentions Á hậu Huyền My's role in the film 'Cây cầu trên mây' and her pairing with Nay Toe, which is precisely the same information presented in the generated answer. The answer's content and context closely match the original answer, indicating a strong relevance."
RELEVANT,"The generated answer is a direct quote from the original answer, providing the name of the movie ('Cây cầu trên mây') that Huyền My acted in, which is the main topic of the original answer. The generated answer accurately responds to the generated question, showing high relevance to the original answer."
RELEVANT,"The generated answer and the original answer share the same content, with the generated answer being a direct response to the generated question. The answer correctly identifies Nay Toe as the male actor who co-starred with Á hậu Huyền My in the Myanmar film, which is a key piece of information from the original answer."
NON_RELEVANT,"The generated answer does not contain any information related to the original answer. The original answer provides details about Á hậu Huyền My and her participation in a film festival, while the generated answer appears to be a statement about the relevance of information in a given context, which is unrelated to the original answer."
RELEVANT,"The generated answer is a paraphrased version of the original answer, providing the same information about the year when 5 banks listed on the stock exchange. The only difference is that the generated answer is more concise and straightforward, while the original answer provides more details about each bank's listing date. The content and context of the generated answer are highly relevant to the original answer."
NON_RELEVANT,"The generated answer is identical to the generated question, which means it does not provide any relevant information or answer to the original question. The original answer provides a list of 5 banks that listed their stocks on stock exchanges in 2017, whereas the generated answer is just a rephrase of the question."
RELEVANT,"The generated answer correctly identifies VPBank (VPB) as the bank listed on HOSE in 2017, which is consistent with the original answer. The generated answer focuses on the specific question being asked and provides the correct information, making it relevant to the original answer."
RELEVANT,"The generated answer accurately extracts the information from the original answer regarding the banks listed on UPCoM. It correctly mentions VIB, Kienlongbank (KLB), LienVietPostBank (LPB), and BacABank (BAB) as the banks listed on UPCoM, which is in line with the original answer. The answer is not entirely identical to the original, but it conveys the same information in a slightly rephrased manner, indicating relevance."
NON_RELEVANT,"The generated answer incorrectly states that Nacho scored the first goal for Sevilla, which is actually wrong. Nacho scored a goal for Real Madrid, not Sevilla. The original answer clearly mentions that Jovetic scored the only goal for Sevilla. The generated answer does not provide any relevant information to answer the original question."
RELEVANT,"The generated answer contains the same information as the original answer, including the score and the names of players who scored goals. The only difference is that the generated answer provides more detailed information about the goals, which is not present in the original answer. Due to the accurate and relevant information provided in the generated answer, it is classified as RELEVANT."
NON_RELEVANT,"The generated answer is a question being answered, which is a drastic departure from the original answer, which provides details about the match result, scorers, and timing. The generated answer does not provide any relevant information about the match, making it non-relevant to the original answer."
