Relevance,Explanation
RELEVANT,"The generated answer is highly relevant to the original answer as it directly addresses the question 'James Bulger bao nhiêu tuổi khi bị hại?' and provides the correct answer '3 tuổi', which is the same answer as the original answer. The generated answer is a verbatim copy of the question, which suggests that the RAG system has relied heavily on the input question to generate the answer."
RELEVANT,"The generated answer is a direct quote from the original text and provides the same information, which indicates a high degree of relevance and similarity to the original answer."
RELEVANT,"The generated answer is similar to the original answer, providing the same reasons for the decrease in crude oil price due to Hurricane Harvey's impact on oil refineries and demand, including the 25% reduction in US oil refinery capacity. The answer is precise and consistent with the original answer, indicating high relevance."
PARTLY_RELEVANT,"Although the generated answer mentions the effect of Hurricane Harvey on oil demand and refinery capacity, it also introduces unrelated information about a fatal accident in Pakistan. The key points about oil demand and refinery capacity are relevant to the original answer, but the additional information is not."
RELEVANT,"The generated answer captures the core information from the original answer, specifically the impact of Hurricane Harvey on the oil refining process and the resulting 25% decrease in oil refining capacity. While the generated answer is concise and to the point, it lacks the additional context and details provided in the original answer, which mentions the global oil demand and supply disruptions. Nevertheless, the generated answer is relevant and accurately responds to the generated question."
RELEVANT,"The generated answer is highly similar to the original answer in terms of content and context. Both answers convey Taylor Muhl's decision to publicly disclose her Chimerism case to promote self-acceptance and confidence in others who may have similar differences. The generated answer even uses the same phrases and sentences as the original answer, indicating a high degree of relevance and similarity."
RELEVANT,"The generated answer is very similar to the original answer in terms of content and context. It conveys the same message and idea, and uses almost identical phrases and wording. The only difference is that the generated answer provides a slight rewording and rephrasing of the original answer, but the meaning and intent remain the same."
RELEVANT,"The generated answer is highly similar to the original answer in terms of content and structure. Both answers mention three main reasons why food on a plane is often rated higher than on land, and the same reasons are listed in the same order. The only minor difference is the rephrasing of the original text, which does not affect the overall relevance of the answer."
PARTLY_RELEVANT,"The generated answer partially matches the content and context of the original answer. It addresses the same question and mentions the same factors that influence taste, including pressure and humidity. However, the generated answer focuses more on the physiological response to high altitude, citing Professor Charles Spence, whereas the original answer provides a more general explanation for the perceived difference in taste. The generated answer adds some specific details about the senses being affected, but lacks the overall context and explanations provided in the original answer."
