Relevance,Explanation
PARTLY_RELEVANT,"The generated answer is partially relevant because it mentions 'miễn phí' as the original answer does. However, the generated answer also adds additional information about the type of business it applies to (doanh nghiệp nhỏ và vừa), which is not present in the original answer."
RELEVANT,"The generated answer directly responds to the generated question, matching the original answer 'Miễn phí' in both content and context. The generated answer is a verbatim repeat of the original answer, indicating high relevance and similarity to the original answer."
FURTHER_MORE_RELEVANT,"The generated answer is not only relevant but also provides additional details and confirms the original answer, which is a free use of the legal database for small and medium-sized enterprises."
PARTLY_RELEVANT,"The generated answer mentions the correct entities (Bộ Công an, Ủy ban nhân dân cấp tỉnh, Bộ Giao thông vận tải) and general task (đảm bảo trật tự an toàn giao thông đường thủy nội địa) as in the original answer. However, the specific responsibilities and tasks mentioned in the generated answer are only partly overlapping with those in the original answer, which includes 'tổ chức lực lượng Cảnh sát giao thông tuần tra, kiểm soát, xử lý hành vi vi phạm pháp luật' and 'điều tra, thống kê, cung cấp dữ liệu về tai nạn giao thông đường thủy nội địa', which are missing in the generated answer."
RELEVANT,"The generated answer partially rephrases the original answer to mention specific responsibilities of the Bộ Công an regarding traffic law enforcement, surveillance, and data collection, which is relevant to the original answer. The generated answer provides more details on the specific tasks of the Bộ Công an, but it lacks the broader context of collaborating with other departments and local authorities mentioned in the original answer."
RELEVANT,"The generated answer is relevant to the original answer as it correctly states the role of Bộ Công an in investigating and reporting traffic accidents on inland waterways. Although the language and wording are slightly different, the key information presented in the generated answer is present in the original answer, including the requirement to statistical data and reports on traffic violations and accidents."
RELEVANT,"The generated answer closely mirrors the original answer, providing a precise interpretation of the role of the People's Committee at the provincial level in managing inland waterway traffic. The generated answer repeats the original answer's sentence structure and uses similar vocabulary, making it a relevant and similar response to the original answer."
PARTLY_RELEVANT,"The generated answer partially touches on the topic of traffic regulations, but it is not directly related to the original answer, which focuses on the requirements and penalties for operating a specialized motorbike. The generated answer is more focused on the definition and characteristics of a specialized motorbike, deviating from the original context."
PARTLY_RELEVANT,"The generated answer attempts to answer the question, but only partially addresses the requirement. The original answer provides specific information about the need for a certificate of knowledge of traffic law and the consequences of not having one. The generated answer, however, only mentions the need for a certificate and does not provide any information about the consequences or specific types of motorcycles that require it."
RELEVANT,"The generated answer directly addresses the content of the original answer. It repeats the same information and context about the requirements for a specialist to operate a motorcycle, including bringing a license or certificate. The only difference is that the generated question asked for standards, whereas the original answer mentions requirements. However, the answer provided still provides relevant information matching the original. The relevance is high, and the generated answer can be considered relevant to the original answer."
NON_RELEVANT,"The generated answer provides a different fine range (from 6.000.000 to 8.000.000 đồng) compared to the original answer (from 100.000 to 1.000.000 đồng or from 600.000 to 1.000.000 đồng). The generated answer does not match the original answer in terms of the fine range and only mentions a specific type of fine, whereas the original answer provides more general information about the fines and the requirements for controlling a motorbike. The generated answer is not a relevant or accurate response to the original question."
RELEVANT,"The generated answer is relevant to the original answer as it mentions the minimum and maximum fine for driving a specialized motorbike without a certificate of professional proficiency, which is similar to the original answer's information about the fine for not having a driving license."
RELEVANT,"The generated answer is relevant to the original answer, as it provides the same information about the regulation (Nghị định số 136/2020/NĐ-CP) and the process (trình tự) for granting the certificate. The generated answer also includes the correct detail (Mẫu số 06 tại Phụ lục IV) mentioned in the original answer, even though it is not exact match. The only difference is the wording and structure, but the essential information is preserved."
NON_RELEVANT,"The generated answer provides a different model number (05) compared to the original answer, which mentions model number 06. The generated answer is not relevant to the original answer and does not accurately answer the question."
