Relevance,Explanation
PARTLY_RELEVANT,"The generated answer provides the correct age of Emmanuel Macron at the time of his presidency, but it does not relate directly to the original answer's statement about him being the youngest president in French history and the youngest leader since Napoleon. The generated answer is partially relevant as it provides useful information, but it is not a direct response to the original context."
RELEVANT,"The generated answer is relevant because it provides a correct clarification to the generated question. Although the question asks whether Emmanuel Macron is the youngest leader of France since Napoleon, the generated answer correctly answers a related question, which is that Macron is actually the youngest president in French history. The answer also provides additional information about Napoleon's age when he became president, which further supports the relevance."
PARTLY_RELEVANT,"The generated answer partially matches the original answer in terms of content, as it also mentions Ronaldo missing an opportunity and being close to the goal. However, it lacks context and details present in the original answer, which makes it less relevant overall."
RELEVANT,"The generated answer accurately reports the number of goals scored by Ronaldo in a specific match against Celta Vigo, which is a key detail mentioned in the original answer. The only difference is the addition of the teams' names (Real Madrid and Celta Vigo), but this doesn't affect the relevance of the information as the context and the goal-scoring details are still present."
RELEVANT,"The generated answer accurately states that Ronaldo surpassed Jimmy Greaves to become the record holder for most goals scored in the top 5 European leagues, which is a crucial detail in the original answer. Although the generated answer does not provide the exact scoreline or the corresponding matches, it accurately conveys the key information related to the 'kỷ lục ghi bàn' (record-breaking goal)."
PARTLY_RELEVANT,"The generated answer mentions the topic of the nuclear agreement between Iran and P5+1, which is relevant to the original answer. However, the generated answer gives a negative response, stating that the information is not available in the dataset, which is not accurate according to the original answer. The original answer mentions the specifics of the agreement and the tensions between the US and Iran, whereas the generated answer does not provide any useful information. The generated answer is relevant to the topic, but not accurate or informative in the context of the original question."
PARTLY_RELEVANT,"The generated answer partially addresses the question by mentioning a specific action by the US that could be perceived as causing tension with Iran. However, the context and details are not entirely accurate. The original answer mentions Donald Trump's criticisms of the Iran-US nuclear deal and the threat to withdraw from it, which are not present in the generated answer. Additionally, the specific demand of moving military bases 1,000 km away is not specifically mentioned in the original answer. The generated answer also introduces new information about IRGC's request, which is not relevant to the original answer."
PARTLY_RELEVANT,"The generated answer provides some relevant information about the tense relationship between the US and Iran, which is partially aligned with the original answer. However, the answer also includes additional information that is not present in the original answer, such as Iran being asked to move military bases out of the country, IS recognizing a bombing in Tehran, and the Iranian police arresting suspects. These additional details make the generated answer less relevant to the original answer compared to a more concise and directly related response."
RELEVANT,"The generated answer accurately matches the original answer in terms of content, answering the question 'Giới tính nạn nhân trong vụ ẩu đả ở Hà Nội là gì?' with the response 'Giới tính nạn nhân trong vụ ẩu đả ở Hà Nội là nam.', which is the same as the original answer 'Giới tính của nạn nhân là nam'. The only difference is the additional context provided in the original answer, but the answer itself matches, indicating relevance."
PARTLY_RELEVANT,"The generated answer partially addresses the original question, but it is not a direct answer to the question 'Nạn nhân trong vụ ẩu đả ở Hà Nội hiện đang ở tình trạng như thế nào?' Instead, it provides information about the victim's condition, which is related to the original answer 'Tình trạng hiện tại của nạn nhân là đang ở trạng thái tiên lượng xấu' but not a direct match. The generated answer also includes extraneous information about the number of deaths and injuries, which is not relevant to the original question."
