Relevance,Explanation
RELEVANT,"The generated answer is a direct repetition of the original answer, with the only difference being the inclusion of the specific SEA Games edition (29) in the original answer. The content and context of the generated answer are almost identical to the original, making it highly relevant."
RELEVANT,"The generated answer is identical to the original answer, providing the same information and context. The only difference is the question asked, which does not affect the relevance of the answer."
PARTLY_RELEVANT,"The generated answer is partially relevant because it mentions the same year (2017) and the same event (Miss Earth), but it provides a different award name ('Hoa hậu Ảnh' instead of '2 huy chương vàng'). The answer also does not accurately convey the same information as the original answer."
RELEVANT,"The generated answer is identical to the original answer, providing accurate information about Hà Thu's achievement at Miss Earth 2017, which is the topic of the original answer."
RELEVANT,"The generated answer closely matches the original answer, providing the same information about Hà Thu winning 2 gold medals at Miss Earth 2017. The generated answer even uses similar wording and structure to the original answer, indicating high similarity and relevance."
PARTLY_RELEVANT,"The generated answer is partly relevant because it mentions the correct festival name 'International Festival 2017', but it does not provide the correct context. The original answer is a piece of information, while the generated answer is a statement about APEC being welcomed by the festival. There is a connection between the two, but it is not a direct match."
RELEVANT,"The generated answer includes the same phrase 'International Festival 2017' as the original answer, and provides additional context about the theme of the festival, which is directly related to the original answer. The generated answer accurately provides more specific information about the festival, making it relevant to the original answer."
PARTLY_RELEVANT,"The generated answer appears to be based on some correct information, as it mentions International Festival 2017. However, the question itself is in Vietnamese, asking about the name of the festival welcoming APEC, and the generated answer does not respond to that specific question. Instead, it simply states the name of the festival, without addressing the query about the topic. Although some relevant information is present, the answer is not fully relevant due to this mismatch."
RELEVANT,"The generated answer mentions 'Lễ hội quốc tế' (International Festival) which matches the original answer 'International Festival 2017'. Although the exact phrase 'International Festival 2017' is not present, the concept and theme of the answer align with the original answer. The answer also provides additional details about the location of the event, which may be seen as an elaboration of the original answer. Therefore, the generated answer is classified as RELEVANT to the original answer."
RELEVANT,"The generated answer is highly relevant to the original answer 'International Festival 2017'. The generated answer provides specific details about the festival, including the location, date, and theme, which match the original answer. The contextual information about the festival's topic and the participation of students from different age groups is also present in the generated answer, making it a relevant response."
RELEVANT,"The generated answer is very similar to the original answer, both providing the same information about Cristiano Ronaldo scoring two goals in the match between Real Madrid and Celta Vigo. The only difference is the format of the answer, with the original being a sentence and the generated being a question and answer. This similarity indicates a high level of relevance between the two."
RELEVANT,"The generated answer matches the original answer exactly, including the same team names and scores, indicating high relevance and similarity."
NON_RELEVANT,"The generated answer is a person's name, Cristiano Ronaldo, which is not related to the original answer's content about goals scored in a game between Real Madrid and Celta Vigo. The generated answer does not provide any relevant information to the original question."
RELEVANT,"The generated answer accurately mentions Cristiano Ronaldo scoring two goals against Celta Vigo, which is the same information present in the original answer, albeit in a slightly different sentence structure and wording."
