Relevance,Explanation
PARTLY_RELEVANT,"The generated answer partially discusses the topic of the original answer, mentioning that the Turkish army used rocket units to attack Iska village. However, it omits crucial information, such as the other military operations and movements mentioned in the original answer, which limits its relevance and accuracy."
RELEVANT,"The generated answer directly answers the generated question, citing specific locations (Dar al-Ezzah and Tây Aleppo) where the artillery forces of the Turkish army and the rebel forces have been deployed. This information is also present in the original answer, supporting the relevance of the generated answer."
PARTLY_RELEVANT,"The generated answer is related to the original answer as both are discussing the Turkish army's military preparations and movements. However, the generated answer is missing some crucial details and context about the specific locations and events mentioned in the original answer."
RELEVANT,"The generated answer provides the same information as the original answer about the length of the wall being built by the Turkish military, matching the question asked. The answer is extracted directly from the original text."
RELEVANT,"The generated answer directly quotes from the original answer, mentioning Real Madrid's interest in selling Karim Benzema. The generated answer is a paraphrased version of the original answer's main idea, maintaining the same context and core information."
NON_RELEVANT,"The generated answer is about Arsenal and Liverpool's interest in buying a central defender, but the original answer is about their interest in buying Karim Benzema, a striker. The two topics are unrelated, making the generated answer non-relevant to the original answer."
NON_RELEVANT,"The generated answer acknowledges the context and mentions the two teams (Arsenal and Liverpool), but its purpose is to deny providing any information, which deviates from the original answer that mentions the transfer interest in Karim Benzema. The generated answer does not address the main topic or provide any meaningful information related to the original answer."
PARTLY_RELEVANT,"The generated answer 'Karim Benzema là người Pháp' (Karim Benzema is French) partially relevant because it provides the correct national origin of Karim Benzema. However, it does not answer the question 'Where does Karim Benzema come from?' as the original sentence mentions Arsenal and Liverpool are interested in signing him, implying the context is about his potential transfer to these clubs, whereas the generated answer only provides his nationality, lacking the connection to the transfer rumors."
NON_RELEVANT,"The generated answer does not provide any information about Karim Benzema or any other player being sold by Real Madrid, whereas the original answer mentions Arsenal and Liverpool being interested in buying Karim Benzema. The generated answer also mentions that the context does not contain any information about the player being sold, which is a clear mismatch with the original answer."
RELEVANT,"The generated answer mentions the specific month that the couple got married, which is a direct reference to the original answer. Although the generated answer does not contain any extra information or context, it accurately answers the specific question asked, making it relevant to the original answer."
NON_RELEVANT,"The generated answer asserts that Kim Ngân decreased 10 kg before meeting Hải Thanh, which is contradictory to the original answer, where it's stated that Kim Ngân had already lost 20 kg before meeting Hải Thanh."
RELEVANT,"The generated answer is related to the original answer, as it mentions the couple's attention-grabbing situation on the internet, which is the increase of 30 kg in the husband's weight. The generated answer is not an exact duplicate, but it still conveys the main point of the original answer. The context and content of the generated answer are aligned with the original answer, making it relevant."
PARTLY_RELEVANT,"The generated answer partially relates to the original answer as both mention the couple's plans for the future. However, the original answer primarily talks about their plans to reduce weight for health reasons, whereas the generated answer introduces a new plan to open a restaurant, which is not mentioned in the original text."
NON_RELEVANT,"The generated answer claims that Hải Thanh caused Kim Ngân to gain 120kg, which is a significant difference from the original answer stating that Kim Ngân gained 30kg. Moreover, the original text does not mention the exact amount of weight loss or gain, so the generated answer's precision is also inaccurate."
RELEVANT,"The generated answer accurately reports the accusation made by Marc Malecek against Derek Williams, which is the same issue mentioned in the original answer. However, the generated answer adds additional information (the husband's marriage being destroyed) that is not explicitly mentioned in the original answer, which might affect the relevance score."
