Relevance,Explanation
RELEVANT,"The generated answer accurately conveys the information about the suitable time to swim in Lençóis Maranhenses National Park, which matches the content of the original answer. The sentence structure and phraseology are similar, indicating that the generated answer is a relevant and accurate response to the input question."
RELEVANT,"The generated answer directly addresses the degree of depth in the natural pool, which is a crucial detail mentioned in the original answer. The answer matches the provided information about the depth of the pool during the rainy season, making it relevant to the original answer."
PARTLY_RELEVANT,"The generated answer partly captures the essence of Lençóis Maranhenses, mentioning it's a region in Brazil with white sand dunes and green water lakes. However, it's lacking in details, missing the specific mention of natural swimming pools and the mentioning of a rainy season as described in the original answer."
RELEVANT,"Although the generated answer does not exactly match the original answer, it provides similar information in terms of Vietnam's ranking improvement in the FIFA ranking. The generated answer even provides more specific details about the exact ranking change and the date range (from month to month), which is indirectly related to the original answer (year-specific). The relevance is deemed RELEVANT because it supplies comparable information, even if not an exact match, to the original answer."
RELEVANT,"The generated answer provides additional context and specifics about the improvement in FIFA rankings, which is closely related to the original answer. It clarifies the period (quý II/2017) and furnishes more information about the ranking increase."
RELEVANT,"The generated answer provides specific information about the ranking change of the Vietnamese women's football team, which matches with the original answer mentioning a 1-batch increase. Although the generated answer provides more details (quarter II/2017) than the original answer, it's still addressing the same topic and concept, making it relevant to the original answer."
PARTLY_RELEVANT,"Although the generated answer provides some relevant information about the Vietnamese women's football team, it is only partly relevant to the original answer. The generated answer discusses the team's participation in the 2018 Asian Cup, while the original answer mentions the team ranking up in 1 bracket. The two answers are not directly connected, and the generated answer does not provide a direct explanation for the team's ranking improvement, making it only partly relevant to the original answer."
RELEVANT,"The generated answer contains the same information as the original answer, including the camera resolution, aperture, and lens type. The only difference is the slightly different wording used. The generated answer accurately summarizes the original answer, therefore, it is considered RELEVANT."
RELEVANT,"The generated answer provides the exact information about the resolution and aperture of the main camera and telephoto camera on OnePlus 5, which is the same information presented in the original answer. The format and wording are slightly different, but the content is identical."
RELEVANT,"The generated answer accurately states the aperture value (f/1.7) of the primary camera of OnePlus 5, which is a crucial detail mentioned in the original answer, making it a relevant response to the generated question."
PARTLY_RELEVANT,"The generated answer mentions the camera specifications of OnePlus 5, which is partially relevant to the original answer. However, it does not mention the comparison with iPhone 7 Plus, which is a key aspect of the original answer. Additionally, the generated answer is more focused on providing a specific detail (camera specs) rather than summarizing the main idea of the original answer (highest resolution camera system on a smartphone)."
