Relevance,Explanation
RELEVANT,"The generated answer accurately reflects the content in the original answer, specifically the point about non-living wild plant and animal specimens being considered personal or household items. The only difference is that the generated answer is more concise and focuses on the explicit question being asked, whereas the original answer provides more general information about the definition of personal or household items."
RELEVANT,"The generated answer is identical to the original answer, with no changes or modifications. It accurately reproduces the content and context of the original answer, including the specific conditions and regulations outlined in the Vietnamese text. The relevance is high, as the generated answer provides the same information and details as the original answer, making it essentially a copy."
RELEVANT,"The generated answer is identical to the original answer, word-for-word, and conveys the same information. The only difference is the minor rephrasing of the sentence structure, but the content remains the same."
RELEVANT,"The generated answer is highly relevant to the original answer, as it directly reproduces the specific time frame mentioned in the original answer (12 tháng so với thời gian quy định) and answers the generated question in a way that is consistent with the original answer. The only difference is that the generated answer is framed as an answer to a question, whereas the original answer is part of a larger text. Overall, the generated answer conveys the same essential information as the original answer."
RELEVANT,"The generated answer is a rewritten version of the original answer, addressing the same topic and providing similar information. The generated answer is a direct response to the generated question, and it includes the same key points as the original answer. However, the generated answer does not add any new information or insights, and it is a verbatim copy of the original answer with minor changes in wording. Therefore, while the generated answer is relevant to the original answer, it is not providing any significant additional value or insights."
RELEVANT,"The generated answer closely matches the original answer in terms of content and context. The generated answer is a paraphrased version of the original answer, covering the same information and providing the same details about the conditions for advancing a rank before the retirement date. The only minor difference is the rephrasing of the sentence, but the overall meaning and intent remain the same."
RELEVANT,"The generated answer provides the same content and context as the original answer, including the same examples and information about the requirements for submitting health declarations for aircraft. The language and structure are also very similar, indicating a high degree of relevance and accuracy."
RELEVANT,"The generated answer is similar to the original answer in terms of content and context. It provides the same information about the required documents for a aircraft to declare health when entering, exiting, or transiting a country, including the model numbers of the forms and the need to contact the border health authority in case of suspected infectious disease. The only difference is that the generated answer is less detailed than the original answer, but it still conveys the same key points."
RELEVANT,"The generated answer mainly focuses on the same information as the original answer, specifically the responsibility and procedures of reporting health information for aircraft. Although the generated answer does not exactly replicate the original answer's structure and wording, it still conveys the same essential information, making it relevant to the original answer."
PARTLY_RELEVANT,"The generated answer partially addresses the question and provides some relevant information, specifically stating that 'Cổng thông tin một cửa quốc gia hoặc tổ chức kiểm dịch y tế biên giới' is used for khai báo y tế tàu bay. However, it does not fully capture the context and scope of the original answer, which provides a detailed explanation of the mandatory procedures for khai báo y tế, including the submission of specific forms and certificates, and the role of the aircraft's captain or flight attendant in contacting customs when there are signs of contagious disease among passengers or crew."
RELEVANT,"The generated answer is very similar to the original answer, with almost identical wording and content. The only difference is that the generated answer is phrased as an answer to a question, while the original answer is a standalone statement. The relevance and similarity between the two are high, making the generated answer classified as 'RELEVANT'."
