Relevance,Explanation
PARTLY_RELEVANT,"The generated answer partially responds to the context, mentioning that the fire does not cause harm to property. However, it omits the significant damage to assets and hundreds of workers affected, which are crucial aspects of the original answer. The generated answer merely copies the original question's statement, rather than providing a comprehensive response."
NON_RELEVANT,"The generated answer completely misinterprets the original question, which asks about the losses at the scene of a fire, and instead provides a general description of various fire incidents with casualties and damage. The answer contains no relevant information to the original question, making it non-relevant."
NON_RELEVANT,"The generated answer is not relevant to the original question about the Bugatti Chiron's engine. Instead, it discusses Honda CR-V's engine options, which is a completely different vehicle model. The generated answer does not provide any information about the Bugatti Chiron's engine, which is what the original question is asking about."
RELEVANT,"The generated answer is partially extracted from the original answer, accurately providing the number of produced units of the 'Zero-400-Zero' Bugatti Chiron model, which matches the original text. Although the generated answer does not provide information on the supercar's specifications, acceleration, or design, it focuses on the production quantity, making it relevant to the question."
RELEVANT,"The generated answer is highly relevant to the original answer as it is a direct quote with identical content, providing the same information and details about the death of comedian Khánh Nam. The generated answer is not only grammatically correct but also conveys the same meaning and context as the original answer, meeting the criteria for 'RELEVANT' evaluation."
RELEVANT,"The generated answer is highly relevant to the original answer as it directly provides the information requested in the question (Khánh Nam's age at the time of death). The generated answer is identical to the information presented in the original answer, demonstrating a high level of similarity and relevance."
RELEVANT,"The generated answer accurately repeats the information from the original answer, with the same sentence structure and wording. The only difference is the phrase 'mất vì nguyên nhân bệnh tật' which is a direct translation of 'mất vì nguyên nhân bệnh tật' in the original answer. This suggests that the generated answer is a direct copy of the original answer, with minor adjustments for language."
PARTLY_RELEVANT,"The generated answer partially addresses the original answer, as it mentions Khánh Nam's profession as a Vietnamese comedy actor and his age at the time of death. However, it does not fully address the content of the original answer, which provides more context about his health struggles before his death. The generated answer also includes a question, which is not relevant to the original answer."
RELEVANT,"The generated answer provides similar information to the original answer, including the specific dates and location of the event, just in a slightly different format and with some minor phrasing differences. The core information is preserved, making it relevant to the original answer."
PARTLY_RELEVANT,"While the generated answer mentions the same event and location as the original answer, the context and format are slightly different. The generated answer is a direct response to the generated question, whereas the original answer is part of a larger text. Additionally, the original answer provides more specific details about the dates and times of the event, which are not mentioned in the generated answer. However, the core information about the location is accurate and relevant, making the generated answer partly relevant."
RELEVANT,"The generated answer is identical to the original answer, including the specific time, date, and location mentioned in the original answer. The generated answer even preserves the exact phraseology and syntax of the original answer, indicating a high level of similarity and relevance."
