Relevance,Explanation
PARTLY_RELEVANT,"The generated answer partially matches the relevant information from the original answer. The generated answer correctly states the maximum fine for repeatedly forcing a family out of their residence, which is from 300,000 to 500,000 VND. However, it lacks the context about the fine range for the first offense, which is from 100,000 to 300,000 VND. Additionally, the generated answer doesn't provide the option of a warning or a fine from 100,000 to 300,000 VND, which is present in the original answer."
NON_RELEVANT,"The generated answer is unrelated to the original answer. The original answer is about the penalty for forcing family members out of their legitimate living space, while the generated answer is about the penalty for occupying a forest preservation area under 2,000 m2. The two topics are distinct and bear no logical connection."
RELEVANT,The generated answer accurately reflects the original answer's sentence about the fine range for forcing family members out of their legal residence with violence. The generated answer's content and range are identical to the original answer's corresponding sentence.
PARTLY_RELEVANT,"The generated answer partially addresses the same topic as the original answer, which is the content of Nghị định số 185/2013/NĐ-CP. However, the scope of the answered question and the provided information differs. The original answer specifically mentions the maximum fines for individuals and organizations, while the generated answer provides a broader summary of the fields governed by the decree. The connection to the original answer is present, but the answer does not contain the same specific details."
NON_RELEVANT,"The generated answer provides a different fine amount (2,000,000 đồng) compared to the original answer (100,000,000 đồng for a individual). The content and context of the generated answer do not match with the original answer, indicating a non-relevant answer."
NON_RELEVANT,"The generated answer provides information about the effectiveness date of Nghị định số 185/2013/NĐ-CP, which is not relevant to the original answer, which mentions the maximum fine amount for individuals and organizations in the field of commerce and consumer protection."
NON_RELEVANT,"The generated answer is about the penalty for organizations that use child labor to produce beer, which is very different from the original answer. The original answer talks about the maximum fine for individuals and organizations for violating specific regulations, but it does not mention child labor or beer production. The generated answer does not provide any relevant information related to the original answer."
NON_RELEVANT,"The generated answer talks about the purpose of the decree (quy định chế độ quản lý ngân quỹ nhà nước), but it is not related to the maximum fines for individual and organization, which is the main content of the original answer. The answers are unrelated, and therefore, the relevance is considered 'NON_RELEVANT'."
RELEVANT,"The generated answer is highly relevant to the original answer as it directly answers the question by stating that the scientific and technological tasks that are approved by the competent state agency are allowed to use the entire state budget. The grammar, vocabulary, and sentence structure are also similar to the original answer, indicating a high degree of similarity."
PARTLY_RELEVANT,"The generated answer is partially relevant because it mentions the agency responsible for approving the use of public funds for scientific and technological tasks, which is similar to the original answer. However, the generated answer is more specific, focusing on a particular type of agency (decision-making agency) and lacks the broader information about tasks being funded with the entire national budget, which is mentioned in the original answer."
RELEVANT,"The generated answer is identical to the original answer, covering the same content, context, and meaning."
RELEVANT,"The generated answer repeats the same content as the original answer, providing the condition for a scientific and technological task to be considered a 'budget task'. The language and structure are identical, indicating a high level of similarity and relevance to the original answer."
RELEVANT,"The generated answer is mostly identical to the original answer, with only minor differences in wording. The core information, definitions, and concepts are preserved, making the generated answer highly relevant to the original answer."
RELEVANT,"The generated answer provides information about the notification period for a business to stop operating, which is related to the original answer 'Có được'. Although the format and wording are different, the content and context of the generated answer match the original answer, providing a similar piece of information."
NON_RELEVANT,"The generated answer provides information about the time frame for announcing a temporary suspension of business, which is unrelated to the original answer 'Có được' (which appears to be a Vietnamese phrase). The generated answer does not address the content or context of the original answer, indicating non-relevance."
