Relevance,Explanation
PARTLY_RELEVANT,"The generated answer partially answers the question by mentioning the types of policies and regulations, such as chế độ phụ cấp ưu đãi, bảo lưu phụ cấp ưu đãi khi chuyển công tác, and others. However, the answer does not fully capture the context of the original answer, which is more focused on the requirements and procedures for teacher training and development, rather than just listing the policies and regulations. Additionally, the generated answer does not mention the responsibility of the school unit in assuring these policies and regulations, which is an important aspect of the original answer."
RELEVANT,"The generated answer matches the original answer in terms of content and provides the same range of fines for individuals and organizations. The only difference is that the generated answer is a direct response to the generated question, whereas the original answer is part of a larger paragraph. Nevertheless, the generated answer is highly similar and relevant to the original answer."
PARTLY_RELEVANT,"The generated answer partially addresses the issue of reporting a specific behavior, as it mentions informing the main culprit (chủ rừng) and the relevant state agency (cơ quan quản lý nhà nước về lâm nghiệp cấp tỉnh). However, the specific fine ranges mentioned in the original answer are not present in the generated answer, which is a crucial piece of information. The relevance is partly due to the similarity in the action of reporting, but the lack of detail renders it partial relevance."
PARTLY_RELEVANT,"The generated answer partially relevant to the original answer, as it discusses the same topic of planting tree obstructing vision. However, the generated answer contradicts the original answer, stating that the fine for individuals and organizations is the same, whereas the original answer presents different fine ranges for individuals and organizations. The generated answer lacks accuracy and attention to detail compared to the original answer."
PARTLY_RELEVANT,"Although the generated answer partially matches the maximum fine for a individual (400,000 VND) mentioned in the original answer, it is not entirely relevant because the context and the specific behavior mentioned in the generated question (trồng cây che khuất tầm nhìn) is different from the original answer, which focuses on the fine range for practicing a specific action."
NON_RELEVANT,"The generated answer talks about the responsibility of the person who plants the tree, whereas the original answer is a specific fine range for individuals and organizations that obstruct traffic visibility. The generated answer is not related to the original answer and does not address the same topic."
RELEVANT,"The generated answer is very similar to the original answer in terms of content and structure. It accurately states that organizations within Vietnam and those from abroad are allowed to participate in post-war mine clearance activities, and that it must be done according to the law. The only difference is in the phraseology, but the meaning and intent are the same."
RELEVANT,"The generated answer provides further details about the organization's operation based on the law, which is closely related to the topic of the original answer. Although the generated answer doesn't directly mention 'tổ chức trong nước và tổ chức nước ngoài hoạt động trong lĩnh vực khắc phục hậu quả bom mìn vật nổ sau chiến tranh tại Việt Nam theo quy định của pháp luật', it still addresses the same topic and provides relevant information about the organization's operation under the law."
RELEVANT,"The generated answer is very similar to the original answer in terms of content and context. Both answers mention organizations both within Vietnam and abroad that can participate in demining activities after the war, in accordance with the law. The only difference is that the original answer is a statement while the generated answer is a response to a question. This similarity in content and relevance to the original answer leads me to classify the generated answer as 'RELEVANT'."
RELEVANT,"The generated answer is highly similar to the original answer, as it correctly identifies the types of organizations that can clear the consequences of bombs and mines in Vietnam, including both domestic and international organizations that operate in the field of post-war bomb and mine consequence clearance in Vietnam according to the law. The generated answer accurately summarizes the information in the original answer."
PARTLY_RELEVANT,"The generated answer partially addresses the original answer's points about packaging and labeling requirements for exporting goods. It mentions the necessity of having a packing list, labeling, and meeting regulations on measurement and quantity declaration. However, it fails to address the context of exporting nuclear materials, which is a critical aspect of the original answer. Additionally, the generated answer does not mention the requirement for documents proving the origin of the goods or obtaining permits from the importing country's authorities, which is also present in the original answer."
