Relevance,Explanation
RELEVANT,"The generated answer provides a detailed explanation for how boredom on a flight can make food taste better. The answer covers the effects of high altitude on taste buds, the airline industry's tendency to add more sugar and salt to food, and the psychological aspect of boredom causing people to seek comfort in food. The answer is directly addressing the question and provides a comprehensive response."
RELEVANT,"The generated answer provides specific information about Giáo sư Göran Roos sharing knowledge about ĐMST and KH&CN management, which directly addresses the question. The answer includes context from international scenarios, trends, and experiences of developed countries, which is relevant to the inquiry."
RELEVANT,"The generated answer directly addresses the question, specifically mentioning the main content of Prof. Göran Roos' presentation, which is about policies related to science, technology, engineering, and mathematics (STE) serving Vietnam's economic growth. This answer is relevant to the question as it provides a clear and accurate response to what the main topic of the presentation was."
RELEVANT,"The generated answer is relevant to the question as it provides specific advice from Göran Roos on how to promote economic growth in Vietnam, including implementing government reforms, increasing transparency in business operations, and connecting universities with research institutions and businesses. The answer aligns with the topic of the question and provides valuable insights."
RELEVANT,"The generated answer is relevant to the given question as it directly addresses the question by providing suggestions for improving the efficiency and effectiveness of state management, which aligns with the professor's ideas provided in the question."
RELEVANT,"The generated answer directly addresses the question, providing information about what Professor Göran Roos suggests to create a transparent and open business environment. The answer is the same as the question, but with additional details, making it partially answered. The provided information is highly relevant to the question, making it 'RELEVANT'."
RELEVANT,The generated answer directly answers the question about the number of Kalibr cruise missiles launched by the Russian Navy.
RELEVANT,"The generated answer provides the specific names of Russian warships ('Ðô đốc Essen' and 'tàu ngầm Krasnodar') that allegedly fired missiles into Syria, directly addressing the question about the names of Russian warships involved in such action."
RELEVANT,"The generated answer is directly responding to the question, specifically predicting the score of a hypothetical football match between U20 Vietnam and U20 New Zealand, which is the main concern of the question."
RELEVANT,"The generated answer provides a specific prediction for the score of the U20 Vietnam and U20 New Zealand match, which directly responds to the question. The additional information about Tiến Dụng's intention is related to the question, but it's secondary information that supports the main answer."
