Relevance,Explanation
PARTLY_RELEVANT,"The generated answer mentions that obtaining permits is important for startups, which is somewhat related to the question. However, it does not provide a clear explanation of why permits are important or how they impact startups. The answer focuses more on the potential difficulties startups may face due to lack of permits rather than the significance of permits for startups."
RELEVANT,"The generated answer explicitly mentions the 9K714 Oka missile being used as a political tool, which aligns with the question's inquiry about a Russian tactical ballistic missile being used as a political tool. The answer provides a specific example that matches the question's context."
PARTLY_RELEVANT,"The generated answer mentions a specific type of missile (9K714 Oka) and its role in containing a military power (the US). However, the question asks about the specific missiles that contributed to containing the US military presence in Europe, and Oka is not known for its involvement in this context. The answer is relevant in the sense that it talks about containment, but it is not a direct answer to the question and requires additional context to understand its connection to the topic."
RELEVANT,"The generated answer is relevant to the question as it discusses the military strategy of Russia in relations with the US in the region, which is in line with the question's inquiry about Nga's military strategy in the context of tension with the US."
PARTLY_RELEVANT,"The generated answer mentions the 9K714 Oka missile, which is relevant to the question. However, the answer focuses on the political context of the US power struggle in Europe, which is not directly connected to the international research on the 9K714 Oka missile. The question is more focused on the research aspect, while the answer provides information on the missile's usage as a political tool."
PARTLY_RELEVANT,"The generated answer partially addresses the question by mentioning the 9K714 Oka missile and its potential impact on the military balance between the US and Russia. However, the answer focuses more on the strategic use of the missile as a political tool to curb American power in Europe, which is only indirectly related to the question. A more direct answer would have provided more specific information about the missile's capabilities, deployment, and effects on the military balance, rather than making a more general claim about its political significance."
RELEVANT,"The generated answer is directly addressing the question, providing information that contradicts the possibility of Mikel Arteta being injured in a fight. The answer explains that there is no such information available, making it relevant to the question."
RELEVANT,"The generated answer directly answers the question, providing details about the incident, including the involvement of Romeu Lukaku and the actual cause of Mikel Arteta's injury. The answer is concise and accurate, matching the requirement of the question."
PARTLY_RELEVANT,"The generated answer mentions HLV Mikel Arteta being injured, which is related to the question about who caused Mikel Arteta's injury. However, the answer's focus on the HLV being injured himself and the cause of the injury (a head collision with a door) is not directly relevant to the question about who caused the injury."
RELEVANT,"The generated answer correctly addresses the question about Trợ lý HLV Mikel Arteta's injury, providing specific details about how he got hurt (a collision with the door). The answer is relevant and provides the requested information."
RELEVANT,"The generated answer directly answers the question about a specific football match where a fight broke out, providing the names of the teams and the league in which it took place."
RELEVANT,"The generated answer discusses the cultural similarities between Cộng hòa Armenia and Việt Nam, mentioning the influence of Western culture and the willingness of their people to adopt new things while preserving traditional culture. The answer is directly related to the question and provides some relevant information, although it does not exhaustively answer the question."
RELEVANT,"The generated answer addresses the question by providing an evaluation of the impact of Western culture on Armenia and Vietnam. The answer meets the requirements of the question, providing specific answers to the assessment of cultural influence."
PARTLY_RELEVANT,"The generated answer partially addresses the question by mentioning some commonalities between Vietnamese and Armenian people, such as being receptive to novelty and valuing cultural heritage. However, it fails to directly answer the question about what specific points they share in terms of adapting to change, and instead focuses more on their cultural characteristics. Therefore, while the generated answer contains some relevant information, it does not fully answer the question."
PARTLY_RELEVANT,"The generated answer discloses some points of similarity between Armenia and Vietnam, such as sharing cultural influences and the importance of preserving traditional culture. However, it does not specifically address the question about how they resolve issues, leaving the answer partly relevant to the question."
