Relevance,Explanation
PARTLY_RELEVANT,"The generated answer does partially answer the question by providing a team name (Áo) that participates in the event, but it does not specify the context of their performance. The question asks about the team that performs together with Vietnam, but the answer only mentions the team's name and does not provide any information about their relationship with Vietnam."
RELEVANT,"The generated answer is highly relevant to the question, providing the exact number of teams (hai team) that participated in the fireworks display event (DIFF 2017) on the first night."
RELEVANT,"The generated answer is relevant to the question because it provides a clear description of DIFF 2017, specifically mentioning it as a international fireworks display event held in Da Nang, which matches the expected content of the answer."
RELEVANT,"The generated answer provides specific information about the type of missile (Hwasong-14) and the date it was launched (4/7), which is highly relevant to the question about the type of missile North Korea launched on 4/7."
RELEVANT,"The generated answer provides a specific date (4/7) that corresponds to a missile launch by North Korea. The answer is directly related to the question about when North Korea launched the Hwasong-14 missile, making it a relevant response."
RELEVANT,"The generated answer directly addresses the question, providing specific information about the type of missile Hwasong-14 belongs to, which is a ballistic missile with a range that can reach the west coast of the US."
RELEVANT,The generated answer mentions the same event and detail (launching date) as described in the question. It accurately answers the question about the Hwasong-14 rocket launched by North Korea on July 4.
RELEVANT,"The generated answer provides a specific information related to the date mentioned in the question, which matches the format 'ngày x/x' and indicates a specific event that occurred on that date. The answer is directly relevant to the question, providing a correct answer about the missile type launched by North Korea on that day."
RELEVANT,"The generated answer directly addresses the question about Moon Jae-in's policy towards North Korea, providing specific details about his stance on 'Chính sách ánh dương' and his approach to dialogue and engagement with North Korea. The answer is highly relevant to the question and provides accurate information."
RELEVANT,"The generated answer is relevant to the question because it directly addresses the purpose or intention of the US launching THAAD, as mentioned by experts. The answer provides specific information about the capabilities of THAAD and its intended targets, which aligns with the question's focus on the purpose or intention of THAAD."
RELEVANT,"The generated answer directly addresses the question about people who advocate for a hardline policy towards North Korea. It provides specific groups of people, such as South Koreans, and explains their reasoning, matching the topic and scope of the question."
