Relevance,Explanation
RELEVANT,"The generated answer directly answers the question, providing specific information about the challenges faced by the project during construction. It matches the format and scope of the question, making it a relevant response."
RELEVANT,"The generated answer provides a specific answer to the question, mentioning the number of locations (37) and households (585) causing a delay in the construction of the Đà Nẵng - Quảng Ngãi highway project, which directly addresses the question's inquiry."
RELEVANT,"The generated answer directly answers the question 'Có bao nhiêu điểm chậm trễ?' (How many delayed points are there?) by providing a specific number of points (37) in the Đà Nẵng - Quảng Ngãi highway construction process, making it relevant to the question."
PARTLY_RELEVANT,"The generated answer '37 vị trí' provides a numerical value which is related to the question, as it likely refers to the number of locations where problems were encountered during the construction of the Da Nang-Quang Ngai highway. However, the answer lacks specific context and details that would make it fully relevant, such as the actual problems that occurred at these locations."
RELEVANT,"The generated answer directly addresses the question and provides a clear explanation for why many companies lack high-quality human resources. The answer is relevant because it mentions the current lack of high-quality human resources as a cause for companies struggling to find them, which matches the question's inquiry into the reasons behind this issue."
NON_RELEVANT,"The generated answer is unrelated to the question, which asks for names of training institutions with high-quality human resources. The answer instead discusses a teacher's expectation for a new education program, which is not relevant to the question."
PARTLY_RELEVANT,"Although the generated answer mentions investing in companies with prospective, it only partially answers the question. The answer talks about what large companies typically do when investing, but lacks direct connection to what they typically do when investing in companies with prospective. The answer goes off-topic to discuss the lack of high-quality human resources and training foundation, which is not directly relevant to the original question."
RELEVANT,"The generated answer provides a reason for the lack of high-quality employees in a company, which is in line with the question. The answer specifically mentions the company's lack of a source to train high-quality employees, which is a relevant explanation for the given question."
PARTLY_RELEVANT,"The generated answer partially addresses the question by mentioning that companies are lacking high-quality human resources, which is related to the shortage of labor force. However, it does not provide a specific solution to address this shortage, which is what the question is asking for."
RELEVANT,"The generated answer accurately provides the average annual GDP growth rate of Vietnam from 1991 to 1995, matching the information requested in the question."
RELEVANT,"The generated answer is directly relevant to the question, providing the exact value of GDP per capita of Vietnam in 2003, which is what the question is asking for."
RELEVANT,"The generated answer is directly relevant to the question, providing the specific increase in Vietnam's export value from 2011 to 2015, which is exactly what the question asks."
RELEVANT,"The generated answer accurately describes the direction of Vietnam's economic structure, mentioning that it has started to shift towards modernization, which directly answers the question about the current direction of Vietnam's economic structure."
PARTLY_RELEVANT,"The generated answer is partially relevant because it mentions Việt Nam actively participating in an organization, which is what the question is asking. However, the specific organization mentioned (Liên chi Đoàn TNCS Hồ Chí Minh tại ĐHQG Lào) is not explicitly mentioned in the question. The answer is not entirely irrelevant because it does relate to the topic of Việt Nam participating in an organization, but it does not provide the expected answer."
RELEVANT,"The generated answer accurately provides an important detail about the largest US military base outside of the US, which aligns with what the question is asking. The answer correctly mentions Trại Humphreys, Pyeongtaek, Korea, and its proximity to Seoul, directly addressing the question's inquiry."
