Relevance,Explanation
RELEVANT,"The generated answer partially answers the question about Alexei Navalny's release. It mentions the duration of his imprisonment (gần 3 tuần), but fails to provide a direct answer to the question (sau bao lâu? or 'how long?')."
RELEVANT,"The generated answer accurately provides the duration of Alexei Navalny's exile, which matches the information requested in the question."
RELEVANT,"The generated answer directly responds to the question, providing information about the first match of Thái Sơn Nam at the 2017 Asian Club Futsal Championship, including the opponent, score, and surprise loss despite being the home team."
RELEVANT,"The generated answer provides the exact information requested in the question, identifying the opponent that caused Thailand's defeat in the first match of the Asian Club Futsal Championship 2017."
RELEVANT,"The generated answer directly provides the score of the match between Thái Sơn Nam and FC Erem (Kyrgyzstan), which is exactly what the question is asking for, thus it is highly relevant to the question."
RELEVANT,"The generated answer directly addresses the question and provides the specific information asked, which is the name of the country that Thái Sơn Nam lost to in a futsal tournament."
RELEVANT,"The generated answer provides a specific detail about Thái Sơn Nam's performance in Giải futsal các CLB châu Á 2017, which is directly related to the question. The answer mentions the opponent (FC Erem) and the result of the match, making it a relevant response to the query."
RELEVANT,"The generated answer provides a specific number of people arrested by the British police (10) and also mentions that two were later released, directly answering the question about the number of people arrested in the Manchester Arena attack investigation."
RELEVANT,"The generated answer accurately provides the number of people who were released after being arrested in the Manchester Arena bombing attack, which is directly relevant to the question."
RELEVANT,"The generated answer provides the specific number of people arrested in relation to the Manchester Arena attack, which directly addresses the question. While the additional information about two people being released is somewhat supplementary, it does not detract from the answer's relevance to the question."
RELEVANT,"The generated answer directly provides the requested information about the number of people arrested and released in the Manchester Arena bombing case. Although the answer does not provide an exact count of those released, it gives the accurate numbers of detainees (16) and those still being held (14) which still aligns with the question's intent."
PARTLY_RELEVANT,"The generated answer does not directly answer the question about the number of arrests made by the Manchester Arena investigation unit. However, it partially provides relevant information as it mentions the number of arrests (10) although two people were later released, which gives an indirect inference about the unit's activities. To be considered fully relevant, the answer should strictly provide the exact number of arrests made by the unit."
RELEVANT,"The generated answer directly answers the question, confirming or denying the existence of a room for filming at Stoke Park's house. The answer is concise and accurate, making it relevant to the question."
RELEVANT,"The generated answer directly addresses the question, providing specific examples of athletic facilities in a house, matching the context and keywords of the question."
RELEVANT,"The generated answer clearly specifies that the pool is in a house at Stoke Park and is an indoor hot water pool, which is directly related to the question. The answer provides a detailed description matching the context of the question."
