Relevance,Explanation
RELEVANT,"The generated answer directly addresses the question about the price of the new Renault Duster model, providing a specific numerical value (363 triệu đồng) which is the relevant information requested."
RELEVANT,"The generated answer provides information about the new generation of Renault Duster, including its price and some design features. Although the answer does not directly answer the question about the price, it touches upon a related aspect of the question, making it partly relevant. However, the textual discussion on design features adds value to the response and makes it overall relevant."
RELEVANT,"The generated answer discusses the advantages of transferring obligations over assigning someone else in large transactions, which aligns with the question. The answer provides a detailed analysis of the pros and cons of transferring obligations, citing an expert's opinion and explaining the legal implications. Although the answer does not directly answer the question, it provides a relevant and informative review of the topic."
RELEVANT,"The generated answer is directly related to the question, specifically answering who is responsible in a business transfer of obligations, and providing additional context about the transfer process. The answer matches the expected semantic meaning of the question, and is clear and concise."
RELEVANT,"The generated answer provides a clear explanation of the concept of 'Vụ việc chuyển giao nghĩa vụ dân sự', which is in line with the question. The answer defines the topic as a matter of determining the subject of civil law relationships, specifically contracts, and provides relevant legal references to support the explanation. The content is relevant and accurate, answering the question concisely and providing additional contextual information to provide depth and clarity."
RELEVANT,"The generated answer directly answers the question about the number of consecutive championships won by Benfica in the Portuguese league, providing the answer 'lần thứ tư' (fourth time). Although it would be more informative to provide the exact number of consecutive championships, the generated answer is still relevant to the question."
RELEVANT,"The generated answer is directly answering the question, stating which football club is the 4-time consecutive champion of the Portuguese Football League."
RELEVANT,"The generated answer provides the correct information about which team won the title of champion in the Portuguese league for 4 consecutive years, which is the main topic of the question."
RELEVANT,"The generated answer is directly addressing the question, providing the correct information about the team that has won the championship most recently in Portugal's football history. The answer is relevant as it matches the exact context and scope of the question."
RELEVANT,"The generated answer directly answers the question, providing the name of the football team that has won the Portuguese championship four times in a row. The answer is relevant to the question and provides the correct information."
RELEVANT,"The generated answer is relevant to the question, as it provides the correct answer to the question about who is the male model for the Mr-Meuw fashion collection of Chung Thanh Phong, which is Nam ca sĩ Noo Phước Thịnh."
RELEVANT,"The generated answer directly answers the question by providing the name of the model who performed the catwalks 'chất đến ngất' at Chung Thanh Phong's show, which matches the content and context of the question."
RELEVANT,"The generated answer directly answers the question, providing information about Noo Phước Thịnh's role in a clothing collection (Mr-Meuw) and describes his performance on the catwalk."
