Relevance,Explanation
RELEVANT,"The generated answer provides a direct response to the question, mentioning the difficulties (khó khăn) caused by U22 Việt Nam for Argentina's team, which is the main topic of the question."
RELEVANT,"The generated answer provides relevant information related to the question about ineffective management and utilization of public investment. Although the answer does not directly address the question's focus on 'hiệu quả quản lý và sử dụng đầu tư công', it discusses the challenges in managing public debt, which is a critical factor in the effective utilization of public investment."
PARTLY_RELEVANT,"The generated answer partially addresses the question 'Nguyên nhân dẫn đến tình trạng đầu tư dàn trải?' by mentioning a potential cause, which is the lack of qualified human resources. However, it does not directly answer the question and instead provides a tangential solution (investing in a leadership team) that is not closely related to the main concern of 'dàn trải' investments."
PARTLY_RELEVANT,"The generated answer provides some relevant information related to the question, specifically mentioning projects with inefficient investments and those with approved budgets exceeding available funds. However, the answer does not directly address the question of whether the approval of a specific project exceeds its ability to raise capital, leaving some context unclear."
PARTLY_RELEVANT,"The generated answer partially relates to the question as it addresses the absence of information about the project's ability to manage funds, but does not provide a specific answer to the question about the extent of this ability."
RELEVANT,"The generated answer directly addresses the question, discussing the limitations of the current system for managing public investment. The answer specifically mentions issues with the Law on Investment and the complexity of the process for approving projects, which aligns with the question's inquiry."
RELEVANT,"The generated answer directly addresses the question of what kind of tricks or methods a car dealership may use to deceive customers when selling used cars, specifically mentioning the potential for them to take the car and documentation, sell it at a lower price than initially agreed upon."
RELEVANT,"The generated answer directly addresses the question, explaining that selling used cars at a lower price than initially quoted is a scam. The example provided also supports the explanation, making the answer relevant to the question."
RELEVANT,"The generated answer addresses the question about cases related to fraudulent activities in selling used cars. The answer provides a specific example of how fraud can occur, which is relevant to the question."
RELEVANT,"The generated answer directly addresses the question by explaining a possible scenario of price manipulation in selling used cars, specifically mentioning the example of a seller initially asking for a higher price but later lowering it. This meets the requirements specified in the question."
RELEVANT,"The generated answer directly addresses the question by providing an example of a common fraud scheme in the used car business. The answer is highly relevant to the question, explicitly mentioning the sale of used cars and the fraudulent actions taken by the shop owner."
RELEVANT,"The generated answer directly addresses the question about why Mourinho was invited to the Technical Area during the match against Southampton, providing a specific reason for his invitation."
PARTLY_RELEVANT,"The generated answer partially relates to the question, which asks about the comment of a Sky Sports journalist about Mourinho's entry into the pitch. The answer does provide some information about Sky Sports, but it does not directly address the comment of the journalist. The phrase 'Có thể' ('may') suggests that the answer is discussing a hypothetical scenario or a possible consequence, which is not directly relevant to the question's focus on the journalist's comment."
RELEVANT,"The generated answer is relevant to the question as it mentions Mourinho's behavior during a match with Southampton, which is the focus of the question. The answer specifically addresses the potential penalties that Mourinho may face as a result of his actions, which matches the topic and scope of the question."
PARTLY_RELEVANT,"The generated answer partially answers the question by mentioning a specific referee (Craig Pawson) who stopped the game, but it does not specify which match or when Mourinho entered the field. The context is relevant, but some additional details are missing to fully confirm the answer."
