Relevance,Explanation
RELEVANT,"Although the answer is not a straightforward answer to the question, it does provide information related to Bayern Munich's performance in the Champions League, which is the subject of the question. While it does not directly answer the question, it is still relevant to the topic."
RELEVANT,"The generated answer is relevant to the question because it provides an additional accolade of Bayern Munich, which is a different title from Bundesliga. However, it does not explicitly answer the question about any other title(s) besides Bundesliga, but instead mentions Champions League."
RELEVANT,"The generated answer directly addresses the question, providing a specific reason why Bayern Munich did not achieve success in the current season, specifically citing their early elimination from the Champions League and German Cup."
PARTLY_RELEVANT,"The generated answer partially addresses the question, as it mentions Bayern Munich being eliminated from the Cup, but it's not entirely clear which team did the eliminating. The context of the answer is also somewhat mismatched, as it talks about the Cup in general instead of the specific one mentioned in the question (Cúp quốc gia Đức)"
RELEVANT,"The generated answer provides a specific reason for Pakistan summoning the Indian Deputy High Commissioner J P Singh, which matches the context of the question. The answer mentions a specific incident involving civilian casualties and injuries along the LoC, which is consistent with the question's focus on the reason for the summoning."
RELEVANT,"The generated answer is relevant to the question because it provides the reason why Pakistan summoned an Indian deputy foreign minister. The answer mentions a specific incident involving the death of Pakistani civilians and injuries to others along the LOC, which the Pakistani government attributes to Indian soldiers. This information is directly related to the question and provides a clear explanation for Pakistan's decision to summon the Indian deputy foreign minister."
PARTLY_RELEVANT,"Although the generated answer mentions the 'Phó Cao ủy Ấn Độ', which is partially related to the question, the main content of the answer is about a specific incident and its causes, whereas the question asks about the purpose of sending the Deputy High Commissioner of India. The connection is not direct or clear-cut."
PARTLY_RELEVANT,"The generated answer mentions Pakistan and India, which is relevant to the question about Pakistan's civilian casualties. However, the answer does not specifically address the question of what Pakistan summoned the Indian Deputy High Commissioner regarding a civilian casualty incident."
RELEVANT,"The generated answer directly addresses the question by specifying the country Pakistan accuses of violating the ceasefire and causing harm to civilians, which is in line with the question's context and content."
RELEVANT,"The generated answer provides specific information about the end date of the war against the IS organization in Iraq, which is directly relevant to the question."
PARTLY_RELEVANT,"The generated answer partially relates to the question about the date of a military parade in Baghdad, as it mentions a parade being held on December 10th. However, the answer is not entirely relevant as it also focuses on announcing the end of the war against IS and provides additional details about the parade that are not directly answering the question."
PARTLY_RELEVANT,"The generated answer is partially relevant to the question because it still attempts to answer the question about the significance of organizing a military parade in Baghdad. However, the answer doesn't directly address the question and instead asks the same question back, which is not a meaningful response. Additionally, the answer doesn't provide a clear connection to the significance of the event, making it partially relevant but not fully relevant to the question."
PARTLY_RELEVANT,"The generated answer partially addresses the question by providing some information about the entities involved in the military parade in Baghdad. However, it focuses more on the types of vehicles and forces present, rather than specifically identifying the 'lực lượng' (factions or forces) asked about in the question."
RELEVANT,"The generated answer directly addresses the question, providing specific information about the location where the Iraqi army organizes a military parade. The answer mentions the Green Zone, which is a real location in Baghdad, and it matches the context of the question, making it highly relevant."
RELEVANT,"The generated answer provides detailed information about the growth of Vietnam's agriculture industry over the past three years, specifically mentioning the impact of US and Western sanctions. While the question is asking about Russia's agriculture industry, the answer does not provide any direct information about Russia's situation. However, the answer does provide a good example of how an economy can grow in the context of sanctions, making it partly relevant to the question."
