Relevance,Explanation
RELEVANT,"The generated answer provides information about the new sanctions of the United Nations, specifically affecting North Korea's oil exports, which is directly related to the question about sanctions targeting the economic sector of North Korea."
RELEVANT,"The generated answer is relevant to the question as it mentions a specific 'dự thảo nghị quyết' (draft resolution) of the US that prohibits the export of certain goods from North Korea, which aligns with the context of the question."
RELEVANT,
RELEVANT,"The generated answer provides relevant information about the trừng phạt new of Liên hợp quốc, specifically mentioning limitations on investment and labor activities with North Korea, which aligns with the question's inquiry about the new sanction's impact on investment in North Korea."
RELEVANT,"The generated answer directly addresses the question by mentioning the specific round (vòng 15) that the study focused on, providing a clear connection to the topic of the La Liga season 2017/18."
PARTLY_RELEVANT,"The generated answer partially addresses the question by providing information about La Liga in 2017/2018. However, the answer is not a detailed response as the question asks for, and does not cover the expected breadth of information. The answer only mentions one specific match between two teams, whereas the question likely seeks more comprehensive information about the league's round."
RELEVANT,"The generated answer directly addresses the question by stating there is no information about VietNamNet being a trustworthy source for La Liga, which is in line with the question's inquiry."
RELEVANT,"The generated answer directly addresses the question and provides a specific source of information (VietNamNet) where the reader can find more details about the La Liga 2017/18 season. Although it does not provide the actual results, it provides a relevant and useful resource for answering the question."
PARTLY_RELEVANT,"The generated answer mentions a source (K+) for retrieving La Liga information, which is directly related to the question. However, it does not fully address the question, as it only provides a specific source and does not offer a general answer or a comprehensive list of sources. Hence, the relevance is partly relevant."
RELEVANT,"The generated answer directly answers the question of who is the player that transferred to MU with the highest value this season. The answer, Pogba, with the transfer value of 89.3 million pounds, is a relevant and accurate answer to the question."
NON_RELEVANT,The generated answer is a response that asks the user to ask a different question instead of providing an answer to the original question. This response has no relevance to the question 'MU đã chi bao nhiêu tiền để mua về Paul Pogba?'
RELEVANT,"The generated answer accurately provides information about Paul Pogba's transfer to Manchester United (MU) from an Italian club, specifically Torino, which is a correct response to the question."
RELEVANT,"The generated answer provides the exact information requested in the question, which is the exchange value of Paul Pogba when he transferred to Manchester United (MU). The answer is clear and concise, matching the context and content of the question."
RELEVANT,"The generated answer directly addresses the question, providing the name of the player (Pogba) and the specific transfer fee amount (£89.3 million) that broke the record for the most expensive transfer in Premier League history, making it a relevant answer to the question."
PARTLY_RELEVANT,"The generated answer is partly relevant because it mentions the year 2017 and that China wanted its U20 team to participate in a German football league, which addresses part of the question. However, it is not entirely relevant because the league mentioned (Regionalliga Südwest) is not a tournament specific to the question, which likely refers to a tournament organized by the German Football Association, while Regionalliga Südwest is a league in a specific region of Germany."
