Relevance,Explanation
RELEVANT,"The generated answer provides specific details about the knowledge equipped to female employees during the 14th club meeting, which is closely related to the question. The answer addresses the required information, mentioning general health knowledge, reproductive health, and basic concepts about childcare, closely matching the question's topic."
RELEVANT,"The generated answer is relevant to the question because it describes the contents of concern during a women's club event, which aligns with the question's query about nội dung nào được quan tâm (what content is cared about). The answer provides specific and relevant information regarding women's health, healthcare, and child-rearing knowledge, making it a matching response to the question."
RELEVANT,"The generated answer directly addresses the question, mentioning the specific topic of reproductive health knowledge learned by the female staff members of the Vietnam Public Employees Trade Union during a club activity."
RELEVANT,"The generated answer directly addresses the question by specifying who the event is intended for, which is a clear and concise answer that matches the question's intent."
RELEVANT,"The generated answer is indeed relevant to the question. Although the question asks 'why' and the answer is a repetition of the question, the subsequent paragraph provides an explanation for the action of placing the camera on the altar. The answer explains the context and cultural background behind this action, which is what the question is seeking."
PARTLY_RELEVANT,"The generated answer is partially relevant because it does mention 'học viên' (students) and 'lễ kỷ niệm' (anniversary) which are related to the question. However, the rest of the answer is about a specific context (a photography training center) and does not provide a clear explanation of the significance of putting a camera on an altar, which is the main focus of the question."
NON_RELEVANT,"The generated answer is a repetition of the question, providing no relevant information to answer the question. The question asks about who is honored by placing a camera on an altar, and the answer simply repeats the question without providing any relevant details or information."
PARTLY_RELEVANT,"The generated answer partly addresses the question of the origin of the custom of placing items on an altar in Thailand, but it veers off in an unexpected direction by introducing the story of students showing gratitude to their teachers. While it mentions that the action is not related to religious rituals, it does not provide a direct answer to the question. A more relevant response would provide a clear explanation of the origin and cultural significance of the custom."
PARTLY_RELEVANT,"The generated answer partially responds to the question. It does mention the topic of placing machines on an altar, but the relevance is not directly related to the question. The question is focused on the relation between placing a machine on an altar and religion, while the answer provides a more cultural context, discussing the act as a way to express gratitude and appreciation."
RELEVANT,"The generated answer provides the specific date range (7-11) for the meeting between Chinese President Xi Jinping and Taiwan's leader, which is directly related to the question's inquiry about the meeting date."
PARTLY_RELEVANT,"The generated answer partially answers the question by providing the leaders' names who met in Xin-ga-po. However, it does not explicitly state that they met in Xin-ga-po, leaving the reader to infer that detail. Providing the location where they met would make the answer more relevant."
RELEVANT,"The generated answer directly addresses the question about when the leaders of two sides of the Taiwan Strait first met, providing the correct year of 1949, making it highly relevant to the question."
RELEVANT,The generated answer mentions a specific event that is considered to have marked a new chapter in the relationship between China and Taiwan. This directly addresses the question and provides a relevant answer.
RELEVANT,"The generated answer provides specific details about the location of the event, which matches the question's inquiry about where the meeting between the Chinese President and the leader of Taiwan took place. The mention of Xin-ga-po (Xining, China) and Sang-gri La (Sangri La Hotel) is relevant to the question, indicating a correct answer."
