Relevance,Explanation
RELEVANT,"The generated answer directly addresses the question and provides a clear and concise answer, stating that hộ kinh doanh is not recognized as a legal entity under current Vietnamese law."
RELEVANT,"The generated answer is relevant to the question because it provides information on the current regulations governing the activities of a tổ hợp tác, despite its lack of recognition as a legal entity. The answer mentions specific laws, namely ones about legal entities and business laws, which is directly related to the question."
PARTLY_RELEVANT,"The generated answer partially answers the question, but it's not a direct answer. The question asks about the location where Taeyeon first participated in an international music festival, and the answer provides the location (Vancouver, Canada) and the festival name (Albatross Music Festival). However, it does not directly answer the question, which asks 'where' (Tại đâu) and the answer provides more details than what is asked for."
RELEVANT,"The generated answer provides the specific date when Taeyeon is expected to perform at the Albatross Music Festival, which directly answers the question asked."
RELEVANT,"The generated answer provides the location and date of the first international music event of Taeyeon, matching the conditions specified in the question. The answer addresses the question accurately, making it a relevant response."
RELEVANT,"The generated answer directly answers the question, providing the specific event where Taeyeon's first solo performance took place, including the event name, location, and date. The answer is relevant to the question as it provides the exact information asked for."
RELEVANT,"The generated answer directly answers the question about the name of the first international music event that Taeyeon participated in, which is specifically mentioned as Albatross Music Festival, and also provides additional context about the event's location and date."
RELEVANT,"The generated answer is directly addressing the question, providing the condition under which the valley of Green Lake is submerged in water. The answer is a complete sentence that answers the question and provides useful information."
RELEVANT,"The generated answer is relevant to the question because it provides the color of the water (xanh ngọc) in the park during the rainy season, which is the topic of the question. Additionally, it provides some context about the water temperature and depth, which is a bit of extra information but still relevant to the question."
PARTLY_RELEVANT,"The generated answer starts by echoing the question, which is a common self-referential mistake. However, the second part of the answer provides some relevant information about what makes the Green Valley magical, which is suitable for the question. However, the relevance is not as strong as it could be, and the answer would have been improved if the key points had been more clearly and concisely explained."
RELEVANT,The generated answer directly addresses the question by providing a specific number of complex issues that Huyện Ứng Hòa is facing in building its political system. The answer accurately answers the question and does not introduce any irrelevant information.
PARTLY_RELEVANT,"The generated answer is partly relevant to the question because it mentions 'huyện Ứng Hòa' and 'xây dựng hệ thống chính trị', which are related concepts. However, the answer is not directly addressing the question's inquiry about 'bao nhiêu vụ việc' (how many incidents). It instead mentions '7 vụ việc phức tạp' (7 complex incidents), which is not a direct answer to the question's inquiry."
RELEVANT,"The generated answer is directly relevant to the given question, providing a specific number (7 vụ việc) of complicated cases that Huyện Ứng Hòa is currently dealing with in the context of building a political system."
