Relevance,Explanation
RELEVANT,"The generated answer accurately identifies the quote 'Yêu mọi người, tin vài người và không hại ai cả' as being related to a specific individual's perspective, which is William Shakespeare. The answer is relevant because it provides a correct association between the quote and the person, aligning with the question's inquiry about who the quote represents."
RELEVANT,"The generated answer directly addresses the question and provides a quote from William Shakespeare, which is relevant to the question about his advice to human beings on how to live."
NON_RELEVANT,"The generated answer mentions William Shakespeare, but the quote 'Yêu mọi người, tin vài người và không hại ai cả' is not attributed to him in reality. The answer is not relevant to the question, which is asking about a Vietnamese author's famous quote."
PARITALY_RELEVANT,"The generated answer is partially relevant because it mentions a famous quote, but it does not directly answer the question about William Shakespeare's famous saying about how to treat people. The quote provided is about not playing with someone's emotions, which is a relevant theme, but it's not a direct answer to the question."
RELEVANT,"The generated answer directly addresses the question by stating the current status of Công ty TNHH Nhã Khắc Lâm's ability to operate a multi-level sales business, which is consistent with the question's inquiry about the company's permission to operate with its new name."
PARTLY_RELEVANT,"The generated answer partially addresses the question by providing a specific condition that a company needs to meet to operate a multi-level sales business. However, it does not provide a clear and direct answer to the question, but rather provides an explanation of a related issue. The answer mentions the company's failure to modify and supplement the certificate of registration according to the law, which is a relevant but not directly answerable point."
PARTLY_RELEVANT,"The generated answer partially addresses the question by providing information related to Công ty Nhã Khắc Lâm's compliance with law regulations. However, it does not directly answer the question about the specific procedure related to retail multi-level selling that the company has completed."
RELEVANT,"The generated answer directly addresses the reason why Công ty TNHH Nhã Khắc Lâm has not been allowed to operate a multi-level sales business, specifically mentioning the company's failure to complete modifications and additions to its business registration certificate in accordance with the law."
RELEVANT,"The generated answer provides information about the company's status regarding the modification of its certificate of registration for multilevel sales, which is specifically asked for in the question. Although it does not provide a specific time limit, the answer is still relevant to the question and provides some useful information."
RELEVANT,"The generated answer directly addresses the question about whether it's beneficial for pregnant women to listen to music to help their babies' brain development, providing a relevant and informative response that incorporates scientific research."
RELEVANT,"The generated answer directly addresses the benefits of listening to music for the fetus in the womb, which is the main topic of the question. The answer provides specific and relevant information about the developmental benefits of music for the fetus's physical and mental growth."
RELEVANT,"The generated answer is highly relevant to the question. The question asks about how to interact with the fetus for its development, and the answer provides specific suggestions on how to do so, such as talking, singing, and reading to the fetus, which are all supported by research. The answer accurately addresses the query and provides valuable information for the user."
RELEVANT,"The generated answer provides specific advice on how to read stories to a fetus during pregnancy, which is directly related to the question. The answer provides relevant information on the benefits of interacting with the fetus through reading, talking, and singing, which matches the context of the question."
RELEVANT,"The generated answer is directly related to the question, which asks what a pregnant woman should pay attention to when interacting with her unborn child. The answer provides specific actions such as talking and singing to the baby, which are relevant to the question and provide valuable information for the pregnant woman."
RELEVANT,"The generated answer provides the desired information, specifically the score of the match between Greece and Croatia in the play-off first leg. The answer is directly relevant to the question and provides the requested information accurately."
