Relevance,Explanation
RELEVANT,"The generated answer provides specific information about the position(s) that were elected at the Nghệ An Provincial Youth Union in 2017, which is directly related to the question."
RELEVANT,"The generated answer is the exact answer to the question, which is the correct province (Nghệ An) where Phạm Tuấn Vinh was elected as the Party Secretary (Bí thư). The answer fully meets the requirements of the question and is not off-topic, making it relevant."
RELEVANT,"The generated answer directly addresses the question, providing the percentage of Singapore's urban area that is green space, which is the specific information requested."
RELEVANT,"The generated answer provides a specific city that has the highest percentage of green area, which directly answers the question 'Thành phố nào có tỷ lệ diện tích cây xanh cao nhất nhì' (Which city has the highest percentage of green area). The answer is precise and relevant to the question, providing the city name and the percentage of green area."
RELEVANT,"The generated answer directly addresses the question, providing the specific area of Singapore's national city, which is 29.3%. The answer is precise and relevant to the question, providing the exact information requested."
RELEVANT,"The generated answer clearly addresses the question, providing a specific comparison between Vietnam and Singapore's urban green space rates. While the answer is a negation, it still provides relevant information to answer the question and provides a concrete statistic about Singapore's urban green space ratio."
RELEVANT,"The generated answer directly addresses the question, stating the goals and targets of IBSC for the next 3-5 years, which is perfectly relevant to the question's inquiry about IBSC's future objectives."
PARTLY_RELEVANT,"The generated answer partially addresses the question, but not directly. The question asks about the operations of IBSC, while the answer explains the company's strategy and development goals. The answer does mention the company's plans, but it does not provide sufficient information about the operations of IBSC to satisfy the requirement of the question."
RELEVANT,"The generated answer directly addresses the question about the development goal of IBSC, providing a specific and meaningful statement related to the company's aspiration to become a well-known and sustainable player on the market."
RELEVANT,"The generated answer directly addresses the question about IBSC's future plans, specifically stating their goal to become a well-known company with sustainable growth and stability in the next 3-5 years. The answer provides a concrete and relevant vision for the company's future development."
RELEVANT,"The generated answer provides information about Lukaku's contract duration, which is directly related to the question. Although it includes additional information about the possibility of contract extension, the main concern is the initial contract duration, which is 5 years, which matches the question. The answer is relevant because it provides the exact information requested, without including unnecessary details or going off-topic."
RELEVANT,"The generated answer provides the correct information about Manchester United being from England, which directly responds to the question about Manchester United's location."
RELEVANT,"The generated answer directly addresses the question, providing specific information on the possible extension of Lukaku's contract, which is the main concern of the question."
