Relevance,Explanation
RELEVANT,"The generated answer is directly related to the question, which asks what is confirmed through the international forest certificate. The answer describes the content confirmed through the certificate, specifying the boundaries of forest zones, including plot, parcel, and forest zone boundaries on the current forest map. This information is relevant to the question and provides a clear explanation of the certificate's confirmation process."
RELEVANT,"The generated answer is highly relevant to the question as it directly answers what Tổ chức chứng nhận rừng quốc tế is, providing detailed information about its role and functions in the field of forest certification and protection."
RELEVANT,"The generated answer directly answers the question, naming the specific agency (Cục Quản lý tài nguyên nước) and its parent ministry (Bộ Tài nguyên và Môi trường) responsible for collecting fees for water resource exploration and use permits."
RELEVANT,"The generated answer directly addresses the question about the responsibilities of Bộ Tài nguyên và Môi trường (Vietnam Ministry of Natural Resources and Environment) regarding water resources. The answer specifically mentions the ministry's role in managing water-related activities and ensuring environmental protection, which is relevant to the question."
RELEVANT,"The generated answer provides a direct response to the question, specifically mentioning the organization responsible for organizing the non-examination permit for the use of water resources. The answer is relevant to the question and provides a concrete answer."
RELEVANT,"The generated answer is a relevant response to the question as it provides specific information about the phase that requires payment for evaluation. The answer mentions a specific regulation (ptom 2) and explains the process of approval and payment, directly addressing the question and providing meaningful details."
RELEVANT,"The generated answer is directly related to the question, specifically discussing the powers of the Ministry of Public Security (Bộ Công an) regarding the use of a database for the implementation of criminal sentences (thi hành án hình sự). The answer explains the Ministry's rights and responsibilities in managing, using, and supervising the database, which aligns with the question's focus on the Ministry's role in this context."
RELEVANT,"The generated answer is relevant to the question because it discusses additional legal responsibilities of the Ministry of Public Security (Bộ Công an) beyond the rights mentioned in the question. The answer specifically mentions tasks such as cooperating with the Ministry of National Defense, reviewing and adjusting lists of industrial products related to national security, and avoiding duplication of effort, which directly relates to the question's inquiry about the ministry's legal responsibilities in this area."
RELEVANT,"The generated answer directly addresses the speeding fine for the specific speed range mentioned in the question (10km/h to 20km/h), providing the fine range in Vietnamese currency (3,000,000 to 5,000,000 dong). The answer is highly relevant to the question."
RELEVANT,"The generated answer directly addresses the question, providing specific information about the fine for a motorbike (xe máy) traveling over 15 km/h. The answer provides a range of 600,000 to 1,000,000 Vietnam Dong, which is a clear and useful response to the question."
