Relevance,Explanation
NON_RELEVANT,"The generated answer is asking the same question as the original question, instead of providing an answer. It does not provide any relevant information to the original question."
RELEVANT,"The generated answer directly addresses the question, specifically mentioning the targets of Vietnamese language strengthening for minority children by 2020, which accurately matches the question's requirements."
RELEVANT,"The generated answer directly addresses the question 'Honda CR-V 2017 có mấy loại động cơ?' and provides detailed information about the types of engines available in the 2017 Honda CR-V, including their specifications and characteristics."
RELEVANT,"The generated answer directly addresses the question, providing the type of engine (tăng áp phun nhiên liệu trực tiếp 1.5 lít) and its horsepower (190 mã lực) on the 2017 Honda CR-V, which is an exact match to the question's query."
PARTLY_RELEVANT,"The generated answer does not directly answer the question, but it provides some relevant information about the Honda CR-V 2017 model. The question asks about the engine capacity, and the answer provides the engine specifications, including the cylinder capacity, but not a direct answer to the question."
RELEVANT,"The generated answer provides the exact value of horsepower and torque for the 2.0 liter engine on Honda CR-V 2017, directly addressing the question and matching its context."
RELEVANT,"The generated answer clearly and accurately provides the specific gear used by the Honda CR-V 2017, which is Earth Dreams CVT. This closely matches the question and provides a relevant and factual response."
RELEVANT,"The generated answer directly addresses the question, providing a specific number of people arrested in the UK in relation to the Manchester bombing. The information is relevant and accurate, matching the question's requirements."
RELEVANT,"The generated answer directly addresses the question, providing a specific number of related individuals and their names, which are relevant to the incident."
PARTLY_RELEVANT,"The generated answer partially relevant as it provides additional information about related countries, but it does not directly answer the question. The question is asking for other countries related to the event, but the answer provides a list of countries that have been denied visas by the US, which is a slightly different context."
RELEVANT,"The generated answer provides the number of people arrested related to the Manchester bombing incident, which is directly relevant to the question. The answer also provides context about the release of 2 individuals and details about the current status of the remaining 14 suspects, further supporting the relevance of the answer to the question."
RELEVANT,"The generated answer directly responds to the question, providing a specific number of people who were released free, which is the main inquiry in the question. The answer is concise and relevant to the context of the question."
RELEVANT,"The generated answer specifically addresses the question of who the prime suspects were in the James Bulger murder case, correctly identifying Jon Venables and Robert Thompson, both around 10-12 years old at the time, as the perpetrators."
RELEVANT,"The generated answer directly provides the date of the James Bulger murder case, which is the exact information requested in the question."
PARTLY_RELEVANT,"The generated answer provides some relevant information, as it mentions Jon Venables and Robert Thompson being involved in a crime and their ages. However, the question asks about their age at the time of the crime, and the answer only provides a range of ages (10-12) without specifying the exact age or the date of the crime. Additionally, the answer includes extraneous information about James Bulger's age and the date of the crime, which is not directly relevant to the question."
