Relevance,Explanation
RELEVANT,"The generated answer directly responds to the question about the fine amount for passengers who litter, providing specific monetary ranges, which matches the expectation and context of the question."
PARTLY_RELEVANT,"The generated answer seems to discuss the rules and regulations regarding vehicles having the right to pick up and drop off passengers along the route, but it does not directly answer the question. The answer provides some relevant information (e.g. the type of vehicle) but omits crucial details (e.g. complete definition of 'dọc đường'), making it partially relevant."
PARTLY_RELEVANT,"The generated answer is partly relevant to the question because it mentions the concept of passengers agreeing to give up their seat to another vehicle, which is related to the question. However, the answer goes beyond the scope of the question by providing some background information on the contract and the regulations, making it less relevant to the original question."
RELEVANT,"The generated answer providesrelevant information related to the question about whether a car owner can relinquish customers to another car that violates the law. The answer explains that according to the regulations, the driver of a car cannot carry a license plate inspection report without being fined, but the specific fine for relinquishing customers to another car that violates the law is not explicitly stated. This answer is therefore relevant to the question and provides useful information, albeit some ambiguity."
RELEVANT,"The generated answer is directly addressing the question, which asks what else a teacher needs to lack a qualified teacher in the same field. The answer correctly states that a degree in teaching education is required in addition to a degree in education."
RELEVANT,"The generated answer provides information about the conditions for recruiting new teachers at THPT level III, matching the question's inquiry about the conditions for teaching certification. The answer includes specific requirements such as having a bachelor's degree or higher in education or a relevant field, and obtaining certification for teaching at THPT level III within 36 months of employment."
RELEVANT,"The generated answer directly addresses the question about how newly hired teachers can meet the standard of educational training to work in THPT grade III. The answer provides specific requirements for certification, education background, and in-service training, which are all relevant to the question."
RELEVANT,"The generated answer directly addresses the question about whether a certified copy of a certificate can be considered as the original. It provides a clear explanation based on the context, using specific examples and terminology, and relates the answer back to the original document, making it relevant to the question."
RELEVANT,"The generated answer directly addresses the question, stating that a copy of a certificate does not have legal value, which aligns with the question's concern about the legality of a duplicate certificate."
RELEVANT,"The generated answer directly addresses the question, providing a clear explanation of the differences between bản sao and bản chính chứng chỉ, including the definition of each term and the characteristics that set them apart. The answer is relevant, accurate, and comprehensive, covering the key aspects of the question."
PARTLY_RELEVANT,"The generated answer partially addresses the question by discussing the requirement of clear face and clear ears in taking a photo for a CCCD, but it does not directly answer the question about using a copy of a teaching profession certification."
RELEVANT,"The generated answer provides relevant information about the scenarios where an original certificate is required, including the case where the person cannot read or write, which is the main context of the original question."
RELEVANT,"The generated answer provides a clear and detailed description of the responsibilities of the chairman of the ward in informing the village masses about the Party's and government's policies, which directly addresses the question. The answer highlights specific tasks, such as timely notification, checking the implementation of policies, and empowering the people to take charge, which corresponds to the requirements listed in the question."
