Relevance,Explanation
RELEVANT,"The generated answer directly answers the question, mentioning the specific award (huy chương vàng) and the event (SEA Games 26), which matches the requirements in the question."
PARTLY_RELEVANT,"The generated answer mentions potential opponents for Nadal, but it doesn't directly answer the question about 'tiềm năng' (future opponents) at the Shanghai Masters. Instead, it mentions specific players Nadal could potentially face, which is related but not fully relevant to the question."
RELEVANT,"The generated answer provides a specific answer to the question about Rafael Nadal's schedule on October 15th, which is a relevant piece of information to the question."
PARTLY_RELEVANT,"The generated answer mentions Nadal's next match at Thượng Hải Masters, which is related to the question. However, it only provides information about the opponents and the date, but not the exact date of Nadal's next match, which is what the question is asking for."
PARTLY_RELEVANT,"The generated answer mentions the two possible opponents (Federer and Del Potro) of Nadal, which is partly related to the question about who Nadal faced in the Shanghai Masters. However, it does not specify the actual opponent, which is the key information required in the question, making it only partly relevant."
RELEVANT,"The generated answer provides specific information about when Nadal will face Federer or Del Potro, which is a direct answer to the question. Although it doesn't provide the name of the tournament, it still addresses the query's main concern, which is the adversary Nadal will face."
RELEVANT,"The generated answer directly addresses the question's concern about the potential consequences of rhinoplasty on the smile, listing specific outcomes such as laughter with an open mouth, loss of the upper lip when smiling, and the appearance of acne on the mouth and inability of the lips to close properly."
PARTLY_RELEVANT,"The generated answer does not directly address the question about the risks of CPreAuthorize for the lips. However, it mentions some possible risks or consequences related to the alteration of the lips, which is indirectly relevant to the question. The actual question is about the risk assessment of CPreAuthorize, whereas the answer is about the risk assessment of a specific cosmetic procedure. Although the topics are related, the answer does not directly answer the question, hence the PARTLY_RELEVANT classification."
RELEVANT,"The generated answer directly addresses the potential impact of creating a facial shape for a cow (tạo hình môi sừng trâu) on the ability of the cow's lips to close (khép kín của môi), which is the central question. The answer discusses various potential complications, such as smiling with an open mouth, losing the upper lip when smiling, and the appearance of a scar on the lip, which all relate to the original question."
RELEVANT,"The generated answer directly answers the question about the possible sequelae of creating a mouth shape of a bull's horn, specifically mentioning the risk of sarcoidosis on the mouth."
RELEVANT,"The generated answer directly addresses the question, listing potential negative impacts after rhinoplasty. The answer is relevant to the question, providing specific consequences of the cosmetic procedure, which is the focus of the original question."
RELEVANT,"The generated answer directly answers the question by listing the two candidates running in the French presidential elections. The answer is specific, accurate, and relevant to the query."
RELEVANT,The generated answer directly addresses the question about Emmanuel Macron's stance towards the European Union (EU) policies. It provides specific information about Macron's supportive views on EU and his reputation as a moderate and EU-friendly candidate.
PARTLY_RELEVANT,"The generated answer partially addresses the question by acknowledging that there is no information available about a party leader who is enthusiastic about business, which is relevant to the question. However, it does not provide a specific answer to the question."
RELEVANT,"The generated answer is relevant to the question as it addresses the topic (Mặt trận Quốc gia) and provides information (lack of information) related to the question (their stance on immigration). Although it doesn't provide a direct answer, it shows awareness of the topic and is relevant to the question."
