Relevance,Explanation
RELEVANT,"The generated answer directly addresses the question by listing the principles that the measures to prevent human trafficking by the Border Defense Force and the Coast Guard must comply with. The answer is relevant to the question as it provides specific guidelines and requirements for the measures to prevent human trafficking, which is the main topic of the question."
RELEVANT,"The generated answer addresses the specific context of ensuring the law is followed when implementing measures to prevent human trafficking, which is a direct response to the question's request for what the Border Defense Forces and Coast Guard should ensure."
RELEVANT,"The generated answer directly addresses the question, which asks about the responsibilities of Ministry of Public Security, Border Guard and Coast Guard in relation to human trafficking victims. The answer provides a clear and detailed list of their responsibilities, including preventing, rescuing, and protecting victims, and ensures that the explanation is consistent with the relevant laws. The answer is relevant because it provides a direct and accurate answer to the question."
RELEVANT,"The generated answer directly addresses the question, providing information on the individuals with responsibility for preventing human trafficking, specifically referring to the roles of Bộ đội Biên phòng, Cảnh sát biển, and other law enforcement forces."
NON_RELEVANT,"The generated answer discusses the responsibility of individuals and contractors for compensation in cases of property damage, but the specific context is unrelated to the original question about the performer's obligation to pay compensation in case of private property damage. The answer provides information on the liability for damage in general, but does not address the question's focus on the performer's responsibility for private property damage."
RELEVANT,"The generated answer is relevant to the question because it provides an example of a situation where objects may be accidentally damaged during construction work. Although the answer is provided in a different language, the context and content are relevant to the question."
RELEVANT,"The generated answer provides detailed information about the percentage of medical examination expenses that are supported, which directly addresses the question. The answer also includes additional details about the calculation method and the maximum amount supported, making it a relevant and informative response to the question."
RELEVANT,"The generated answer directly answers the question and provides a specific limit on the maximum support for a single consultation, which is 800,000 VND per person per consultation."
PARTLY_RELEVANT,"The generated answer provides some related information, but it's not a direct answer to the question. The question asks for the number of times each laborer can enjoy occupational disease treatment per year, but the answer provides an incorrect detail that each person only receives support once per year. The statement about 02 times of support per year is partially correct, but the rest of the answer is irrelevant."
RELEVANT,"The generated answer directly addresses the question about when the level of support for occupational disease examination is applied, providing a specific detail about the situation when it is applied and the maximum amount. The answer is relevant to the question as it provides concrete information about the topic."
PARTLY_RELEVANT,"The generated answer is partly relevant because it mentions the responsible unit for determining the prices of occupational health checks, which is approximately what the question asks. However, the question specifically asks about the unit that is responsible for 'ban hành' (issuing) the price graph, whereas the answer only mentions the unit responsible for determining the prices, which is a slightly different aspect."
RELEVANT,"The generated answer directly addresses the question about the responsibilities of a unit of accounting according to the 2003 Accounting Law. The answer accurately summarizes the duties mentioned in the law, including managing, using, preserving, and storing accounting documents and providing timely and accurate information to organizations and individuals. The response fully answers the question and provides relevant information."
