Relevance,Explanation
PARTLY_RELEVANT,"The generated answer mentions something about a plan to tackle flooding in the inner city of Hanoi, which is partially relevant to the question. However, it does not explicitly mention which company is authorized to carry out the plan, which is the main point of the question."
PARTLY_RELEVANT,"The generated answer does not directly address the question of what 'lực lượng và phương tiện' Việt Nam prepared in response to the flooding situation, but it provides some relevant information about the measures being taken by two companies (Thoát nước Hà Nội and Cây xanh Hà Nội) to mitigate the effects of flooding. However, the answer does not provide the specific 'lực lượng và phương tiện' mentioned in the question."
RELEVANT,"The generated answer directly addresses the question, which asks about the negative impacts of flooding on people in Hanoi. The answer provides specific examples of the negative impacts, including the preparation and actions of two companies in Hanoi to mitigate the effects of flooding. The answer is relevant to the question because it provides concrete information about the consequences of flooding on people in Hanoi."
PARTLY_RELEVANT,"The answer partially answers the question, as it mentions another organization, Công ty TNHH MTV Cây xanh Hà Nội, that is also preparing for a storm. However, the question asks about units other than the company managing water drainage, and the answer only provides one specific example that may not be exhaustive."
PARTLY_RELEVANT,"The generated answer mentions the aftermath of a disaster (lũ lụt) and the response of a certain institution (GD&ĐT Đắk Lắk), but it doesn't directly address the question about which industry is responsible for ensuring the safety of people, properties, and transportation during a storm/hurricane. The answer is partly relevant because it provides context related to the aftermath of a disaster, but it doesn't provide a direct answer to the question."
RELEVANT,"The generated answer provides information about the native places of Hoa loa kèn, which matches the question. Although it also provides additional information about Hoa loa kèn being grown in Đà Lạt, Việt Nam, the essence of the answer is still focused on the question's core inquiry."
RELEVANT,"The generated answer provides a specific type of climate (ôn đới) that is suitable for the characteristics of the flower loa kèn, directly addressing the question's inquiry about which climate is most suitable for the flower."
RELEVANT,"The generated answer provides specific information about the location where Việt Nam first cultivated the orchid, which directly answers the question. The answer is relevant and accurate, providing clear context and supporting details to justify the relevance."
RELEVANT,"The generated answer provides specific information about the origin of Hoa loa kèn, mentioning the Ryukyu Islands and Japan, which are relevant to the question about the country of origin in East Asia."
RELEVANT,"The generated answer directly addresses the question, providing information on where the hoa loa kèn is grown outside of Vietnam, namely Japan and Taiwan, making it highly relevant to the original question."
PARTLY_RELEVANT,"The generated answer mentions the day with the most viewership registrations, which is partially relevant to the question. However, the question specifically asks when there are many viewers, but the answer mainly provides the specific date instead of explaining why it is the busiest day."
RELEVANT,"The generated answer provides a specific number (gần 40,000 people) for the question 'Số người đăng ký xem gấu trúc Hương Hương nhiều nhất là bao nhiêu?', which directly answers the question's inquiry about the number of people who registered to see the Hương Hương panda."
RELEVANT,"The generated answer is relevant to the question because it answers the quantity of viewers who watched the panda Hương Hương on a holiday (lễ). The answer provides a specific date (23-12) and number of viewers (gần 40.000), which directly responds to the question."
RELEVANT,"The generated answer directly addresses the question, which asks about the number of people who registered to view the Hương Hương giant panda on December 23rd. The answer provides a specific number (around 40,000) in response to the question, making it highly relevant."
