Relevance,Explanation
RELEVANT,"The generated answer provides specific benefits that police officers can enjoy when transferring to a new post, which is directly related to the question about forms of welfare enjoyed during transfer."
RELEVANT,"The generated answer provides a direct response to the question, mentioning other supports beside compensation for police officers when they transfer to a new unit, matching the question's scope and intent."
RELEVANT,"The generated answer directly answers the question, providing the specific decree number and name that regulates karaoke business activities, making it highly relevant to the given question."
RELEVANT,"The generated answer provides a comprehensive list of things that are provided within a karaoke service, which directly answers the question about what is provided in a karaoke service."
PARTLY_RELEVANT,"The generated answer partially addresses the question by mentioning that karaoke services are provided at places that meet certain conditions. However, it does not provide a comprehensive list of where karaoke services are provided, which is the primary information requested in the question."
RELEVANT,"The generated answer directly addresses the question and provides specific details about the technical requirements for karaoke activities, including equipment and facilities, which is relevant to the question of whether karaoke has specific technical requirements."
PARTLY_RELEVANT,"The generated answer is related to the question, but it's not a complete answer. The question is asking for the specific fine (mức phạt) for driving a car (xe ô tô) while towing another car (xe khác), whereas the generated answer is asking about the fine again, instead of providing the amount."
RELEVANT,"The generated answer is directly answering the question, providing the exact range of fines for driving an automobile to tow another vehicle, which correlates with the prompt's requirement."
RELEVANT,"The generated answer is relevant to the question because it provides the specific information about the fine range for the case of controlling a car to tow another car, which is the topic of the question."
RELEVANT,The generated answer directly answers the question about the range of the fine for driving a car while towing another car.
RELEVANT,"The generated answer directly answers the question about the fine for controlling a car to pull another car, which is a specific offense under Vietnamese traffic law. The answer provides a specific range of fines, which is relevant to the question and can be used to answer it."
RELEVANT,"The generated answer directly answers the question, providing the location where people undergoing compulsory treatment for rehabilitation can receive medical treatment."
