Relevance,Explanation
RELEVANT,"The generated answer directly addresses the question about the regulations that must be followed when generating profits from a fund, providing specific guidelines and examples of what is allowed and not allowed."
RELEVANT,"The generated answer provides a specific regulation or rule related to the question, clarifying what actions are allowed regarding assets of a fund, and what exceptions apply."
RELEVANT,The generated answer directly addresses the question by highlighting potential risks when using funds for investment purposes that differ from the originally intended objectives. The answer provides specific examples and regulations that a fund management company must follow to ensure responsible use of funds.
NON_RELEVANT,"The generated answer appears to be the question itself, instead of a response that explains the concept of 'điểm khoáng sản'. It does not provide any additional information or insight into the concept, making it non-relevant to the question."
PARTLY_RELEVANT,"The generated answer partially addresses the question, as it provides a definition of a type of discovery related to mineral resources. However, the question specifically asks what determines a discovery to be considered a 'point of mineral resources', and the answer does not fully address this determination."
PARTLY_RELEVANT,"The generated answer partially addresses the question by providing a definition of 'điểm khoáng sản'. However, it does not directly answer the question about whether there is a significant mineral resource. The answer instead focuses on the quality of the discovery at the time of investigation, which is not directly related to the question's concern about the existence of a large mineral resource."
PARTLY_RELEVANT,"The generated answer provides some relevant information about the term 'điểm' in the context of khoáng sản, specifically that it refers to the discovery of mineral deposits with quality suitable for exploitation. However, it does not fully answer the question 'Tại sao người ta gọi là 'điểm' khoáng sản?', instead providing some definition and context rather than the reason."
RELEVANT,"The generated answer directly addresses the question, providing specific examples of mineral discoveries that are not suitable for exploitation, namely Biểu hiện khoáng sản and Điểm khoáng sản. The answer is relevant to the question because it provides concrete instances that support the answer. The content is also coherent and well-organized, making it easy to understand the relevance of the answer to the question."
RELEVANT,"The generated answer provides detailed information about the regulation of funding, payment, and expense control for the Science and Technology Enterprise Development Support Program, which directly answers the question. The answer provides specific references to relevant documents, including circulars and instructions, which increases its relevance to the question."
PARTLY_RELEVANT,"The generated answer mentions a specific topic (chế độ kiểm soát, thanh toán chi ngân sách nhà nước qua Kho bạc Nhà nước), but it does not provide a direct answer to the question about a specific thông tư ( ordinance) issued by Bộ Tài chính. The answer instead talks about a different topic (nhiệm vụ, quyền hạn và trách nhiệm trong quản lý và sử dụng Quỹ thực hiện chính sách tiền tệ quốc gia) and only partially related to the question. To be considered RELEVANT, the answer should have directly addressed the specific topic and provided the required information."
RELEVANT,"The generated answer directly addresses the question by providing specific numbers and details about the number of circulars related to controlling and settling state budget expenditures through the State Treasury, which is in line with the question's inquiry."
RELEVANT,"The generated answer is directly addressing the question, providing a list of units included in the Total Electric Corporation. It is a relevant answer that provides a clear and concise explanation to the question."
RELEVANT,"The generated answer provides a direct answer to the question, stating that except for the electricity companies at the provincial and city levels, no other unit directly belongs to the Electricity of Vietnam. The answer is relevant to the question, addressing the query about other units that belong directly to the Electricity of Vietnam."
