Relevance,Explanation
RELEVANT,"The generated answer provides a specific reason (bị giãn cơ) for why Tuấn Anh cannot participate in the U22 Vietnam team's training session, aligning with the question's inquiry about the reason."
RELEVANT,"The generated answer directly addresses the question by stating the lack of information about Đức Huy's injury, which is a plausible and accurate response to the question seeking to know the reason why Đức Huy did not attend the training session due to injury."
NON_RELEVANT,"The generated answer does not provide any information about a specific physician or physical therapy expert who is treating Tuân Anh. Instead, it discusses the process of transferring a patient to a different hospital for treatment, which is not relevant to the question."
PARTLY_RELEVANT,"The generated answer does contain some relevant information, specifically the fact that there is no information about Tuấn Anh's injury. However, it does not provide a direct answer to the question, which is asking about the specific injury that Tuấn Anh suffered. Therefore, it is partially relevant."
RELEVANT,"The generated answer directly addresses the question, providing information about the absence of information regarding Đức Huy's injury location in the given text."
RELEVANT,The generated answer directly addresses the question by providing the coach's assessment of the U.20 Vietnam team's abilities. The answer mentions the coach's high evaluation of the team's potential and his confidence in their upcoming friendly match as a good preparation for the World Cup in Korea. The content is related to the question's inquiry about the coach's evaluation of the team's ability.
RELEVANT,"The generated answer provides information about Claudio Ubeda's expectations from the upcoming friendly match with U.20 Vietnam, which is directly related to the question. The answer discusses the preparation for the World Cup in Korea and the team's experience with Asian weather, which is relevant to the question."
RELEVANT,"The generated answer directly answers the question by providing the reason why HLV Claudio Ubeda considers the friendly match with U.20 Vietnam as important, which is to prepare for the World Cup in Korea. The answer is relevant to the question and provides a specific example or explanation for the reason."
NON_RELEVANT,"The generated answer does not address the question about U.20 Argentina's participation in a tournament in South Korea. Instead, it mentions a preparation trip to Vietnam for friendly matches, which is not related to the question."
RELEVANT,"The generated answer directly answers the question about the specific friendly match before a tournament, including the name of the tournament (U20 World Cup 2017), making it highly relevant to the question."
PARTLY_RELEVANT,"The generated answer partially addresses the question by mentioning the demands of North Korea, but it does not directly answer the question about what North Korea demands from South Korea and the US to proceed with military negotiations. The answer focuses on the demands related to the policy towards North Korea and the return of personnel, which is relevant to the broader context of the question. However, it does not directly provide the specific demands mentioned in the question."
PARTLY_RELEVANT,"The generated answer is partly relevant to the question because it touches on the idea of conditions for negotiations between North Korea, South Korea, and the US. However, the specific conditions mentioned ( Halting hostilities, returning North Korean employees who fled to China) are not directly related to the original question, which asks about the conditions for negotiations between the three parties mentioned, whereas the generated answer talks about negotiations between North Korea and South Korea, with the US being mentioned separately."
PARTLY_RELEVANT,"The generated answer is partly relevant to the question because it does mention Triều Tiên and Hàn Quốc, which are related to the topic of the question. However, the specific answer provided (12 nhân viên phục vụ) is not directly related to the question, which asks about someone being returned. The answer provides an additional context about Triều Tiên's demands, but it doesn't directly answer the question."
RELEVANT,"The generated answer directly addresses the reason why North Korea demanded South Korea return 12 staff, which is a specific and relevant piece of information closely related to the given question."
PARTLY_RELEVANT,"The generated answer partially addresses the question by mentioning 12 nhân viên phục vụ (12 employees) and their action of seeking asylum in South Korea, which matches the topic. However, the question's context was missing, and it seems to be a separate event or scenario, making the relevance fall short of being directly related to the original question."
