Relevance,Explanation
RELEVANT,"The generated answer directly addresses the question, stating that there is no information provided about the number of people evacuated due to flooding in Hunan Province."
RELEVANT,"The generated answer is directly addressing the question by providing a specific region affected by the flood, matching the expected format of 'excluding Hồ Nam, [other affected region]'."
RELEVANT,"The generated answer directly addresses the question about the damages caused by a flood in Guangxi (Quảng Tây), specifically mentioning the affected people, transportation, and casualties, which are all relevant to the question."
RELEVANT,"The generated answer acknowledges that there is no relevant information about the affected activities of amphibians in Guangxi due to the flood, which directly addresses the question about the impacts of the flood on amphibian activities in Guangxi."
RELEVANT,"The generated answer provides the names of 4 DJs who have performed at an event in Hanoi on September 17th, which is directly related to the question asking which DJs performed in Hanoi on that date."
RELEVANT,"The generated answer mentions specific artists who have attracted thousands of fans in Hanoi, which directly addresses the question about artists who have performed in Hanoi and drawn a large audience. The answer is relevant to the question as it provides the desired information."
RELEVANT,"The generated answer provides a list of DJs who performed a concert in Hanoi on September 17th, matching the question's requirement, which is a specific date and location, making it a relevant response."
RELEVANT,"The generated answer provides a list of famous DJs who have performed at sold-out shows in Hanoi, which directly addresses the question about DJs who have performed at sold-out shows in Hanoi."
PARTLY_RELEVANT,"The generated answer mentions a specific date (17/9) and mentions four artists, which is partially relevant to the question about which artists performed on stage in Ha Noi. However, the question asks about 'nghệ sĩ âm nhạc nào đã bùng nổ sân khấu thành phố Hà Nội' (which artists burst onto the stage of Ha Noi city) but the answer provides a list of artists without context or information about them 'bursting onto the stage'."
RELEVANT,"The generated answer is about a specific location in Yosemite National Park in the US, specifically Half Dome, which is a notable feature in the park. This answer is directly related to the question asking about the park's notable locations."
PARTLY_RELEVANT,"The generated answer partially answers the question by mentioning that adventurous tourists can conquer Half Dome, but it does not specifically identify the tourists who can conquer it. The answer also includes additional information about Half Dome and its location, which is not directly relevant to the question."
RELEVANT,"The generated answer provides a descriptive phrase about Half Dome, which matches the question's query about what Half Dome is. Although the answer does not directly provide a specific category, such as a mountain or a tourist attraction, the context suggests that it is related to a geographical feature or natural landmark."
RELEVANT,"The generated answer directly addresses the question about the surroundings of Half Dome, providing information about Half Dome being a mountain rock in Yosemite National Park, USA, with a spectacular view, which is highly relevant to the question."
RELEVANT,"The generated answer provides a reason why tourists should visit Yosemite Park, specifically mentioning the iconic Half Dome landmark, which is relevant to the question."
RELEVANT,"The generated answer directly addresses the question about the provinces in Syria that are currently engaged in ceasefire negotiations. The answer lists six provinces (Aleppo, Damascus, Homs, Hama, Idlib, and Quneitra) that are relevant to the question."
