Relevance,Explanation
RELEVANT,"The generated answer is directly addressing the specific export conditions for radioactive nuclear materials belonging to Groups 1 and 2, which aligns with the question's requirements, providing the necessary information on documentation, packaging, labeling, and import permits from the responsible authorities."
RELEVANT,"The generated answer directly addresses the requirement mentioned in the question, which is to provide proof of origin for nuclear source materials. The answer is a question followed by a statement that provides a necessary condition for nuclear source material to be exported, making it highly relevant to the question."
RELEVANT,"The generated answer is relevant to the question because it correctly identifies the authority responsible for issuing permits for the importation of nuclear materials, which is the receiving country's competent authorities. The answer provides a reasonable and accurate response to the question."
RELEVANT,"The generated answer is relevant to the question because it provides the steps to process data to calculate the construction price index. The answer accurately lists the steps including data collection, determining material prices, and using local prices for construction projects. The content is directly related to the question and provides a complete and detailed answer."
RELEVANT,"The generated answer directly addresses the question, specifically mentioning the contents of the inspection and adjustment process for input factors in calculating the construction price index, including prices of construction materials, labor, and machinery and equipment. The answer also provides concrete information about how to determine each of these prices based on relevant regulations and guidelines."
PARTLY_RELEVANT,"The generated answer partially addresses the question by mentioning the need to convert total investment and construction plan data for calculating the index of construction cost. However, it only provides an example of unit conversion (from m² to m²), which is not directly related to the context of the question. The question asks about units to convert to, not just an example of conversion."
RELEVANT,The generated answer fully addresses the question by providing specific information about what needs to be checked to ensure the accuracy of the prices of machines and equipment for construction cost index calculation.
RELEVANT,"The generated answer directly addresses the question, providing a clear procedure for issuing a proposal to re-export traditional medicine that has been recalled. The answer is concise, informative, and relevant to the question, and does not contain any extraneous or off-topic information."
PARTLY_RELEVANT,"The generated answer is partially relevant to the question as it mentions the time frame for processing a document related to re-exporting traditional medicine, but it does not provide a clear answer to the question. The answer also provides additional information about the complaint process for pharmacy business establishment, which is not directly related to the question."
RELEVANT,"The generated answer directly addresses the question, providing specific information about the procedures and timeline for the Ministry of Health (Bộ Y tế) when a pharmaceutical facility requests permission to export traditional medicine that has been recalled."
RELEVANT,"The generated answer is fully relevant to the question, as it provides the specific department within the Ministry of Health with the authority to handle requests for re-exporting traditional medicine."
RELEVANT,"The generated answer perfectly mirrors the wording of the question and provides a direct answer to the inquiry, indicating a high degree of relevance between the question and the generated response."
RELEVANT,"The generated answer responds directly to the question, providing details on how a fund management company can use its assets. The answer clearly explains the regulations and restrictions on using assets for trading, lending, or other activities."
RELEVANT,"The generated answer directly addresses the question of whether there are regulations regarding the use of funds from a fund, specifically mentioning what a fund management company is not allowed to do with fund assets, which is relevant to the question."
