Relevance,Explanation
RELEVANT,"The generated answer provides a specific quote from the Chairman of the National Assembly, Nguyễn Thị Kim Ngân, regarding the evaluation of BOT investment. Although it doesn't directly answer the question on how to mobilize sources for BOT, it pertains to the attitude towards BOT investments, which is indirectly related to the question."
PARTLY_RELEVANT,"The generated answer partially addresses the question by providing a perspective on why Vietnam's BOT policy is criticized as slow. However, the answer is not directly relevant to the question as it does not explicitly state the reasons for the slowness, but rather focuses on the importance of implementing projects correctly and not evaluating BOT as wrong. Additionally, the answer uses ambiguous language, such as 'some projects' and ' không thể nào huy động được nguồn lực', which makes it difficult to understand the specific reasons behind the criticism."
RELEVANT,"The generated answer directly answers the question about the number of episodes in new TV shows on VTV3 channel, which makes it highly relevant."
RELEVANT,"The generated answer clearly states the time of broadcast for new films on VTV3, which is the main topic of the question. The answer provides specific time and days (Thứ tư và Thứ năm) which matches the expected information and is directly related to the question."
RELEVANT,"The generated answer directly addresses the question, providing specific information about the day(s) of the week and time when new VTV movies are broadcast. The answer is precise and relevant to the inquiry, providing the most accurate information one might look for in response to the question."
RELEVANT,"The generated answer directly addresses the question, providing the specific information asked, which is the channel where the new movie of VTV3 will be broadcasted. The answer accurately matches the query, with no irrelevant or distracting content."
RELEVANT,"The generated answer directly addresses the specific question about the broadcast time of a new film on VTV3, providing the exact time '21 giờ 50 phút'. The answer is specific, accurate, and relevant to the question's inquiry."
RELEVANT,"The generated answer provides specific reasons for the book 'Miếng ngon Hà Nội' being confiscated, which directly addresses the question. The answer is detailed and accurate, matching the context of the question."
RELEVANT,"The generated answer directly addresses the question by providing information about the consequences of the publishing company 'Nhà xuất bản Dân trí' facing issues with the book 'Miếng ngon Hà Nội'. The answer includes specific details about the content of the book being altered to fulfill political goals and violates the Publishing Law 2012, which makes it highly relevant to the question."
PARTLY_RELEVANT,"The generated answer is partly relevant because it does provide an answer to the question about which provision of the Publishing Law 2012 is being violated. However, the question is not asking for an example, but rather a specific provision. The generated answer provides a detailed explanation of the provision being violated, which is a departure from the original question."
PARTLY_RELEVANT,"The generated answer is not directly answering the question, but still provides some relevant information. The answer acknowledges that the author of the book 'Miếng ngon Hà Nội' is not mentioned in the context, which is a partial answer to the question. However, it does not provide the actual author's name, which is the main intent of the question."
PARTLY_RELEVANT,"The generated answer does not directly answer the question. Instead, it provides additional context and information about the book 'Miếng ngon Hà Nội', mentioning its errors, fines, and a possible location of correction (Trang 210). While the answer is related to the question, it is not a direct answer, making it PARTLY_RELEVANT."
NON_RELEVANT,"The generated answer is identical to the question itself, providing no new information or relevance to the question. It only asks the same question again and does not provide any answer or clarification."
PARTLY_RELEVANT,"The generated answer partially addresses the question by providing some information relevant to the topic, but it also contains incorrect information and sidetracks the main point. The model correctly states that Toyota has not received any paintings, but then goes off on a tangent to provide information about the total number of paintings submitted to the international art contest, which is not directly related to the question."
RELEVANT,"The generated answer directly addresses the question by providing the specific number of participants (544,200) in the international Toyota painting competition, which is the main information required by the question."
