Relevance,Explanation
RELEVANT,"The generated answer provides a specific date (8 tháng 9 năm 2017) and day (ngày 8 tháng 9) for Techfest Hải Phòng, directly answering the question."
RELEVANT,"The generated answer directly answers the question about the number of startup businesses that participated in Techfest Hai Phong 2017, providing a specific and relevant piece of information."
PARTLY_RELEVANT,"The generated answer acknowledges the uncertainty of the question and states that the location is not mentioned in the text. Although it's not a direct answer to the question, it's a relevant response in a sense that it addresses the question and provides a reasonable explanation."
RELEVANT,"The generated answer is relevant to the question because it provides the exact definition of Techfest Hải Phòng, which is a specialized startup and innovation exhibition in Hải Phòng. The answer accurately answers the question, providing the correct information about the nature of Techfest Hải Phòng."
RELEVANT,"The generated answer provides a list of free iOS applications on July 30th, which directly answers the question. The answer is relevant to the question because it satisfies the query for free iOS applications on a specific date."
RELEVANT,"The generated answer lists specific iOS applications that are free, which is directly related to the question asking for applications that are free on the iOS platform on July 30th. The answer provides a list of apps that meet the criteria specified in the question, making it relevant."
RELEVANT,"The generated answer provides a list of iOS apps that are free on a specific date, July 30th, which directly answers the question about listing free iOS apps on that day."
PARTLY_RELEVANT,"The generated answer partially addresses the question by acknowledging that there is no information available on July 30th about free applications for tablets. However, it does not provide any relevant information or answers to the question, which makes it not entirely relevant. The answer is somewhat relevant as it provides a clear and concise answer about the availability of information on that specific date, but it does not provide a solution or an answer to the original question."
RELEVANT,"The generated answer directly answers the question by stating whether Tiny Defense is one of the free iOS apps on July 30th, which matches the question's content and context."
PARTLY_RELEVANT,"The generated answer mentions 'va chạm' (collision) which is related to the question. However, it only provides a general statement about the number of recorded collisions, and does not directly answer the question about the number of collisions between US military ships and civilian ships."
RELEVANT,"The generated answer provides multiple examples of collisions between US warships and civilian vessels other than the incident between USS Fitzgerald and a Philippines cargo ship, which is the main topic of the question. The answer is directly addressing the question and provides relevant information."
RELEVANT,"The generated answer directly addresses the question, providing information about the number of recorded incidents between Japanese warships and civilian ships, which aligns with the question's topic."
PARTLY_RELEVANT,"The generated answer partially matches the question by mentioning the collision of a Japanese warship with a vessel on the Seto Inland Sea. The answer correctly identifies the location and the type of collision. However, it does not exactly match the question, which asks about a collision with 'a type of ship' (in this case, 'tàu dân sự'), whereas the answer specifies 'tàu đánh cá' (fishing boat). This discrepancy reduces the relevance of the answer to the question."
RELEVANT,"The generated answer directly addresses the question by providing additional cases of collisions between foreign warships and civilian ships, which matches the context and scope of the question."
