Relevance,Explanation
RELEVANT,"The generated answer provides information about the current state of prostitution in residential areas of HCMC, which is directly related to the question. The answer discusses the forms and methods of prostitution, which are relevant to understanding the issue."
RELEVANT,"The generated answer directly addresses the question by stating that there is no information provided about the forms used to facilitate prostitution, which is relevant to the question."
RELEVANT,"The generated answer provides a clear and relevant explanation of the typical forms of business activities that occur in the environment of prostitution. The answer is directly related to the question, which is asking about the common forms of business activities in this environment."
RELEVANT,"Although the generated answer does not provide a direct numerical answer to the question, it instead informs that the report does not provide such information, which is directly related to the question asking about the amount of money that sex workers in HCMC receive. The answer is relevant as it acknowledges the lack of information in the report instead of providing an incorrect or unrelated answer."
PARTLY_RELEVANT,"The generated answer partially answers the question by providing the location where the MV 'Khi có em' was shot, which is correct. However, it does not directly answer the question 'Tại đâu' which means 'where' in English. The answer is related to the question but does not fully address the inquiry."
RELEVANT,"The generated answer directly addresses the question, which is about what Hà Anh did after the song reached a million listens. The answer may not provide a concrete answer, but it clearly indicates that the question is not discussed or mentioned in the answer, which makes it relevant to the context."
RELEVANT,"Although the answer is brief, it directly addresses the question by stating that the information about Hà Anh's difficulties in the MV process is not available. The answer is highly relevant as it provides a clear response to the question's inquiry."
RELEVANT,"The generated answer is a direct quote from the question, which is indicating that Hương Giang Idol participated in a music video with the title Khi có em. The answer is identical to the question, showing a high degree of relevance."
RELEVANT,"The generated answer explicitly states that it cannot find information about the production cost of MV When having an em, which directly answers the question and provides a specific response, making it relevant to the query."
RELEVANT,"The generated answer provides a specific time and date mentioned in the question, indicating that it directly answers the query and is relevant to the question."
RELEVANT,"The generated answer explicitly addresses the purpose of the US Navy ships approaching the Iranian oil rig, matching the question's intent and providing a relevant response."
RELEVANT,"The generated answer is relevant to the question because it provides a specific example of a US aircraft carrier that performed a warning shot. Although the question is phrased in a more general form, the answer provides a concrete instance that matches the context of the question."
RELEVANT,"The generated answer provides a specific location where an event occurred, which directly answers the question 'Vị trí cụ thể nơi xảy ra sự việc?' (Specific location where the event occurred?)."
RELEVANT,"The generated answer directly addresses the Iran's response to the US Navy's action, which is in line with the question's topic, making it relevant."
