Relevance,Explanation
RELEVANT,"The generated answer directly answers the question about the ideal time to go to Lençóis Maranhenses for a beach bath, specifically mentioning the rainy season from July to September, which is a relevant and accurate piece of information for the question."
PARTLY_RELEVANT,"The generated answer provides information about the temperature of the water, which is related to the question about the water temperature in Lençóis Maranhenses. However, the answer is not entirely relevant because it does not directly answer the question about the temperature, but instead provides a general statement about the temperature being suitable for swimming."
RELEVANT,"The generated answer directly addresses the question, providing a specific value (3m) for the depth of a natural pool (hồ bơi tự nhiên) in Lençóis Maranhenses. The answer is relevant and accurate, providing a precise piece of information mentioned in the question."
RELEVANT,"The generated answer accurately answers the question 'Lençóis Maranhenses là gì?', providing a description of what Lençóis Maranhenses is, specifically mentioning it is a desert area in Brazil characterized by white sand dunes and green lakes. The answer is relevant and directly addresses the question."
RELEVANT,"The generated answer directly addresses the question, stating the change in Việt Nam's ranking on the FIFA table, including specific numbers and timeframe (month) as requested in the question."
RELEVANT,"The generated answer directly answers the question by providing specific information about the improvement of the Vietnamese women's national football team in FIFA's ranking during the second quarter of 2017, matching the context of the question."
RELEVANT,"The generated answer is directly addressing the question, providing specific information about the teams' ranking changes in the second quarter of 2017. The answer mentions Thailand and Vietnam, both teams from the Asian region, and their ranking changes, which is in line with the question's inquiry."
RELEVANT,"The generated answer directly answers the question about the ranking of the Vietnamese women's football team on the FIFA ranking table, providing specific information about the change in ranking in a specific quarter."
PARTLY_RELEVANT,"The generated answer partially answers the question by mentioning an achievement of the team, but it doesn't directly answer the question about what helped the team advance to a new rank in Q2/2017. Although the answer mentions a qualifying event in April 2017, it does not provide the specific information about what contributed to the team's success."
RELEVANT,"The generated answer clearly addresses the question asking about the camera configuration of OnePlus 5, specifically mentioning it has a dual camera setup similar to iPhone 7 Plus. The answer is directly related to the question's topic and provides relevant information."
RELEVANT,"The generated answer directly provides the technical specifications of the dual-camera system of OnePlus 5, which matches the content and context of the question."
RELEVANT,"The generated answer directly answers the question, providing specifications for the resolution of the main camera and auxiliary camera of OnePlus 5 (16 MP and 20 MP respectively). The answer matches the context and format of the question, making it a relevant response."
RELEVANT,"The generated answer directly addresses the question about the aperture size of the primary camera lens of OnePlus 5, which is f/1.7, matching the context of the question."
RELEVANT,"The generated answer directly addresses the question, providing information about the smartphone model with the highest resolution dual-camera system, as claimed by OnePlus."
RELEVANT,"The generated answer provides a clear and accurate explanation of why injecting vitamin K to newborns is important, specifically highlighting its role in preventing hemorrhagic diseases, its impact on blood coagulation, and the underlying reasons for its importance (e.g., some newborns may have a deficit in vitamin K during the first 30-40 days of life). The answer addresses the main concern of the question and provides relevant details to support its assertion, making it relevant to the question."
