Relevance,Explanation
RELEVANT,"The generated answer directly addresses the question, providing specific information on the organizational model of non-public libraries in Vietnam, as required by the 2019 Library Law."
PARTLY_RELEVANT,"The generated answer is partly relevant to the question as it only addresses the scenario of foreigners working in a library, while the question asks about anyone who can invest or ensure the conditions for a library's operation outside the public sector. The answer provides relevant information about foreigners, but fails to cover the broader scope of the question."
RELEVANT,"The generated answer directly addresses the question, providing a clear and accurate description of the main differences between public libraries and private libraries in Vietnam. The answer includes specific details about the organizational models, funding sources, and management structures of both types of libraries, making it highly relevant to the original question."
PARTLY_RELEVANT,"The generated answer is partly relevant because it is a standalone version of the question, which does not provide a direct answer. However, it includes a relevant sentence at the end, referencing a regulation that provides a possible answer to the original question."
RELEVANT,"The generated answer directly addresses the specific form of punishment mentioned in the question, which is 'phạt cụ thể' or 'specific fine', and provides the range of the fine. The answer is relevant to the question because it provides the required information on the punishment for causing traffic congestion by driving a motorbike"
RELEVANT,"The generated answer explicitly mentions the situation described in the question (xe máy di chuyển thành đoàn) and provides a plausible reason for a potential accident (không có khoảng cách an toàn giữa hai xe). The answer is directly responsive to the question, making it relevant."
RELEVANT,"The generated answer directly addresses the question, providing specific examples of other behaviors relevant to motorcycles on the streets, which aligns with the question's topic and context."
NON_RELEVANT,"The generated answer is the same as the question, providing no meaningful information or answer to the question, which asks for the unit of measurement for packaged items ready for shipment."
RELEVANT,"The generated answer specifically mentions the information that is recorded on packaged goods, which matches the topic of the question about what information is recorded on packaged goods. The answer is relevant to the question because it provides a detailed description of the types of information that are typically recorded on packaged goods."
RELEVANT,"The generated answer explicitly addresses the question by providing a definition of hàng đóng gói sẵn and clarifies the situation where the buyer is present during the packaging process, directly answering the question and providing a logical explanation for the conclusion. The answer is highly relevant to the question."
RELEVANT,"The generated answer directly addresses the question, providing a clear definition of hàng đóng gói sẵn (pre-packaged goods) and the types of units they are measured in."
RELEVANT,"The generated answer is relevant to the question as it explains the reason behind the regulation of pre-packaged goods by law. The answer provides specific examples of the benefits of regulation, such as ensuring accuracy in measurement and protecting the rights of consumers. The content is closely related to the question and provides a clear and logical explanation of the regulation's purpose."
RELEVANT,"The generated answer clearly addresses the question about the members that can become a special trading member. The answer provides specific conditions and criteria for the bank, foreign bank branches, and securities companies to meet in order to become a special trading member, which directly answers the question."
RELEVANT,"The generated answer provides a list of specific entities that can become special trading members, directly addressing the question about the types of members that can be special traders."
