Relevance,Explanation
RELEVANT,"The generated answer correctly identifies Nikki Haley as the US Ambassador to the United Nations, which is a specific country or organization mentioned in the question. The relevance between the question and the generated answer is direct and accurate, making it a relevant response."
PARTLY_RELEVANT,"The generated answer partially answers the question, providing information about the rights of President Trump, specifically the power to hire and fire. However, it does not directly answer the question about Theodore Nikki Haley's rights."
PARTLY_RELEVANT,"The generated answer partially addresses the question by providing a specific example of Nikki Haley's disagreement with a decision made by President Trump. However, the answer does not directly answer the question, as it does not provide a general statement about Haley's agreement or disagreement with all of Trump's decisions. Instead, it provides a specific example and explains her views on presidential powers."
RELEVANT,"The generated answer directly addresses the question about President Trump's power to hire and fire anyone, and provides specific quotes from Nikki Haley to support the claim. The answer is relevant and accurate in its response to the question."
RELEVANT,"The generated answer directly addresses the question and provides a clear response, acknowledging that there is no information available to answer the question."
PARTLY_RELEVANT,"The generated answer partially addresses the question, as it mentions Notarbartolo's skill in cracking the code, which is one of the skills mentioned in the question. However, the answer only provides information about this one skill, without addressing the other skills that were used in the Antwerp heist. The answer lacks completeness and relevance to the full scope of the question."
RELEVANT,"The generated answer provides a specific method by which Frank William Abagnale Jr. committed fraud, namely using fake pictures and forged documents to withdraw money from banks, which is directly related to the question of how he scammed banks."
RELEVANT,"The answer provides the specific countries where Frank William Abagnale Jr. pretended to be a pilot, which directly answers the question asking for the countries where he did so."
RELEVANT,"The generated answer directly addresses the question by specifying a scenario in which a special loan can be used to support the liquidity of a credit organization, which is in line with the question's inquiry. The answer provides a specific and relevant example, showcasing a good understanding of the question's context."
RELEVANT,"The generated answer directly addresses the question, specifying the maximum time limit for special lending supported by the State Bank of Vietnam to ensure liquidity, which is the exact information required by the question."
RELEVANT,"The generated answer explicitly addresses the question about the ceiling period for special loans provided by the State Bank to support liquidity, directly answering the query and providing the required information."
RELEVANT,"The generated answer is relevant to the question as it directly addresses the purpose of using specific lending for supporting liquidity, specifically for withdrawals by individual depositors."
RELEVANT,"The generated answer is relevant to the question as it directly addresses the task that an organization credit institution performs during a special lending period, which is restructuring according to an approved restructuring plan. The answer is a specific and accurate description of a responsibility of the organization."
