Relevance,Explanation
PARTLY_RELEVANT,"The generated answer does not directly address the main concern of the question, which is whether the method of electing city council deputies (HĐND) is affected by changes in the population of the commune. However, the answer does indirectly provide relevant information, as it clarifies that the method of voting is not changed regardless of population changes. A more complete answer would have addressed the conditionality of the method of voting and its relationship to population changes."
RELEVANT,"The generated answer directly addresses the question, providing a specific calculation and reasoning to determine the number of additional deputy seats that would be elected with an increase in population from 7000 to 8000 people, accurately answers the question and is therefore highly relevant."
RELEVANT,"The generated answer is relevant to the question because it discusses another factor that affects the number of delegates, which was asked in the question. The answer specifically mentions regulations about the organization and function of the People's Council and People's Committee, which is a clear connection to the question."
RELEVANT,"The generated answer directly addresses the question, providing specific information about the fine amount for working on a fishing boat without essential documents, including personal ID cards."
RELEVANT,"The generated answer directly addresses the question about whether a person can be punished for working on a fishing boat without identification papers. The answer clearly states the fine range (300,000 to 500,000 VND) for not having required documents, which is the relevant information sought in the question."
PARTLY_RELEVANT,"The generated answer is partially relevant as it provides some information related to the question, specifically the types of documents required for working on a fishing boat. However, the answer is too detailed and includes a wide range of information, including non-essential items such as the vessel's dimensions and materials. The original question only asks for the types of necessary documents, not their detailed descriptions."
RELEVANT,"The generated answer addresses the risk of committing a crime by forgetting to bring an ID (CMND) when working on a fishing boat, which is directly related to the question."
RELEVANT,"The generated answer provides a specific and direct answer to the question about the range of fine money for forgetting to carry the ID card when working on a fishing vessel, which is precise and relevant to the question."
RELEVANT,"The generated answer provides a detailed explanation of the main function of the Commander-in-Chief of the Military Command of the central government in issuing documents related to national defense, which directly answers the question."
RELEVANT,"The generated answer closely matches the question's intent, providing a detailed list of specific tasks and responsibilities of a Commanding Officer in terms of national defense, as regulated by law. The answer covers various aspects of national defense, including strategic planning, resource allocation, and emergency preparedness."
RELEVANT,"The generated answer provides a detailed explanation of how the group of commanders of the military headquarters of the central ministry participates in the process of building the political system, specifically citing the relevant regulations and mechanisms, which directly addresses the question."
RELEVANT,"The generated answer directly addresses the question about the number of major aspects of the task of the advisory council. The answer provides specific details about the two main aspects of the council's task, which is coherent with the question."
