Relevance,Explanation
RELEVANT,"The generated answer is directly related to the specific fines for the behavior of letting animals run free in the city streets, which is what the question is asking. The answer provides the specific penalties, namely a fine of 100,000 to 300,000 VND, which is the relevant information to the question."
RELEVANT,"The generated answer is highly relevant to the question as it directly addresses the query and provides a clear and specific response about a common penalty for releasing domestic animals into the wild, which is the topic of the question."
RELEVANT,"The generated answer specifically mentions the level of fine (60,000 - 100,000đ) for the illegal act of releasing farm animals into the wild, which directly answers the question about the specific fine for the mentioned behavior."
RELEVANT,"The generated answer directly addresses the question about the maximum fine for abandoning animals, providing a specific range of values. The content is highly relevant to the question, accurately conveying the required information."
RELEVANT,The generated answer directly addresses the question about who is responsible for the budget to handle the consequences of railway accidents in urban areas. The provided information about the regulations and scope of responsibility from the law matches the context of the question.
RELEVANT,"The generated answer directly answers the question by stating that the company responsible for the cost of consequences of railway accidents in urban areas is the urban railway busines, which is a specific instance of Linh vực in the context of the question."
RELEVANT,The generated answer directly addresses the question about the specific law regulating responsibility for urban railway accident expenses and correctly mentions the relevant laws under different circumstances.
PARTLY_RELEVANT,"The generated answer is partially relevant because it attempts to answer the question, but it does not fully address the requirement for a specific type of business or industry. The answer instead provides a broader definition of the businesses that may be responsible for initial costs in case of an accident, which may not be directly relevant to the original question."
RELEVANT,"The generated answer accurately addresses the question, providing specific responsibilities of a urban railway business enterprise in case of an accident, including reporting it to the nearest police station and provincial people's committee in case of a fatality. The answer is relevant to the question and addresses the exact responsibility mentioned."
RELEVANT,"The generated answer directly addresses the question, providing additional required documents when modifying a vehicle's total machine or chassis. The answer is specific, detailed, and consistent with the question's context, making it relevant to the question."
RELEVANT,"The generated answer provides a list of specific documents that the owner of the vehicle must submit when changing the vehicle registration certificate, which is directly relevant to the question. The answer is specific, accurate, and provides the requested information, making it relevant to the question."
RELEVANT,"The generated answer specifically addresses the question of what additional documents are needed in cases of engine or chassis replacement, mentioning the specific documents required to identify the vehicle's machine number and chassis number, which directly answers the query."
RELEVANT,"The generated answer directly addresses the question about the fine for violating driving conditions in foggy weather, providing a specific range of fine amounts (100,000 - 200,000 VND). The answer is relevant to the question and provides the requested information."
