Relevance,Explanation
RELEVANT,"The generated answer directly answers the question, stating that SEAT Ibiza is a good choice for a small and compact car in 2017, supported by the fact that it was rated the best car in the UK. The answer is specific, accurate, and contains relevant information that addresses the user's query."
RELEVANT,"The generated answer directly addresses the question by providing a list of car models other than SEAT Ibiza that were considered good in 2017. The answer is relevant because it provides supporting information to the question, answering what other car models were considered good in that year."
RELEVANT,"The generated answer directly addresses the question by stating that there is no information available about the best SUV small and light cars introduced in 2017, which is a relevant response to the question."
RELEVANT,"The generated answer directly answers the question by listing several models of small and lightweight cars that Citroen is known for, including the Citroen C4 Cactus, Citroen C3, and others that are not directly related to Citroen but are mentioned as examples of highly-rated small cars in 2017."
RELEVANT,The generated answer directly answers the question providing the amount of money (100 triệu đồng) the minister of VHTTDL rewarded to the Vietnamese women's football team after winning the SEA Games 29 championship.
PARTLY_RELEVANT,"The generated answer partially answers the question, as it mentions the reward given to the women's Vietnam football team by the Minister of the Ministry of VH,TDL. However, the answer does not provide the name of the Minister, which is the main information requested in the question."
RELEVANT,"The generated answer directly addresses the question, providing the name of the team that received the 100 million dong reward from the Ministry of VHTTDL after SEA Games 29, which matches the information sought in the question."
PARTLY_RELEVANT,"The generated answer is partly relevant to the question because it mentions SEA Games, which is related to the question. However, it does not provide the number of gold medals for women's football, which is the specific information requested in the question. Instead, it provides information about the teams participating in the tournament and the date it took place."
PARTLY_RELEVANT,"The generated answer provides partial information related to the question, specifically mentioning the prize money given to the Vietnamese women's football team. However, the answer is not directly addressing the question's scope, as it only mentions one team, team type, and does not provide the general amount of prize money given to all teams."
PARTLY_RELEVANT,"The generated answer provides a specific number of female students (3) who were disciplined, but it does not provide the overall total of female students disciplined in Nghệ An, as requested by the question. Therefore, while it partially addresses the question, the relevance is not high enough to be classified as RELEVANT."
NON_RELEVANT,"The generated answer talks about 'Ba nữ sinh khối 10 đã bị kỷ luật', whereas the question asks about the number of female students punished for fighting in Nghe An. The answer does not provide any information related to the number requested in the question, making it non-relevant."
RELEVANT,"The generated answer directly responds to the question, providing a specific number of female students who were disciplined. The answer is concise and relevant to the query, addressing the main question of how many female students were disciplined."
PARTLY_RELEVANT,"The generated answer provides some relevant information about incidents related to school violence, but it does not directly answer the question about the number of female students disciplined in Nghệ An. The answer provides a scenario with specific numbers (Ba nữ sinh, 10th grade), but the information is not related to the time frame of 'Lần gần đây nhất' (the latest time frame) mentioned in the question, which requires a more specific answer about the recent incidents."
PARTLY_RELEVANT,"The generated answer mentions '3 nữ sinh' which matches the context of 'Số nữ sinh' in the question. However, it only provides the number of girls and their school grade (khối 10) without answering the question about what block they were in. It requires additional information to answer the question fully, making it partly relevant."
RELEVANT,"The generated answer directly addresses the question, providing a description of Hồ Quỳnh Hương's outfit during the performance on September 22nd in HCMC. The answer matches the context and question, providing the required information in a clear and concise manner."
