Relevance,Explanation
PARTLY_RELEVANT,"The generated answer provides some information related to the incident at the Yên Bình 2 substation, mentioning the EVNNPC's coordination with the UBND tỉnh Thái Nguyên to repair the issue. However, it is not directly answering the question about the specific impact on production operation, making the relevance only partly relevant."
PARTLY_RELEVANT,"The generated answer partially addresses the question by providing a scenario where EVNNPC ensures power supply to Samsung after an incident. However, the question specifically asks about what EVNNPC did to ensure power supply, whereas the answer only describes the measures taken without explicitly stating what action was taken."
PARTLY_RELEVANT,"The generated answer partially addresses the question by mentioning EVNNPC's agreement with the customer to provide sufficient power, but it does not directly answer the question about the specific capacity of electricity provided to Samsung after the incident."
RELEVANT,"The generated answer directly addresses the question about the power source used by Samsung's factory after an accident. The answer mentions EVNNPC ( Electricity of Vietnam National Performance Company) agreeing with the customer to use a local power source to provide 100% of the required capacity, which is relevant to the question."
RELEVANT,"The generated answer directly answers the question about Huấn luyện viên Nguyễn Hữu Thắng's desired outcome for the match between Vietnam and Jordan, which is to gain 1 point."
RELEVANT,"The generated answer provides a specific date and time for the match between Vietnam's national team and Jordan, which directly addresses the question's inquiry about the time of the match."
PARTLY_RELEVANT,"The generated answer partially answers the question by providing the location of the match (sân Thống Nhất). However, it does not directly answer the question about the team facing Jordan, which is the main topic of the question. The answer assumes the question is asking about a specific match between Vietnam and Jordan, which might not be the case."
RELEVANT,"The generated answer provides the specific date of the match between Vietnam's national team and Jordan, which is a direct answer to the question. The answer matches the context and syntax of the question, demonstrating relevance to the query."
RELEVANT,"The generated answer specifically mentions the tournament being referred to in the context of the question, which is the Asian Cup 2019, and also mentions the match between Vietnam and Jordan, directly addressing the question about which international football qualifying round the match belongs to."
RELEVANT,"The generated answer directly addresses the question, mentioning the suspect relationship between Bà Diệp's sister (chị P) and her husband (ông Trần Văn D), which is exactly what the question is asking about."
RELEVANT,"The generated answer provides an explanation for why bà Diệp thinks chị P has a relationship with her husband, which is one of the main points of the question. The answer gives specific details about the suspicion and the evidence that supports it."
PARTLY_RELEVANT,"The generated answer partially addresses the question by mentioning a phone call being recorded, which is relevant to the question's topic. However, it does not adequately answer the question as it appears to be a specific scenario and not a general answer to the question 'Ai đã ghi âm cuộc điện thoại khiến bà Diệp nghi ngờ?' (Who recorded the phone call that made Bà Diệp suspicious?)"
PARTLY_RELEVANT,"The generated answer is partially relevant to the question because it mentions a relationship between two individuals, which is the main content of the question. However, the answer is not directly addressing the specific relationship between 'bà Diệp' and 'ông Trần Văn D', but instead provides a context about another relationship and its conflict."
PARTLY_RELEVANT,"The generated answer partially addresses the question by explicitly stating that there is no information available about the phone call between Mr. Tran Van D and Ms. P in the provided data. However, it does not provide any further information or details about the recording process of the phone call itself, which is the main concern of the question."
RELEVANT,"The generated answer directly answers the question about when Pakistan stopped its military and intelligence cooperation with the US, providing a specific date (9-1). The content is highly relevant to the question."
