Relevance,Explanation
RELEVANT,"The generated answer is relevant to the question as it provides information about North Korea's development of nuclear weapons and ballistic missiles, which is the topic of the question. The details in the answer, such as the mention of the KN-17 missile and the development of a miniaturized nuclear weapon, show a clear understanding of the topic and provide additional information that is relevant to the question."
RELEVANT,"The generated answer directly addresses the question about North Korea's goals in developing nuclear weapons. The answer provides specific information about North Korea's desire to maintain the ability to attack anywhere in the world, its concerns about its right to self-defense, and its willingness to negotiate to develop its nuclear program in a peaceful manner. The answer is relevant to the question because it provides a clear and concise explanation of North Korea's motivations and goals in the context of its nuclear program."
RELEVANT,"The generated answer directly addresses the question, providing the location of SEA Games 29, which is Malaysia. The answer is a specific and accurate response to the question, demonstrating relevance."
NON_RELEVANT,"The generated answer is the same as the question, which is a repetition of the original question. The answer fails to provide any new information or respond to the question, making it non-relevant."
RELEVANT,"The generated answer provides relevant information about Việt Nam's performance at SEA Games 29, including their goal of winning the championship and their defeat by Thailand in the previous edition. The answer also provides specific details about the team's performance, such as their victory over the Philippines and the contributions of individual players. The answer is relevant to the question because it addresses the question of Việt Nam's performance at SEA Games 29 and provides specific examples to support the answer."
RELEVANT,"The generated answer directly addresses the question, stating the specific goal of the female Vietnamese football team at SEA Games 29. The answer provides the correct information and is relevant to the question."
RELEVANT,"The generated answer directly addresses the question about the team's objective at SEA Games 29, specifically mentioning a past event and a rival team, which shows a strong relevance to the original question."
RELEVANT,The generated answer provides an explanation for why trâu số 12 lost at the third round of the Đồ Sơn 2017 bullfighting competition. The content is directly related to the question and provides a clear and concise answer to the query.
PARTLY_RELEVANT,"The generated answer mentions a specific animal ('trâu số 12') and a situation ('chấn thương'), but the context is not directly related to the question about the quarterfinal match. The answer seems to be describing an incident involving a specific animal, but it does not provide information about the match, making it partly relevant."
PARTLY_RELEVANT,"The generated answer partially addresses the question, specifically mentioning a reason (gãy chân phải = broken right leg) that could be related to a horse (trâu = horse) leaving a field (sân = field). However, the question mentions a 'trâu số 12' which implies a specific horse number, and the generated answer only provides a vague reason without specifying which horse number is referred to."
PARTLY_RELEVANT,"The generated answer is partly relevant because it provides some information related to the condition leading to the failure of 'trâu số 12' (a specific buffalo identified as 'trâu số 12'). However, the answer is not directly addressing the condition leading to its failure, instead, it mentions the reason for the buffalo's defeat in a competition ('Chung kết chọi trâu Đồ Sơn 2017'). The relevance is limited, hence the classification as 'PARTLY_RELEVANT'."
RELEVANT,"The generated answer provides a specific tournament match (bán kết 3 chọi trâu Đồ Sơn 2017) where trâu số 12 got hurt and had to leave the field, which directly answers the question."
RELEVANT,"The generated answer is directly addressing the question asked, providing information about the date (4/4), groups accusing, and specific location (Idlib, Khan Shaykhun). The question and answer are closely related, making it a relevant response."
RELEVANT,"The generated answer directly addresses the question by mentioning the Syrian government's denial of a specific accusation related to Idlib, namely the use of chemical weapons. Although the answer does not provide an exact match to the question's wording, it still answers the question's intent about the government's denial of certain allegations."
