Relevance,Explanation
PARTLY_RELEVANT,"The generated answer mentions that Dani Alves and Bonucci scored goals in a cup national championship in Italy, which is partially relevant to the original question. However, it does not specify which one of them is a Juventus defender, which is the key information required in the question. The answer is not totally irrelevant but lacks the specific information required to be fully relevant."
NON_RELEVANT,"The generated answer mentions specific players (Dani Alves and Bonucci) and positions (hậu vệ, which translates to defender), but it does not provide the correct information about who scored the goals for Juventus against Lazio. The answer is unrelated to the question."
RELEVANT,"The generated answer directly responds to the question, providing the score by which Juventus defeated Lazio in the Cup of Italy, which is a relevant piece of information in answering the question."
RELEVANT,"The generated answer directly addresses the question, mentioning the specific match that helped Juventus win the national cup and Bonucci's goal in that match, which is Lazio. The answer accurately provides the required information to answer the question."
RELEVANT,"The generated answer provides a relevant response to the question, specifically mentioning 'hậu vệ Dani Alves' who scored a goal in a crucial match, along with Bonucci, which answers the question about other Juventus players who scored in a significant match."
RELEVANT,"The generated answer directly addresses the question, providing the approximate number of radical elements within the Dzhebhat en-Nusra group in Syria."
RELEVANT,"The generated answer provides a direct answer to the question, stating the origin of most people fighting in the Dzhebhat en-Nusra group. The answer mentions the local population, which is directly related to the question's inquiry."
RELEVANT,"The generated answer provides additional information about Dzhebhat en-Nusra, specifically the number of fighters and their origin, which is relevant to the question asking about the group's origin."
PARTLY_RELEVANT,"The generated answer partially matches the question, which asks for the full name of the terrorist group in question. While it provides the name 'Dzhebhat en-Nusra', it is unclear if this is the exact group being referred to, or if it's a related group. Additional context or clarification would be needed to determine the complete relevance of the answer."
RELEVANT,"The generated answer provides information about the origin of the extremists within the Dzhebhat en-Nusra group, which is directly relevant to the question. The answer specifically mentions that most of the extremists come from local people in Syria, which fulfills the requirement of the question."
RELEVANT,"The generated answer is directly relevant to the question, as it describes the emotions Kim Jong-un displayed when North Korea's rocket was launched successfully. The answer accurately addresses the question's inquiry about Kim Jong-un's emotional response, making it relevant to the context."
RELEVANT,"The generated answer provides a specific scenario that led to Kim Jong-un's smile. While it's not a direct answer to the question, it does attempt to answer the question by providing a concrete example, which is relevant to the inquiry about a specific situation that made Kim Jong-un laugh."
RELEVANT,"The generated answer mentions the presence of some officials, including Kim Jong-un, at the launch of a missile, which directly answers the question about who was present with Kim Jong-un when the missile was launched."
RELEVANT,"The generated answer directly addresses the question, providing the specific type of launchpad (KN-17) from which North Korean missiles are launched. The answer accurately answers the question and is completely relevant to the context."
RELEVANT,"The generated answer addresses the question about the launch site of North Korean missiles. Although it does not provide a specific location, it provides information about the uncertainty surrounding the location and the methods used by North Korea, such as using mobile launchers or ships, which is relevant to the question."
