Relevance,Explanation
NON_RELEVANT,"The generated answer is not relevant to the question about the role of a notary in the process of authorizing surrogacy, but instead talks about the exemption of a female notary from professional training due to pregnancy, which is a different topic."
RELEVANT,"The generated answer directly addresses the question by specifying that there are exceptions not requiring written authorization for surrogate motherhood, and one such exception is a letter from a prisoner."
RELEVANT,"The generated answer directly answers the question about the fine amount for encroaching on a protective forest area with an area of 12,000 to under 15,000 square meters, providing the specific range of fine amounts (25,000,000 to 32,000,000 VND)."
RELEVANT,"The generated answer directly addresses the question about the level of fine for violating the protection forest, specifying a range of 1,000,000 to 3,000,000 VND for an area of less than 2,000 m2, which is a relevant and accurate response to the question."
RELEVANT,"The generated answer directly addresses the question, stating the range of fine amount for the crime of violating forest protection area of 12,000 m2 to under 15,000 m2. The answer contains specific numbers and values, matching the context and requirements of the question."
RELEVANT,"The generated answer directly addresses the question, providing detailed information about the fined range for occupying forest land with an area of 12,000 to 15,000 m2. The answer is a rewritten version of relevant information from the provided context, making it highly relevant to the question."
RELEVANT,"The generated answer is directly related to the question, providing a specific punishment for the act of land encroachment on forest protective areas with a specific area range."
RELEVANT,"Although the answer is not a numerical value, it is related to the question's context. The question asks about the 'Diện tích Công an hiệu', which is a recognizable symbol in Vietnam. The answer describes the symbol's appearance, including its dimensions and design. While not a straightforward numerical answer, the response provides relevant information about the symbol's visual characteristics."
RELEVANT,"The generated answer provides the relevant information about the colors of a police badge, which matches the question 'Công an hiệu có những màu nào?' (What are the colors of a police badge?)."
RELEVANT,"The generated answer directly answers the question about the shape and design of the Dien Bien Phu Campaign insignia of the Vietnam People's Public Security, which is in the form of a round shape with 36mm diameter, featuring a five-pointed yellow star on a red background, surrounded by green and yellow colors."
RELEVANT,"The generated answer explicitly mentions 'cành tùng trên mũ' (a tree-shaped ornament on a hat) and provides specific information about its color ('màu vàng' means yellow). The question asks about the color of this ornament based on its level (cấp bậc), and the answer partially addresses this by providing a color (yellow). Although it lacks information about the level, the answer is still relevant as it provides correct and concrete information about the ornament's color."
PARTLY_RELEVANT,"The generated answer discusses the possibility of a transfer contract being represented by an individual, but first addresses the context of no direct information on the topic and then mentions other entities that can represent the contract. Although it's partially relevant to the question, the answer does not directly answer the question or provide a clear yes/no answer."
RELEVANT,"The generated answer directly addresses the question, discussing the scope of representation and the circumstances under which a representative can enter into a civil transaction on behalf of the represented party. Although the answer does not provide a straightforward 'yes' or 'no' answer, it provides relevant information about the conditions under which a representative can and cannot sign a transaction on behalf of the represented party."
