Relevance,Explanation
RELEVANT,"The generated answer is relevant to the question because it specifically addresses the question of how the UAE and Qatar can achieve a solution to the crisis. The answer provides quotes and statements from the UAE Foreign Minister, Anwar Gargash, providing concrete information and suggestions for a solution. The content is directly related to the question and provides relevant details and insights."
RELEVANT,"The generated answer is relevant to the question because it addresses the second part of the question, which is about the recommendations Ngoại trưởng UAE made for Qatar. The answer provides specific details about Ngoại trưởng UAE's recommendations, including the requirement for international supervision, preventing Qatar from being a sponsor of terrorism, and rejecting extremism."
RELEVANT,"The generated answer is directly addressing the question and providing information about the number of years Afghanistan had peaceful periods in the 20th century. Although the answer is complex and presents a nuanced view, it is still relevant to the question and does not appear to be off-topic or unrelated."
NON_RELEVANT,"The generated answer appears to be a mix of a question and a sentence, which does not provide an answer to the original question. It seems to be asking the same question again, instead of providing a relevant answer. Additionally, there is some incorrect or irrelevant information included, such as 'Afghanistan đang trong giai đoạn bình yên và chưa tan nát do chiến tranh trong những năm của thế kỷ 20', which does not align with the context and question provided."
RELEVANT,"The generated answer directly addresses the question, stating a specific time period (the 1950s-1960s) when Afghanistan was not involved in a civil war. The answer provides supporting context, including the US and Soviet Union's efforts to influence the Afghan government and the country's relative stability during this period. The information matches the question's requirements, making the answer RELEVANT."
RELEVANT,"The generated answer provides a brief context for when Afghanistan started to experience conflict. Although the answer doesn't directly answer the question, it does respond to the topic by providing a general description of the country's history, which is relevant to the question."
PARTLY_RELEVANT,"The generated answer partially answers the question, as it provides an attempt to answer the question about the duration of Afghanistan's peace status in the 20th century. However, the answer is incomplete and implicitly assumes that the question is asking about a specific period of peace, whereas the question is actually asking about the duration of Afghanistan's peace status in general. A more accurate answer would provide the actual duration of Afghanistan's peace status in the 20th century, if it existed."
RELEVANT,"The generated answer is relevant to the question as it provides the exact score (456 points) that Robot Xiao Yi achieved in the Chinese doctor licensing exam, matching the exact query phrase 'Đạt bao nhiêu điểm trong kỳ thi bác sĩ ở Trung Quốc' (Achieved how many points in the doctor licensing exam in China)."
RELEVANT,"The generated answer directly addresses the question about the score of robot Xiao Yi in the Chinese medical licensing examination, providing an exact numerical value which is an exact match with what the question is asking."
PARTLY_RELEVANT,"The generated answer provides a specific result (456 points) of Robot Xiao Yi's performance in a Chinese doctor's examination, which partially relates to the question (mentions Robot Xiao Yi's achievement in a specific exam). However, the context and the type of exam are not clarified, which reduces the relevance of the answer."
NON_RELEVANT,"The generated answer is about Robot Xiao Yi not being licensed to practice medicine in China due to having default points in the examination, while the question asks whether Robot Xiao Yi got a license after a certain exam. The answer does not directly address the question and provides unrelated information."
RELEVANT,"The generated answer directly addresses the question by providing information about the topic Robot Xiao Yi and the exam it took, matching the query's context and structure."
RELEVANT,"The generated answer directly answers the question, specifically mentioning the company 'Công ty TNHH đá Granite Đông Phát' and their involvement in violating and occupying a pedestrian path at the address specified in the question."
RELEVANT,"The generated answer directly addresses the question, providing a specific company (TNHH đá Granite Đông Phát) that allegedly violates pedestrian walkway rules at a particular address (290 Lê Văn Hiến, quận Ngũ Hành Sơn). The answer provides details about the violation, including the company's actions and the impact on the public. The relevance is high because the answer directly answers the question and provides substantial information related to the topic."
