Relevance,Explanation
NON_RELEVANT,"The generated answer does not address the question about the deadline for completing a project of land inventory, provided by the General Department of Land Administration. Instead, it discusses the requirement for a geologist of rank III to be promoted to rank II, which is a different topic altogether."
RELEVANT,"The generated answer is directly addressing the question's requirement to know what else needs to be done before the land inventory inspection 4 months ahead. The answer provides specific tasks that need to be completed, including constructing the land inventory project, creating a current land use map, and establishing a plan and guidelines for implementation. The content and context of the generated answer align well with the question, providing relevant information for the user."
RELEVANT,"The generated answer provides a specific and accurate answer to the question, specifying who (Bộ trưởng) is responsible for approving the plan and map of land use. The answer directly addresses the question's inquiry, making it highly relevant."
RELEVANT,The generated answer is relevant to the given question because it provides information about the agencies that the Tổng cục Quản lý đất đai collaborates with to conduct inventory of national defense land and security land.
RELEVANT,"The generated answer directly addresses the question, explaining that a fund management company does not have a maximum lending limit due to regulations governing short-term lending to cover necessary expenses or settle transactions with investors. The response provides specific details, including the 5% value of the net asset value requirement and the 30-day maximum loan term. The content is coherent and relevant to the question, providing a clear answer."
RELEVANT,"The generated answer addresses the question's query about the short-term loan term for a company that manages funds. The answer provides a specific value (30 days) that corresponds to the question, making it highly relevant."
RELEVANT,"The generated answer directly addresses the question, specifying the purpose of a company's short-term lending activities and providing additional details such as restrictions on lending amounts and durations. The answer is relevant to the question and provides specific information about the topic."
RELEVANT,"The generated answer directly answers the question, providing the maximum percentage of short-term loan value allowed by the fund, which is 5% of the net asset value, and the maximum loan term is 30 days, which is a specific detail mentioned in the question."
RELEVANT,"The generated answer directly addresses the question, providing the required information about the necessary permit for drivers of oversized and overweight cargo transport. The answer is clear and concise, matching the question's intent."
RELEVANT,"The generated answer provides information on the types of goods that are allowed to be transported by oversized trucks, which is closely related to the question about transporting goods by 'xe ô tô siêu trường, siêu trọng' (oversized trucks). The answer accurately explains the characteristics of such goods and the requirements for transporting them, making it a relevant response to the question."
RELEVANT,"The generated answer directly addresses the question, providing the specific conditions for using a vehicle to transport oversized and heavy goods. The answer is concise and relevant to the query, making it an accurate response."
RELEVANT,"The generated answer accurately identifies the agency responsible for issuing a license for transporting oversized and overweight goods, which is exactly what the question is asking."
RELEVANT,"The generated answer directly addresses the question, which is about what to do before transporting oversized or over-dimensional goods. The answer specifies the requirement for a valid permission from the relevant authorities, which is a crucial aspect of transporting such goods."
RELEVANT,"The generated answer directly addresses the question by providing a specific detail about the penalty for building a concentrated IT infrastructure behind schedule, which is the core information required by the question."
