Relevance,Explanation
PARTLY_RELEVANT,"The generated answer partially matches the question because it also asks the same question, but it doesn't provide any relevant information or answer. The provided context about the company being sued for adding arga fat into shrimp from 3 to 4 months ago seems unrelated to the question, and the answer does not provide a direct answer to the question."
RELEVANT,"The generated answer directly answers the question, providing the time period when the business started pumping additives (tạp chất) into shrimp. The same context and keywords (Lê Quang Long, tôm) as the question are used in the answer, indicating relevance."
RELEVANT,"The generated answer is highly relevant to the question as it directly answers what the output product of Lê Quang Long's business is, being 'tôm'."
RELEVANT,"The generated answer provides information about the plan of investigation of a specific person (Nguyễn Văn A) by a functional organization, which directly addresses the question. Although the information lacks details, it is still relevant to the question."
RELEVANT,"The generated answer directly addresses the question, providing specific information on how VPBank handles internal wrongdoing among employees, mentioning the example of a sales employee being terminated for misconduct."
RELEVANT,"Although the generated answer uses slightly different wording than the question, it accurately describes the channel VPBank uses to handle cases of employee misconduct. The answer specifically mentions 'kênh điều tra và phòng chống gian lận nội bộ' which is the channel described in the question. The answer is relevant to the question and provides the required information."
RELEVANT,"The generated answer provides details on how VPBank handles information about employee misconduct, directly addressing the question. The answer describes the procedures and measures taken by VPBank to detect and address employee misconduct, including internal investigations, reporting to the relevant departments, and applying disciplinary actions. The content is directly related to the question and provides a specific example to support the explanation."
RELEVANT,"The generated answer provides specific information on how VPBank prevents employee misconduct in the future, which is directly related to the question. The provided information includes the bank's methods for investigating and preventing internal fraud, as well as the consequences for employees who violate these methods. This information is relevant and coherent with the question, demonstrating the RAG system's ability to provide meaningful and relevant answers."
RELEVANT,"The generated answer directly addresses the question about VPBank's purpose of putting employees who violate rules into a black list, explaining that it is to prevent them from working again. The answer provides a specific example to support this claim."
RELEVANT,"The generated answer provides information related to the question about Việt Nam's requirement to win a certain number of goals to top the table. Although the answer does not directly provide the exact number of goals, it provides context and explanations about Việt Nam's situation in the tournament, which is relevant to the question."
PARTLY_RELEVANT,"The generated answer is a near-duplicate of the original question, with only minor changes to the word order and verb tense. While it does contain the relevant information - the score between Thailand and the Philippines - it is not a direct or accurate response to the question. A relevant response should provide a clear answer to the question asked, which is 'how many?' in this case. The generated answer assumes the reader already knows the question being asked and responds with a sentence that is more suitable as a question itself."
RELEVANT,"The generated answer mentions a country (Vietnam) and a specific football team (U22 Việt Nam) that defeated the Philippines. This information is directly related to the question, which asks about who the Philippines was defeated by."
RELEVANT,"The generated answer provides information about the reason why Vietnam needs to win against Malaysia with a score of 5-0, specifically to win the SEA Games 29 championship. The provided context about Thailand's win against the Philippines is relevant to the question because it might be used as an example or background information for Vietnam's need to win in order to achieve their goal."
