Relevance,Explanation
RELEVANT,"The generated answer directly responds to the question by providing the information about the timing and the teams participating in the volleyball match. The question asks about the timing of a match between two women's volleyball teams, and the answer provides the necessary details."
RELEVANT,"The generated answer is relevant to the question as it specifically discusses the impact of the result of the match between Vietnam and the Philippines on the next round, which is the semi-final. The answer provides a clear explanation of how the match outcome will affect the team's position in the tournament."
PARTLY_RELEVANT,"The generated answer mentions the consequences of winning a match against the Philippines, which is related to the question. However, the specific consequence mentioned (avoiding the defending champion Thailand) is not directly relevant to the question, which is what the winning team will get after a match against the Philippines. The answer is partly relevant because it provides some information related to the question, but it is not a direct answer to the specific question asked."
RELEVANT,"The generated answer provides a specific geographic location of the bombing incident, which is directly relevant to the question that asks about the country where the bombing occurred. The answer 'Pakistan' is a plausible and accurate solution to the question, making it highly relevant."
RELEVANT,"The generated answer directly addresses the question about the number of casualties caused by an attack in the Khyber area, providing specific numbers of deaths and injuries, which is a relevant response to the question."
RELEVANT,"The generated answer correctly mentions the location of the bombing incident, which is near the border with Afghanistan, matching the question."
RELEVANT,"The generated answer accurately names the country that shares a border with the Khyber region, which is Afghanistan. The answer is relevant to the question because it provides the correct geographic information required to answer the question."
PARTLY_RELEVANT,"The generated answer partially answers the question, as it provides the number of fatalities (6 people) in the context of a specific attack. However, it also mentions the number of injured people and the location of the attack (near the Pakistan-India border), which is not directly related to the question, making it PARTLY_RELEVANT rather than fully RELEVANT."
RELEVANT,The generated answer 'USS Tripoli được hạ thủy vào ngày 1 tháng 5' directly answers the question 'USS Tripoli được hạ thủy vào ngày tháng nào?' by providing the specific date of the USS Tripoli's launch.
RELEVANT,"The generated answer directly addresses the question, providing the specific capacity of the USS Tripoli in carrying F-35B fighter jets, which is the main intent of the question."
RELEVANT,"The generated answer accurately provides the date of commission of the USS Tripoli, which is the information requested in the question."
RELEVANT,"The generated answer is a direct response to the question, providing the exact number of F-35Bs that the USS Tripoli can carry, making it highly relevant."
RELEVANT,"The generated answer directly answers the question, providing both the release date of the USS Tripoli and the number of F-35B aircraft it can carry, which is exactly what the question asks for."
RELEVANT,"The generated answer discusses the opinion of the UAE Foreign Minister Anwar Gargash on the use of military force to resolve a diplomatic crisis with Qatar, which is directly related to the question. The answer provides specific quotes and statements from Gargash, indicating a good understanding of the topic and relevance to the question."
RELEVANT,"The generated answer directly responds to the question, stating Anwar Gargash's concerns about the peace efforts of Al-Sabah. The answer is highly relevant to the question and provides specific details about Gargash's worries."
