Relevance,Explanation
RELEVANT,"The generated answer 'Miranda Kerr' is directly related to the question 'Evan Spiegel đã kết hôn với ai?' which asks about Evan Spiegel's spouse, and the answer correctly mentions Miranda Kerr as his wife."
RELEVANT,"The generated answer directly answers the question, providing the name of the person Evan Spiegel is married to, which is Miranda Kerr."
PARTLY_RELEVANT,"The generated answer partially answers the question 'Khi nào Evan Spiegel kết hôn?' (When did Evan Spiegel get married?). It mentions the marriage of Evan Spiegel, but only provides the date (27-5) and refers to the local time. It does not provide the exact year or context of the marriage."
RELEVANT,"The generated answer mentions the specific person (Evan Spiegel) and provides a relevant date-related detail (the date of marriage), directly addressing the question about the year of marriage."
RELEVANT,The generated answer specifically mentions the event 'tuần lễ quốc tế FCB Escola lần thứ tư' which aligns with the question 'Gerrard Piqué bị một cầu thủ nhí ngó lơ trong sự kiện nào' referring to the incident where Piqué was involved in a 'nhí ngó lơ' incident during a specific event.
RELEVANT,"The generated answer accurately answers the question, providing information about what FCB Escola is, specifically a youth football training program managed by FC Barcelona."
RELEVANT,"The generated answer is a truthful admission by the model that it has no information about the 4th event of FCB Escola, which directly addresses the question and provides a correct response, albeit a negative one."
RELEVANT,The generated answer directly answers the question about how many times Gerrard Piqué participated in the FCB Escola event.
RELEVANT,"The generated answer is relevant because it directly addresses the question and provides a correct answer, which is that the information about who organizes the FCB Escola event is not provided in the given context."
PARTLY_RELEVANT,"The generated answer mentions HLV Toshiya Miura and quyền chủ tịch Lê Công Vinh, which are indeed related to football clubs. However, the question asks about CLB TP.HCM and CLB Than Quảng Ninh, and the generated answer does not explicitly mention these clubs. The connection between the mentioned individuals and the target clubs is indirect."
RELEVANT,The generated answer directly addresses the question by providing the names of individuals who were present at the match between TP.HCM and Than Quảng Ninh.
RELEVANT,"The generated answer provides specific details about the presence of HLV Toshiya Miura and quyền chủ tịch Lê Công Vinh in a particular match of V-League 2017, which directly answers the question and provides relevant information about the topic."
RELEVANT,"The generated answer directly answers the question, specifying Lê Công Vinh's role as Quyền Chủ tịch (Right Chairman) of TP.HCM football club, which is a relevant answer to the question about his role in the team."
RELEVANT,The generated answer directly addresses the question's requirement to achieve a certain goal (graining a spot in the semifinals) by specifying the minimum outcome needed in the last match against Thailand (getting at least one point). The answer is concise and relevant to the context of the question.
