Relevance,Explanation
PARTLY_RELEVANT,"The generated answer partially addresses the question by providing the date when Trump stopped in Hawaii, which relates to the question's mention of 'trước khi chuyến công du Châu Á' (before the trip to Asia). However, the question specifically asks about the number of days (ước bao nhiêu ngày) before the trip, which is not provided in the generated answer."
NON_RELEVANT,"The generated answer mentions Hawaii as the 'điểm dừng chân đầu tiên' (first stop) of Donald Trump's trip to Asia, which is not correct. There is no evidence to suggest that Hawaii is the first stop of Donald Trump's trip to Asia, and the question specifically asks about the 'điểm dừng chân đầu tiên' which implies a stop in Asia, not Hawaii. The answer is therefore non-relevant to the question."
PARTLY_RELEVANT,"The generated answer is partly relevant because it does provide some information about Donald Trump and his wife stopping over in Hawaii, which are the main entities mentioned in the question. However, the question specifically asks for the month, whereas the generated answer provides a specific date (November 3rd). This lack of specificity makes the answer only partly relevant to the question."
RELEVANT,"The generated answer directly answers the question by providing specific dates and locations related to Donald Trump's trip to Asia, including his stop in Hawaii before visiting Asia."
PARTLY_RELEVANT,"The generated answer mentions 'Các cầu thủ U20 Việt Nam' which matches with the question, but the answer does not directly address the timing ('khi nào') mentioned in the question. Instead, it provides a general statement about the teams' success in the V.League, which is related but not directly relevant to the question."
RELEVANT,"The generated answer is relevant because it acknowledges that the context does not provide information about Quang Hải and Hà Đức Chinh playing for a CLB (club), effectively addressing the question by clarifying the lack of relevant information."
RELEVANT,"The generated answer provides a list of players and a description of their playing situation. Although the question asks about players who have not got a regular position in V.League, the answer mentions players who have not got a regular position in the first division league (CLB) or play in the second division league, which is somewhat related to the question."
RELEVANT,"The generated answer is relevant to the question as it mentions HLV Lê Thụy Hải's opinion about the U19 Vietnamese team, which is directly related to the question's inquiry about his evaluation of the team."
RELEVANT,"The generated answer closely relates to the question, providing a specific suggestion (thi đấu ở giải trẻ) for the coach Lê Thụy Hải on where to play the U19 Vietnam football players."
RELEVANT,"The generated answer provides the location (Sochi, Nga) and the date (14-22/10) of the 19th World Youth Festival, which is directly related to the question ('Liên hoan Thanh niên, sinh viên thế giới lần thứ 19 diễn ra vào thời gian nào?'). The answer is specific, factual, and relevant to the question."
RELEVANT,"The generated answer directly addresses the question, specifying the location of the 19th World Youth Festival, which is a specific detail requested in the question."
RELEVANT,"The generated answer is highly relevant to the question, which asks what Việt Nam's delegates participate in at the 19th World Festival of Youth and Students. The answer mentions the specific activities, such as presenting speeches, participating in conferences, and meetings, which aligns with the question's requirements. The content is accurate and provides valuable information about the topics and areas covered during the event."
RELEVANT,"The generated answer directly addresses the question, providing information about the topics discussed at the 19th World Festival of Youth and Students, which includes several relevant topics such as independence and self-determination, the achievements of the October Revolution, youth roles in various fields, and international cooperation for peace, democracy, and progress."
RELEVANT,"The generated answer is relevant to the question as it specifically mentions the additional activities that Vietnamese representatives participate in, apart from the official activities, which is the main topic of the question."
RELEVANT,The generated answer addresses the question about Man United's plan for the team formation when facing Arsenal in the 36th round. The answer provides a specific detail (the second team) that is directly relevant to the question.
